Transaction_ID,Date,Customer_ID,Product_Category,Product_Name,Price,Quantity,Payment_Status,Price_Clean,Date_Clean,Returned,Complaint_Count,Subject,Message_Body,Complaint_Category,Sentiment
100236,2023-11-24,C0012,Electronics,Smartphone Z,919.20,1,Paid,919.2,2023-11-24,False,0.0,,,None,None
100061,2023-11-17,C0002,Electronics,Laptop X,"1598,23 EUR",1,Paid,1598.23,2023-11-17,False,0.0,,,None,None
101131,2023-12-14,C0008,Smart Home,NordPlug,23.86,1,Paid,23.86,2023-12-14,False,4.0,Refund for my purchase | Battery dies in 2 days | Can't connect the app | NordLock Pro battery drains fast,"I want to return this product.<br>It is not working.<br>I need my money back.<br><br>Sent from my Android device

My order #101131. | My smart lock dies in 48 hours.<br>I changed batteries and it still dies.<br>This is unacceptable.<br>Also: dead battery.<br><br>Sent from my iPhone

My order #101131. | <p>The app cannot connect to the lock.
I tried resetting but it fails.
Please advise.

Sent from my iPhone</p>

Order number: 101131 | <p>My NordLock Pro dies in 2 days.
I changed batteries and it still drains quickly.
I can't rely on this.

Sent from my iPhone</p>

My order #101131.",Battery Issue,Negative
100391,28/11/2023,C0001,Smart Home,NordTherm,$101.68,1,Paid,101.68,2023-11-28,False,0.0,,,None,None
100319,2023-11-27,C0004,Accessories,Phone Case,"35,72 EUR",1,Paid,35.72,2023-11-27,False,0.0,,,None,None
100889,2023-12-09,C0001,Electronics,NoiseCancel Headphones,230.36,1,Paid,230.36,2023-12-09,False,0.0,,,None,None
100105,2023-11-19,C0056,Smart Home,NordCam Mini,"82,40 EUR",1,Paid,82.4,2023-11-19,False,0.0,,,None,None
100603,2023-12-04,C0002,Electronics,Laptop X,"1771,94 EUR",1,Paid,1771.94,2023-12-04,False,0.0,,,None,None
101189,2023-11-28,C0001,Smart Home,NordLock Pro,210.88,1,Paid,210.88,2023-11-28,False,0.0,,,None,None
100563,2023-12-03,C0008,Electronics,Smartphone Z,855.14,1,Paid,855.14,2023-12-03,True,0.0,,,None,None
100366,2023-11-28,C0004,Electronics,Smartphone Z,1024.64,1,Paid,1024.64,2023-11-28,False,0.0,,,None,None
100996,2023-12-12,C0003,Smart Home,NordLock Pro,222.61,1,Paid,222.61,2023-12-12,False,0.0,,,None,None
100043,16/11/2023,C0002,Electronics,TV Pro,$1164.30,1,Paid,1164.3,2023-11-16,False,0.0,,,None,None
100725,2023-12-06,C0003,Accessories,Laptop Sleeve,27.13,2,Paid,27.13,2023-12-06,False,0.0,,,None,None
100456,2023-11-30,C0001,Smart Home,NordTherm,"105,45 EUR",1,Paid,105.45,2023-11-30,False,0.0,,,None,None
100537,2023-12-02,C0030,Electronics,NoiseCancel Headphones,"290,46 EUR",1,Paid,290.46,2023-12-02,False,1.0,Tracking shows no updates,"My delivery is delayed.<br>Tracking shows pending.<br>Where is my order?<br><br>Sent from my Android device

Order number: 100537",Delivery,Neutral
101176,2023-11-24,C0017,Accessories,Phone Case,"34,84 EUR",1,Paid,34.84,2023-11-24,False,0.0,,,None,None
101058,2023-12-13,C0001,Electronics,Laptop X,"1504,82 EUR",1,Paid,1504.82,2023-12-13,False,0.0,,,None,None
100032,2023-11-16,C0094,Electronics,Laptop X,$1585.05,1,Paid,1585.05,2023-11-16,False,0.0,,,None,None
100455,2023-11-30,C0117,Smart Home,NordLock Pro,205.04,2,Paid,205.04,2023-11-30,False,3.0,NordLock Pro battery drains fast | App cannot connect to WiFi | Battery problem with my lock,"My NordLock Pro dies in 48 hours.<br>I changed batteries and it still drains quickly.<br>I can't rely on this.<br><br>Sent from my iPhone

Order number: 100455 | <p>The app will not connect to WiFi.
I tried pairing again but it fails.
Please advise.

Sent from my Android device</p>

Ref: TX-100455 | My NordLock Pro battery drains in a day.
I changed batteries and it still dies.
Please help ASAP.

<br><br>--<br>NordTech Customer

My order #100455.",Battery Issue,Negative
100354,2023-11-28,C0002,Smart Home,NordLock Pro,"201,09 EUR",1,Paid,201.09,2023-11-28,False,0.0,,,None,None
101181,08/12/2023,C0006,Accessories,Accessory Bundle,27.11,1,Paid,27.11,2023-12-08,False,0.0,,,None,None
100062,17/11/2023,C0001,Smart Home,NordLock Pro,221.97,1,Paid,221.97,2023-11-17,False,0.0,,,None,None
100858,09/12/2023,C0001,Electronics,TV Pro,1060.25,1,Failed,1060.25,2023-12-09,False,0.0,,,None,None
101049,2023-12-13,C0001,Electronics,NoiseCancel Headphones,288,1,Paid,288.0,2023-12-13,False,0.0,,,None,None
100686,2023-12-05,C0059,Electronics,Tablet A,753.90,1,Paid,753.9,2023-12-05,False,2.0,NordLock Pro battery drains fast | Battery problem with my lock,"<p>My smart lock dies in 2 days.
I changed batteries and it still drains quickly.
Please help ASAP.
Also: battery dies.

<br><br>--<br>NordTech Customer</p><br><p>Please help!</p>

My order #100686. | <p>My NordLock Pro dies in 2 days.
I changed batteries and it still dies.
This is unacceptable.

<br><br>--<br>NordTech Customer</p>

Order number: 100686",Battery Issue,Negative
100233,24/11/2023,C0278,Electronics,TV Pro,1041.16,1,Paid,1041.16,2023-11-24,False,0.0,,,None,None
100094,2023-11-18,C0076,Accessories,Charger,"28,32 EUR",3,Paid,28.32,2023-11-18,False,0.0,,,None,None
100215,23/11/2023,C0063,Electronics,Smartphone Z,1077.99,1,Paid,1077.99,2023-11-23,False,0.0,,,None,None
100310,2023-11-26,C0002,Electronics,TV Pro,1601.36,1,Paid,1601.36,2023-11-26,False,0.0,,,None,None
100202,2023-11-23,C0002,Smart Home,NordLock Pro,$186.48,1,Pending,186.48,2023-11-23,False,0.0,,,None,None
100290,2023-11-25,C0002,Accessories,Phone Case,12.32,1,Paid,12.32,2023-11-25,False,0.0,,,None,None
100737,2023-12-06,C0015,Electronics,Tablet A,672.16,1,Paid,672.16,2023-12-06,False,0.0,,,None,None
100318,2023-11-27,C0005,Electronics,Smartphone Z,727.66,1,Paid,727.66,2023-11-27,False,0.0,,,None,None
101141,01/12/2023,C0038,Accessories,Accessory Bundle,55.24,3,Paid,55.24,2023-12-01,False,0.0,,,None,None
100891,2023-12-09,C0008,Smart Home,NordLock Pro,"212,31 EUR",2,Paid,212.31,2023-12-09,False,0.0,,,None,None
101188,2023-12-10,C0062,Accessories,Wireless Mouse,32.09,1,Paid,32.09,2023-12-10,False,0.0,,,None,None
100096,2023-11-18,C0001,Electronics,NoiseCancel Headphones,"166,52 EUR",1,Paid,166.52,2023-11-18,False,0.0,,,None,None
100880,2023-12-09,C0001,Smart Home,NordLock Pro,231.50,1,Paid,231.5,2023-12-09,False,0.0,,,None,None
100070,2023-11-17,C0124,Accessories,Accessory Bundle,"86,79 EUR",1,Paid,86.79,2023-11-17,False,1.0,Return request,"<p>I want to return this product.
It is not working.
Please send return instructions.
Also: want a refund.

<p>Thanks</p><p>Customer</p></p><br><p>This is unacceptable.</p>

Order number: 100070",Defect / Refund,Negative
100797,07/12/2023,C0097,Electronics,Tablet A,583.65,1,Paid,583.65,2023-12-07,False,0.0,,,None,None
100721,2023-12-06,C0085,Smart Home,NordLock Pro,"200,26 EUR",1,Paid,200.26,2023-12-06,False,2.0,Product defective | Can't open the door,"<p>The product is defective.
Very disappointed.
Please help.
Also: doesn't work.

Sent from my Android device</p><br><p>Please help!</p>

My order #100721. | I am stuck outside — the lock will not unlock.
The app shows not responding.
I can't get into my house.

<br><br>--<br>NordTech Customer

Order number: 100721",Connectivity,Negative
100796,2023-12-07,C0145,Accessories,Wireless Mouse,"43,57 EUR",1,Paid,43.57,2023-12-07,False,3.0,Tracking shows no updates | Not working as expected | Tracking shows no updates,"<p>My delivery is delayed.
Tracking shows in transit for days.
Where is my order?
Also: delivery late.

Sent from my Android device</p>

My order #100796. | <p>The product is not working.
This should not happen.
What are my options?

<br><br>--<br>NordTech Customer</p>

Order number: 100796 | <p>My delivery is delayed.
Tracking shows in transit for days.
Where is my order?
Also: delivery late.

Sent from my Android device</p>

My order #100796.",Connectivity,Neutral
100353,28/11/2023,C0010,Electronics,NoiseCancel Headphones,"297,95 EUR",1,Failed,297.95,2023-11-28,False,0.0,,,None,None
100352,2023-11-28,C0013,Electronics,Laptop X,1343,1,Paid,1343.0,2023-11-28,False,0.0,,,None,None
100551,02/12/2023,C0200,Electronics,Tablet A,"445,23 EUR",1,Paid,445.23,2023-12-02,False,0.0,,,None,None
100404,2023-11-29,C0017,Smart Home,NordTherm,"83,85 EUR",1,Paid,83.85,2023-11-29,False,0.0,,,None,None
100715,06/12/2023,C0002,Electronics,NoiseCancel Headphones,"330,75 EUR",1,Paid,330.75,2023-12-06,False,0.0,,,None,None
100170,2023-11-22,C0199,Electronics,TV Pro,"1 050,20 EUR",1,Failed,1050.2,2023-11-22,False,0.0,,,None,None
100431,29/11/2023,C0310,Smart Home,NordLock Pro,"193,31 EUR",1,Paid,193.31,2023-11-29,False,0.0,,,None,None
100608,2023-12-04,C0024,Smart Home,NordTherm,"81,21 EUR",1,Paid,81.21,2023-12-04,False,0.0,,,None,None
100648,2023-12-05,C0024,Electronics,Smartphone Z,834.38,1,Paid,834.38,2023-12-05,False,0.0,,,None,None
100623,04/12/2023,C0002,Accessories,Laptop Sleeve,"43,96 EUR",2,Paid,43.96,2023-12-04,False,0.0,,,None,None
100341,2023-11-27,C0006,Electronics,NoiseCancel Headphones,300.70,2,Paid,300.7,2023-11-27,False,0.0,,,None,None
100742,2023-12-07,C0001,Accessories,USB-C Cable,"10,69 EUR",4,Paid,10.69,2023-12-07,False,0.0,,,None,None
100873,2023-12-09,C0004,Electronics,Smartphone Z,"863,18 EUR",1,Paid,863.18,2023-12-09,False,0.0,,,None,None
100078,18/11/2023,C0007,Electronics,Tablet A,"527,12 EUR",1,Paid,527.12,2023-11-18,False,0.0,,,None,None
101143,2023-12-10,C0001,Electronics,TV Pro,"970,60 EUR",1,Paid,970.6,2023-12-10,False,0.0,,,None,None
100910,10/12/2023,C0006,Smart Home,NordLock Pro,181.92,1,Failed,181.92,2023-12-10,False,0.0,,,None,None
100432,2023-11-29,C0006,Smart Home,NordLock Pro,187.29,1,Failed,187.29,2023-11-29,False,0.0,,,None,None
100272,25/11/2023,C0003,Electronics,TV Pro,1118.62,1,Paid,1118.62,2023-11-25,False,0.0,,,None,None
100081,18/11/2023,C0091,Electronics,Tablet A,372.51,1,Paid,372.51,2023-11-18,False,0.0,,,None,None
100280,2023-11-25,C0002,Accessories,Charger,"39,36 EUR",1,Paid,39.36,2023-11-25,False,0.0,,,None,None
100837,08/12/2023,C0006,Electronics,Tablet A,"702,29 EUR",1,Paid,702.29,2023-12-08,False,0.0,,,None,None
100506,2023-12-01,C0057,Accessories,Screen Protector,7.12,1,Paid,7.12,2023-12-01,False,1.0,Product defective,"The product is broken.<br>Poor quality.<br>What are my options?<br><br><br><br>--<br>NordTech Customer

My order #100506.",Defect / Refund,Neutral
100364,2023-11-28,C0003,Electronics,TV Pro,$1094.93,1,Paid,1094.93,2023-11-28,False,0.0,,,None,None
101173,2023-12-07,C0002,Electronics,Tablet A,$636.80,1,Paid,636.8,2023-12-07,False,0.0,,,None,None
100612,2023-12-04,C0052,Accessories,Charger,"35,09 EUR",3,Pending,35.09,2023-12-04,False,0.0,,,None,None
100040,2023-11-16,C0238,Electronics,Laptop X,1653.40,1,Paid,1653.4,2023-11-16,False,0.0,,,None,None
101085,2023-12-13,C0038,Smart Home,NordCam Mini,"91,86 EUR",2,Paid,91.86,2023-12-13,False,0.0,,,None,None
100412,29/11/2023,C0053,Electronics,TV Pro,1261.41,1,Paid,1261.41,2023-11-29,False,0.0,,,None,None
100278,25/11/2023,C0181,Smart Home,NordLock Pro,"247,91 EUR",1,Paid,247.91,2023-11-25,False,0.0,,,None,None
101101,2023-12-14,C0004,Smart Home,NordLock Pro,211.15,1,Paid,211.15,2023-12-14,False,2.0,Can't open the door | Battery problem with my lock,"<p>I am stuck outside — the lock does not respond.
The app shows offline.
I need immediate assistance.

—
Regards,
A very unhappy customer</p><br><p>Please help!</p>

My order #101101. | My NordLock Pro dies in a day.<br>I changed batteries and it still drains quickly.<br>Please help ASAP.<br>Also: battery drains.<br><br>Sent from my iPhone

Order number: 101101",Battery Issue,Negative
100565,2023-12-03,C0005,Smart Home,NordLock Pro,185,1,Paid,185.0,2023-12-03,False,0.0,,,None,None
100827,2023-12-08,C0013,Electronics,Tablet A,$665.07,1,Paid,665.07,2023-12-08,True,0.0,,,None,None
100561,03/12/2023,C0002,Electronics,Tablet A,"771,78 EUR",1,Paid,771.78,2023-12-03,False,0.0,,,None,None
101183,21/11/2023,C0170,Accessories,Charger,30.35,2,Paid,30.35,2023-11-21,False,0.0,,,None,None
100426,2023-11-29,C0031,Accessories,Screen Protector,$8.99,2,Failed,8.99,2023-11-29,False,0.0,,,None,None
100345,2023-11-27,C0250,Electronics,TV Pro,1536.64,1,Paid,1536.64,2023-11-27,False,0.0,,,None,None
100998,12/12/2023,C0001,Accessories,Laptop Sleeve,"23,36 EUR",1,Failed,23.36,2023-12-12,False,0.0,,,None,None
101047,2023-12-13,C0023,Electronics,Tablet A,441.24,1,Paid,441.24,2023-12-13,False,1.0,Product defective,"<p>The product is not working.
Poor quality.
What are my options?
Also: defective.

Sent from my Android device</p><br><p>This is unacceptable.</p>

Order number: 101047",Defect / Refund,Negative
100471,2023-11-30,C0019,Smart Home,NordLock Pro,$180.99,1,Paid,180.99,2023-11-30,False,0.0,,,None,None
100303,2023-11-26,C0003,Smart Home,NordLock Pro,224.82,1,Paid,224.82,2023-11-26,False,0.0,,,None,None
101002,12/12/2023,C0008,Electronics,Tablet A,318.91,1,Paid,318.91,2023-12-12,False,0.0,,,None,None
100570,2023-12-03,C0001,Accessories,Laptop Sleeve,"19,23 EUR",1,Paid,19.23,2023-12-03,False,0.0,,,None,None
100058,2023-11-17,C0031,Electronics,TV Pro,"914,97 EUR",1,Paid,914.97,2023-11-17,False,0.0,,,None,None
100395,2023-11-29,C0169,Electronics,NoiseCancel Headphones,"180,76 EUR",1,Paid,180.76,2023-11-29,False,1.0,Where is my order?,"<p>My delivery is stuck.
Tracking shows pending.
This is taking too long.
Also: tracking.

<br><br>--<br>NordTech Customer</p><br><p>ASAP</p>

Ref: TX-100395",Delivery,Negative
100093,2023-11-18,C0004,Electronics,Smartphone Z,894.13,1,Paid,894.13,2023-11-18,False,0.0,,,None,None
100798,2023-12-08,C0004,Accessories,Laptop Sleeve,41.56,1,Paid,41.56,2023-12-08,False,0.0,,,None,None
100573,2023-12-03,C0008,Electronics,Laptop X,1597.38,1,Paid,1597.38,2023-12-03,False,0.0,,,None,None
100484,2023-12-01,C0137,Smart Home,NordCam Mini,80,1,Paid,80.0,2023-12-01,False,1.0,Where is my order?,"My delivery is late.<br>Tracking shows in transit for days.<br>Where is my order?<br><br>Sent from my iPhone

Ref: TX-100484",Delivery,Neutral
100261,2023-11-25,C0010,Electronics,NoiseCancel Headphones,258.75,1,Paid,258.75,2023-11-25,True,2.0,Tracking shows no updates | Very disappointed,"<p>My delivery is stuck.
Tracking shows no updates.
Where is my order?

Sent from my Android device</p>

Order number: 100261 | The product is not working.
Very disappointed.
Please help.

Sent from my Android device

Order number: 100261",Connectivity,Negative
100084,2023-11-18,C0001,Accessories,Wireless Mouse,"56,31 EUR",1,Paid,56.31,2023-11-18,False,0.0,,,None,None
100592,2023-12-03,C0024,Smart Home,NordLock Pro,"189,75 EUR",1,Paid,189.75,2023-12-03,False,0.0,,,None,None
100003,2023-11-15,C0059,Electronics,Laptop X,1446.04,1,Paid,1446.04,2023-11-15,False,0.0,,,None,None
100042,2023-11-16,C0002,Accessories,Charger,"18,80 EUR",3,Paid,18.8,2023-11-16,False,0.0,,,None,None
100327,2023-11-27,C0002,Electronics,Laptop X,$1437.50,1,Paid,1437.5,2023-11-27,False,0.0,,,None,None
100087,18/11/2023,C0002,Accessories,Accessory Bundle,32.79,1,Paid,32.79,2023-11-18,False,0.0,,,None,None
100457,30/11/2023,C0010,Accessories,Screen Protector,5,1,Paid,5.0,2023-11-30,False,0.0,,,None,None
100965,2023-12-11,C0279,Accessories,Screen Protector,"12,26 EUR",1,Paid,12.26,2023-12-11,False,1.0,Where is my order?,"My delivery is late.
Tracking shows in transit for days.
Please update me.
Also: tracking.

Sent from my Android device

My order #100965.",Delivery,Neutral
101028,2023-12-12,C0044,Accessories,Wireless Mouse,"31,71 EUR",1,Paid,31.71,2023-12-12,False,1.0,NordLock Pro pairing issue,"The app will not connect to WiFi.
I tried reinstalling the app but it fails.
It worked once and then stopped.
Also: bluetooth.

<br><br>--<br>NordTech Customer

My order #101028.",Connectivity,Neutral
100731,06/12/2023,C0002,Electronics,TV Pro,"1405,31 EUR",2,Paid,1405.31,2023-12-06,False,0.0,,,None,None
100852,09/12/2023,C0113,Accessories,USB-C Cable,"18,62 EUR",2,Paid,18.62,2023-12-09,False,0.0,,,None,None
100916,2023-12-10,C0003,Electronics,Laptop X,"1608,63 EUR",1,Paid,1608.63,2023-12-10,False,0.0,,,None,None
101071,2023-12-13,C0013,Accessories,Wireless Mouse,26.47,2,Paid,26.47,2023-12-13,False,1.0,NordLock Pro won't unlock,"<p>I am stuck outside — the lock will not unlock.
The app shows offline.
I need immediate assistance.
Also: locked out.

—
Regards,
A very unhappy customer</p><br><p>ASAP</p>

Order number: 101071",Connectivity,Negative
101160,2023-11-25,C0004,Accessories,Phone Case,"19,93 EUR",2,Paid,19.93,2023-11-25,False,0.0,,,None,None
100108,19/11/2023,C0008,Smart Home,NordPlug,$24.89,1,Paid,24.89,2023-11-19,False,0.0,,,None,None
100690,2023-12-06,C0003,Smart Home,NordLock Pro,$192.91,1,Paid,192.91,2023-12-06,False,0.0,,,None,None
100986,2023-12-11,C0178,Accessories,Charger,45.19,4,Paid,45.19,2023-12-11,False,1.0,Where is my order?,"My delivery is delayed.
Tracking shows no updates.
This is taking too long.

—
Regards,
A very unhappy customer

Order number: 100986",Connectivity,Negative
100747,07/12/2023,C0006,Accessories,Screen Protector,$11.32,4,Paid,11.32,2023-12-07,False,0.0,,,None,None
101059,2023-12-13,C0002,Smart Home,NordLock Pro,202.54,1,Paid,202.54,2023-12-13,False,0.0,,,None,None
101184,2023-11-28,C0001,Smart Home,NordLock Pro,210.88,1,Paid,210.88,2023-11-28,False,0.0,,,None,None
100165,22/11/2023,C0001,Electronics,Smartphone Z,$771.06,1,Paid,771.06,2023-11-22,False,0.0,,,None,None
100779,2023-12-07,C0001,Electronics,TV Pro,916.41,1,Paid,916.41,2023-12-07,False,0.0,,,None,None
100039,2023-11-16,C0003,Accessories,Accessory Bundle,"91,93 EUR",2,Paid,91.93,2023-11-16,False,0.0,,,None,None
100149,2023-11-21,C0001,Electronics,Tablet A,"475,44 EUR",1,Paid,475.44,2023-11-21,False,0.0,,,None,None
100068,17/11/2023,C0004,Accessories,Accessory Bundle,84.63,2,Paid,84.63,2023-11-17,False,0.0,,,None,None
100260,2023-11-25,C0003,Electronics,Smartphone Z,"706,61 EUR",2,Paid,706.61,2023-11-25,False,0.0,,,None,None
100558,03/12/2023,C0008,Electronics,Tablet A,$356.42,1,Paid,356.42,2023-12-03,False,0.0,,,None,None
100184,22/11/2023,C0028,Smart Home,NordLock Pro,"210,27 EUR",2,Paid,210.27,2023-11-22,False,0.0,,,None,None
101079,13/12/2023,C0003,Accessories,Charger,"40,81 EUR",1,Paid,40.81,2023-12-13,False,0.0,,,None,None
101094,2023-12-14,C0030,Electronics,Laptop X,"1326,30 EUR",2,Paid,1326.3,2023-12-14,False,3.0,Very disappointed | Can't connect the app | NordLock Pro battery drains fast,"The product is not working.
Poor quality.
What are my options?
Also: poor quality.

—
Regards,
A very unhappy customer

Order number: 101094 | The app will not connect to WiFi.<br>I tried reinstalling the app but it fails.<br>Please advise.<br><br><p>Thanks</p><p>Customer</p>

Order number: 101094 | My smart lock dies in a day.
I changed batteries and it still dies.
This is unacceptable.

Sent from my iPhone

Order number: 101094",Battery Issue,Negative
100944,2023-12-11,C0289,Electronics,NoiseCancel Headphones,157.39,1,Paid,157.39,2023-12-11,False,0.0,,,None,None
100054,2023-11-17,C0011,Electronics,Laptop X,"1 798,82 EUR",1,Paid,1798.82,2023-11-17,False,0.0,,,None,None
100617,2023-12-04,C0002,Electronics,Tablet A,$351.21,1,Paid,351.21,2023-12-04,False,0.0,,,None,None
100136,20/11/2023,C0256,Smart Home,NordTherm,85,2,Paid,85.0,2023-11-20,False,0.0,,,None,None
100974,2023-12-11,C0031,Accessories,Accessory Bundle,68.13,3,Paid,68.13,2023-12-11,False,2.0,Battery dies in 2 days | Return request,"My NordLock Pro battery drains in a day.<br>I changed batteries and it still drains quickly.<br>This is unacceptable.<br>Also: battery dies.<br><br>—<br>Regards,<br>A very unhappy customer

My order #100974. | <p>I want to return this product.
It is not working.
Please send return instructions.

Sent from my Android device</p>

My order #100974.",Battery Issue,Negative
100955,2023-12-11,C0002,Accessories,Screen Protector,"5,43 EUR",1,Paid,5.43,2023-12-11,False,0.0,,,None,None
100221,2023-11-24,C0001,Electronics,TV Pro,"1 386,66 EUR",1,Paid,1386.66,2023-11-24,False,0.0,,,None,None
101060,2023-12-13,C0001,Electronics,TV Pro,1293.65,1,Paid,1293.65,2023-12-13,False,0.0,,,None,None
100726,2023-12-06,C0001,Electronics,NoiseCancel Headphones,$302.52,1,Paid,302.52,2023-12-06,False,0.0,,,None,None
101151,2023-12-11,C0007,Accessories,Accessory Bundle,"44,45 EUR",1,Paid,44.45,2023-12-11,False,0.0,,,None,None
100861,2023-12-09,C0046,Smart Home,NordLock Pro,201,1,Paid,201.0,2023-12-09,False,2.0,Very disappointed | Battery problem with my lock,"<p>The product is defective.
This should not happen.
Please help.

—
Regards,
A very unhappy customer</p>

My order #100861. | My smart lock battery drains in a day.<br>I changed batteries and it still dies.<br>Please help ASAP.<br><br>Sent from my iPhone

Order number: 100861",Battery Issue,Negative
100329,2023-11-27,C0001,Accessories,Phone Case,"12,21 EUR",2,Paid,12.21,2023-11-27,False,0.0,,,None,None
100835,08/12/2023,C0023,Electronics,Laptop X,"1 517,20 EUR",1,Paid,1517.2,2023-12-08,False,0.0,,,None,None
100312,26/11/2023,C0148,Electronics,Laptop X,$1691.90,1,Paid,1691.9,2023-11-26,False,0.0,,,None,None
100377,2023-11-28,C0009,Accessories,USB-C Cable,"19,51 EUR",1,Paid,19.51,2023-11-28,False,0.0,,,None,None
100639,04/12/2023,C0042,Smart Home,NordLock Pro,"223,67 EUR",2,Paid,223.67,2023-12-04,False,0.0,,,None,None
101098,2023-12-14,C0001,Accessories,Charger,"22,04 EUR",1,Paid,22.04,2023-12-14,False,0.0,,,None,None
100173,22/11/2023,C0008,Electronics,Smartphone Z,"1043,81 EUR",1,Paid,1043.81,2023-11-22,False,0.0,,,None,None
100883,2023-12-09,C0002,Electronics,Laptop X,1389.38,1,Paid,1389.38,2023-12-09,False,0.0,,,None,None
100560,03/12/2023,C0196,Electronics,Smartphone Z,$840.55,1,Paid,840.55,2023-12-03,False,0.0,,,None,None
100289,2023-11-25,C0005,Smart Home,NordLock Pro,249.63,2,Paid,249.63,2023-11-25,False,0.0,,,None,None
100294,25/11/2023,C0002,Accessories,USB-C Cable,13.57,2,Paid,13.57,2023-11-25,False,0.0,,,None,None
100435,2023-11-29,C0008,Accessories,Screen Protector,8.41,3,Paid,8.41,2023-11-29,False,0.0,,,None,None
101154,2023-12-11,C0015,Smart Home,NordLock Pro,"241,95 EUR",1,Paid,241.95,2023-12-11,False,0.0,,,None,None
100666,05/12/2023,C0001,Accessories,Laptop Sleeve,22.57,4,Paid,22.57,2023-12-05,False,0.0,,,None,None
100270,25/11/2023,C0031,Accessories,Laptop Sleeve,$17.02,2,Paid,17.02,2023-11-25,False,0.0,,,None,None
101087,2023-12-14,C0009,Electronics,Tablet A,484.26,1,Paid,484.26,2023-12-14,False,0.0,,,None,None
100321,2023-11-27,C0004,Accessories,Accessory Bundle,"51,76 EUR",1,Paid,51.76,2023-11-27,False,0.0,,,None,None
100462,2023-11-30,C0009,Electronics,Laptop X,"1389,57 EUR",1,Paid,1389.57,2023-11-30,False,0.0,,,None,None
100370,2023-11-28,C0217,Accessories,USB-C Cable,"19,89 EUR",2,Failed,19.89,2023-11-28,False,0.0,,,None,None
100218,2023-11-23,C0004,Electronics,Smartphone Z,"989,29 EUR",2,Paid,989.29,2023-11-23,False,0.0,,,None,None
100083,18/11/2023,C0002,Smart Home,NordLock Pro,215,1,Paid,215.0,2023-11-18,False,0.0,,,None,None
100273,2023-11-25,C0002,Electronics,Laptop X,"1374,89 EUR",1,Paid,1374.89,2023-11-25,False,0.0,,,None,None
100637,2023-12-04,C0003,Electronics,Smartphone Z,713,1,Paid,713.0,2023-12-04,False,0.0,,,None,None
101103,2023-12-14,C0103,Accessories,Accessory Bundle,63.95,1,Paid,63.95,2023-12-14,False,2.0,Very disappointed | NordLock Pro pairing issue,"The product is not working.<br>Poor quality.<br>What are my options?<br><br>—<br>Regards,<br>A very unhappy customer

Order number: 101103 | The app will not connect to WiFi.<br>I tried reinstalling the app but it fails.<br>It worked once and then stopped.<br><br><br><br>--<br>NordTech Customer

My order #101103.",Connectivity,Negative
100178,2023-11-22,C0025,Electronics,NoiseCancel Headphones,"252,35 EUR",1,Paid,252.35,2023-11-22,False,0.0,,,None,None
100593,2023-12-03,C0297,Accessories,Laptop Sleeve,27.83,1,Paid,27.83,2023-12-03,False,0.0,,,None,None
100410,2023-11-29,C0026,Accessories,Accessory Bundle,"35,78 EUR",1,Pending,35.78,2023-11-29,False,0.0,,,None,None
100401,2023-11-29,C0017,Accessories,Phone Case,10,1,Paid,10.0,2023-11-29,False,0.0,,,None,None
100438,2023-11-30,C0010,Accessories,Charger,$20.58,1,Paid,20.58,2023-11-30,False,0.0,,,None,None
100600,04/12/2023,C0043,Accessories,Phone Case,"32,88 EUR",1,Paid,32.88,2023-12-04,False,0.0,,,None,None
100753,2023-12-07,C0040,Electronics,Tablet A,"436,32 EUR",1,Paid,436.32,2023-12-07,False,1.0,Battery dies in 2 days,"My smart lock battery drains in a day.
I changed batteries and it still dies.
I can't rely on this.
Also: 2 days.

Sent from my Android device

Ref: TX-100753",Battery Issue,Neutral
100765,2023-12-07,C0080,Electronics,Laptop X,"1361,87 EUR",1,Paid,1361.87,2023-12-07,False,0.0,,,None,None
100782,2023-12-07,C0001,Smart Home,NordLock Pro,201,2,Paid,201.0,2023-12-07,False,0.0,,,None,None
101064,13/12/2023,C0002,Accessories,Phone Case,16.39,3,Paid,16.39,2023-12-13,False,0.0,,,None,None
100477,30/11/2023,C0001,Smart Home,NordLock Pro,$195.76,1,Pending,195.76,2023-11-30,False,0.0,,,None,None
100936,2023-12-11,C0151,Electronics,TV Pro,"1641,80 EUR",1,Paid,1641.8,2023-12-11,False,2.0,Tracking shows no updates | Battery dies in 2 days,"My delivery is delayed.<br>Tracking shows pending.<br>Where is my order?<br><br>Sent from my Android device

My order #100936. | <p>My smart lock dies in 2 days.
I tried new batteries and it still dies.
Please help ASAP.

Sent from my iPhone</p><br><p>ASAP</p>

My order #100936.",Battery Issue,Negative
100489,2023-12-01,C0015,Electronics,Tablet A,559,2,Paid,559.0,2023-12-01,False,0.0,,,None,None
100238,2023-11-24,C0270,Accessories,USB-C Cable,17,1,Paid,17.0,2023-11-24,False,0.0,,,None,None
100026,16/11/2023,C0091,Electronics,NoiseCancel Headphones,"192,39 EUR",1,Paid,192.39,2023-11-16,False,0.0,,,None,None
100244,2023-11-24,C0002,Electronics,NoiseCancel Headphones,229.51,1,Paid,229.51,2023-11-24,False,0.0,,,None,None
100828,2023-12-08,C0001,Accessories,Screen Protector,"13,81 EUR",2,Paid,13.81,2023-12-08,False,0.0,,,None,None
100976,2023-12-11,C0008,Electronics,Tablet A,"365,96 EUR",1,Paid,365.96,2023-12-11,False,1.0,Battery problem with my lock,"My smart lock dies in 48 hours.
I tried new batteries and it still dies.
This is unacceptable.

Sent from my iPhone

Ref: TX-100976",Battery Issue,Negative
100427,2023-11-29,C0001,Electronics,TV Pro,"1187,16 EUR",1,Paid,1187.16,2023-11-29,False,0.0,,,None,None
100023,16/11/2023,C0016,Accessories,Accessory Bundle,30.78,1,Paid,30.78,2023-11-16,False,0.0,,,None,None
100256,2023-11-24,C0002,Smart Home,NordLock Pro,$235.74,1,Paid,235.74,2023-11-24,False,0.0,,,None,None
100293,2023-11-25,C0001,Accessories,Charger,$40.76,1,Paid,40.76,2023-11-25,False,0.0,,,None,None
100811,2023-12-08,C0008,Electronics,NoiseCancel Headphones,"161,34 EUR",1,Paid,161.34,2023-12-08,False,0.0,,,None,None
100295,2023-11-25,C0001,Electronics,Smartphone Z,"789,49 EUR",1,Paid,789.49,2023-11-25,False,0.0,,,None,None
100785,2023-12-07,C0034,Electronics,Smartphone Z,"1072,68 EUR",1,Paid,1072.68,2023-12-07,False,0.0,,,None,None
100122,2023-11-20,C0113,Accessories,Phone Case,33.56,1,Paid,33.56,2023-11-20,False,1.0,Battery problem with my lock,"<p>My smart lock dies in 2 days.
I changed batteries and it still dies.
This is unacceptable.

—
Regards,
A very unhappy customer</p>

My order #100122.",Battery Issue,Negative
100807,2023-12-08,C0007,Accessories,USB-C Cable,"12,72 EUR",1,Paid,12.72,2023-12-08,False,0.0,,,None,None
100953,2023-12-11,C0015,Smart Home,NordLock Pro,"241,95 EUR",1,Paid,241.95,2023-12-11,False,0.0,,,None,None
101084,2023-12-13,C0225,Accessories,Laptop Sleeve,$20.38,2,Paid,20.38,2023-12-13,False,0.0,,,None,None
100317,2023-11-27,C0001,Electronics,Smartphone Z,"724,77 EUR",1,Paid,724.77,2023-11-27,False,0.0,,,None,None
100679,05/12/2023,C0001,Smart Home,NordLock Pro,197.29,1,Pending,197.29,2023-12-05,False,0.0,,,None,None
100503,2023-12-01,C0122,Smart Home,NordLock Pro,207.18,1,Paid,207.18,2023-12-01,False,6.0,I want a refund | Battery problem with my lock | Refund for my purchase | Tracking shows no updates | App cannot connect to WiFi | NordLock Pro pairing issue,"I want to get a refund for this product.<br>It is not as described.<br>Please send return instructions.<br><br>Sent from my iPhone

Order number: 100503 | My smart lock battery drains in 2 days.
I changed batteries and it still dies.
Please help ASAP.
Also: battery life.

—
Regards,
A very unhappy customer

Order number: 100503 | <p>I want to get a refund for this product.
It is not as described.
How do I start an RMA?

Sent from my Android device</p>

Order number: 100503 | My delivery is stuck.
Tracking shows no updates.
Where is my order?

—
Regards,
A very unhappy customer

My order #100503. | The app will not connect to the lock.
I tried pairing again but it fails.
It worked once and then stopped.

—
Regards,
A very unhappy customer

Ref: TX-100503 | <p>The app will not connect to WiFi.
I tried resetting but it fails.
Please advise.

Sent from my iPhone</p>

Order number: 100503",Battery Issue,Negative
100190,2023-11-22,C0215,Electronics,Smartphone Z,"846,71 EUR",2,Paid,846.71,2023-11-22,False,0.0,,,None,None
100763,07/12/2023,C0001,Accessories,USB-C Cable,"16,94 EUR",1,Paid,16.94,2023-12-07,False,0.0,,,None,None
100171,2023-11-22,C0090,Accessories,Charger,$28.87,4,Paid,28.87,2023-11-22,False,1.0,NordLock Pro battery drains fast,"<p>My NordLock Pro dies in 48 hours.
I tried new batteries and it still drains quickly.
Please help ASAP.

<br><br>--<br>NordTech Customer</p><br><p>This is unacceptable.</p>

Ref: TX-100171",Battery Issue,Negative
100155,21/11/2023,C0003,Electronics,TV Pro,"1019,81 EUR",1,Paid,1019.81,2023-11-21,False,0.0,,,None,None
100177,22/11/2023,C0002,Electronics,NoiseCancel Headphones,309,1,Paid,309.0,2023-11-22,False,0.0,,,None,None
100350,2023-11-27,C0038,Accessories,Charger,$34.12,2,Paid,34.12,2023-11-27,False,1.0,App cannot connect to WiFi,"<p>The app cannot connect to the lock.
I tried reinstalling the app but it fails.
Please advise.

<p>Thanks</p><p>Customer</p></p>

My order #100350.",Connectivity,Neutral
100991,2023-12-12,C0107,Electronics,Tablet A,$427.39,1,Failed,427.39,2023-12-12,False,0.0,,,None,None
101066,2023-12-13,C0007,Electronics,NoiseCancel Headphones,258.62,1,Pending,258.62,2023-12-13,False,0.0,,,None,None
100583,2023-12-03,C0001,Electronics,TV Pro,"1181,73 EUR",1,Paid,1181.73,2023-12-03,False,0.0,,,None,None
101191,2023-11-15,C0002,Electronics,Tablet A,"488,25 EUR",1,Paid,488.25,2023-11-15,False,0.0,,,None,None
101035,2023-12-12,C0001,Smart Home,NordLock Pro,"195,28 EUR",2,Paid,195.28,2023-12-12,False,1.0,Tracking shows no updates,"<p>My delivery is delayed.
Tracking shows no updates.
Where is my order?

<p>Thanks</p><p>Customer</p></p><br><p>This is unacceptable.</p>

Order number: 101035",Delivery,Negative
100578,2023-12-03,C0012,Accessories,Wireless Mouse,"51,21 EUR",1,Pending,51.21,2023-12-03,False,0.0,,,None,None
101031,12/12/2023,C0020,Smart Home,NordLock Pro,"205,55 EUR",1,Paid,205.55,2023-12-12,False,0.0,,,None,None
100524,2023-12-02,C0104,Accessories,Wireless Mouse,"18,15 EUR",1,Paid,18.15,2023-12-02,False,0.0,,,None,None
100777,2023-12-07,C0206,Accessories,Phone Case,"16,43 EUR",1,Paid,16.43,2023-12-07,False,0.0,,,None,None
101175,2023-12-07,C0004,Electronics,Smartphone Z,"893,14 EUR",1,Paid,893.14,2023-12-07,False,0.0,,,None,None
100607,2023-12-04,C0054,Electronics,Laptop X,1698.65,1,Paid,1698.65,2023-12-04,False,1.0,Return request,"I want to get a refund for this product.<br>It is not as described.<br>I need my money back.<br>Also: money back.<br><br>Sent from my iPhone

My order #100607.",Defect / Refund,Negative
100983,2023-12-11,C0038,Accessories,Laptop Sleeve,"38,52 EUR",2,Paid,38.52,2023-12-11,False,0.0,,,None,None
100562,03/12/2023,C0142,Accessories,USB-C Cable,"17,33 EUR",1,Paid,17.33,2023-12-03,False,0.0,,,None,None
100842,2023-12-08,C0007,Electronics,Laptop X,"1714,94 EUR",1,Paid,1714.94,2023-12-08,True,0.0,,,None,None
101187,2023-11-29,C0017,Smart Home,NordTherm,"83,85 EUR",1,Paid,83.85,2023-11-29,False,0.0,,,None,None
100630,2023-12-04,C0069,Accessories,Wireless Mouse,13.89,1,Paid,13.89,2023-12-04,False,1.0,App cannot connect to WiFi,"<p>The app will not connect to the lock.
I tried reinstalling the app but it fails.
Is there a fix?
Also: app won't connect.

—
Regards,
A very unhappy customer</p>

Order number: 100630",Connectivity,Negative
100898,2023-12-10,C0001,Smart Home,NordLock Pro,"241,97 EUR",1,Paid,241.97,2023-12-10,False,0.0,,,None,None
100067,2023-11-17,C0003,Accessories,Wireless Mouse,56.08,1,Paid,56.08,2023-11-17,True,0.0,,,None,None
100714,06/12/2023,C0001,Accessories,Screen Protector,12.92,1,Paid,12.92,2023-12-06,False,0.0,,,None,None
100182,2023-11-22,C0001,Electronics,TV Pro,$1046.88,1,Failed,1046.88,2023-11-22,False,0.0,,,None,None
100958,2023-12-11,C0001,Accessories,Charger,43,3,Paid,43.0,2023-12-11,False,0.0,,,None,None
100696,2023-12-06,C0135,Smart Home,NordLock Pro,225,2,Paid,225.0,2023-12-06,False,3.0,Where is my order? | Not working as expected | Not working as expected,"My delivery is late.
Tracking shows in transit for days.
Where is my order?

—
Regards,
A very unhappy customer

My order #100696. | <p>The product is not working.
Poor quality.
I want a replacement.

<p>Thanks</p><p>Customer</p></p><br><p>Please help!</p>

My order #100696. | <p>The product is defective.
This should not happen.
I want a replacement.
Also: defective.

Sent from my iPhone</p>

My order #100696.",Connectivity,Negative
100334,2023-11-27,C0005,Electronics,Tablet A,322.05,1,Paid,322.05,2023-11-27,False,0.0,,,None,None
100938,11/12/2023,C0014,Electronics,Smartphone Z,"782,74 EUR",1,Failed,782.74,2023-12-11,False,0.0,,,None,None
100733,2023-12-06,C0050,Accessories,Charger,48.23,3,Paid,48.23,2023-12-06,False,0.0,,,None,None
100913,2023-12-10,C0001,Accessories,Wireless Mouse,"19,15 EUR",1,Paid,19.15,2023-12-10,False,1.0,Battery dies in 2 days,"<p>My smart lock battery drains in a day.
I changed batteries and it still dies.
Please help ASAP.
Also: dead battery.

Sent from my Android device</p>

Ref: TX-100913",Battery Issue,Negative
100644,2023-12-04,C0301,Accessories,USB-C Cable,"9,53 EUR",2,Paid,9.53,2023-12-04,False,3.0,App cannot connect to WiFi | Can't open the door | Battery problem with my lock,"The app cannot connect to the lock.<br>I tried reinstalling the app but it fails.<br>It worked once and then stopped.<br><br>Sent from my Android device

Ref: TX-100644 | <p>I am stuck outside — the lock does not respond.
The app shows not responding.
I need immediate assistance.

—
Regards,
A very unhappy customer</p>

Ref: TX-100644 | My smart lock dies in a day.
I changed batteries and it still drains quickly.
This is unacceptable.

<br><br>--<br>NordTech Customer

My order #100644.",Battery Issue,Negative
100541,2023-12-02,C0020,Accessories,Wireless Mouse,"58,32 EUR",1,Paid,58.32,2023-12-02,False,0.0,,,None,None
100621,04/12/2023,C0003,Electronics,Laptop X,"1 776,33 EUR",1,Paid,1776.33,2023-12-04,False,0.0,,,None,None
100577,2023-12-03,C0002,Smart Home,NordLock Pro,$213.50,2,Paid,213.5,2023-12-03,True,0.0,,,None,None
100045,2023-11-17,C0115,Electronics,TV Pro,1532.19,1,Paid,1532.19,2023-11-17,False,0.0,,,None,None
100080,18/11/2023,C0002,Accessories,Accessory Bundle,"35,86 EUR",2,Paid,35.86,2023-11-18,False,0.0,,,None,None
100911,2023-12-10,C0003,Electronics,NoiseCancel Headphones,254.21,1,Paid,254.21,2023-12-10,False,0.0,,,None,None
100820,2023-12-08,C0001,Accessories,Accessory Bundle,61.58,3,Failed,61.58,2023-12-08,False,0.0,,,None,None
100990,2023-12-12,C0157,Electronics,NoiseCancel Headphones,"328,41 EUR",2,Paid,328.41,2023-12-12,False,1.0,Delivery delay,"<p>My delivery is delayed.
Tracking shows no updates.
Please update me.
Also: still not received.

<p>Thanks</p><p>Customer</p></p>

Ref: TX-100990",Delivery,Neutral
100634,04/12/2023,C0002,Electronics,Smartphone Z,"810,82 EUR",1,Paid,810.82,2023-12-04,False,0.0,,,None,None
100118,2023-11-19,C0068,Accessories,Laptop Sleeve,38,1,Paid,38.0,2023-11-19,False,0.0,,,None,None
100906,10/12/2023,C0048,Electronics,NoiseCancel Headphones,$158.01,1,Paid,158.01,2023-12-10,False,0.0,,,None,None
100332,2023-11-27,C0002,Electronics,Laptop X,1608.06,1,Paid,1608.06,2023-11-27,False,0.0,,,None,None
101117,2023-12-14,C0018,Accessories,Charger,27,2,Paid,27.0,2023-12-14,False,0.0,,,None,None
100755,2023-12-07,C0003,Accessories,Accessory Bundle,76.30,2,Paid,76.3,2023-12-07,False,0.0,,,None,None
100483,2023-12-01,C0001,Smart Home,NordLock Pro,"216,17 EUR",1,Paid,216.17,2023-12-01,False,0.0,,,None,None
100047,2023-11-17,C0006,Smart Home,NordLock Pro,208.67,1,Paid,208.67,2023-11-17,False,0.0,,,None,None
100605,2023-12-04,C0013,Smart Home,NordTherm,"142,49 EUR",1,Paid,142.49,2023-12-04,False,0.0,,,None,None
100124,2023-11-20,C0004,Electronics,NoiseCancel Headphones,"233,73 EUR",1,Paid,233.73,2023-11-20,False,0.0,,,None,None
100240,2023-11-24,C0018,Accessories,USB-C Cable,"13,43 EUR",2,Paid,13.43,2023-11-24,False,1.0,Where is my order?,"My delivery is stuck.
Tracking shows pending.
This is taking too long.

<br><br>--<br>NordTech Customer

Order number: 100240",Delivery,Negative
100027,16/11/2023,C0004,Electronics,NoiseCancel Headphones,170.89,1,Paid,170.89,2023-11-16,False,0.0,,,None,None
101168,28/11/2023,C0004,Smart Home,NordLock Pro,"246,71 EUR",1,Paid,246.71,2023-11-28,False,0.0,,,None,None
100057,2023-11-17,C0061,Electronics,TV Pro,1046.02,1,Paid,1046.02,2023-11-17,False,0.0,,,None,None
101072,2023-12-13,C0001,Smart Home,NordLock Pro,212.32,1,Paid,212.32,2023-12-13,False,0.0,,,None,None
100709,2023-12-06,C0001,Accessories,Wireless Mouse,54.54,3,Paid,54.54,2023-12-06,False,0.0,,,None,None
101045,2023-12-13,C0027,Smart Home,NordPlug,"32,53 EUR",2,Paid,32.53,2023-12-13,False,0.0,,,None,None
100379,2023-11-28,C0001,Accessories,Accessory Bundle,67.03,2,Paid,67.03,2023-11-28,False,0.0,,,None,None
100316,2023-11-26,C0002,Electronics,Tablet A,597.79,1,Paid,597.79,2023-11-26,False,0.0,,,None,None
100907,10/12/2023,C0005,Electronics,TV Pro,"1352,21 EUR",1,Paid,1352.21,2023-12-10,False,0.0,,,None,None
100180,2023-11-22,C0006,Electronics,NoiseCancel Headphones,"228,54 EUR",1,Paid,228.54,2023-11-22,False,0.0,,,None,None
101018,12/12/2023,C0002,Accessories,USB-C Cable,15.31,2,Paid,15.31,2023-12-12,False,0.0,,,None,None
101088,2023-12-14,C0006,Accessories,USB-C Cable,"14,75 EUR",1,Paid,14.75,2023-12-14,False,1.0,Return request,"<p>I want to get a refund for this product.
It is defective.
I need my money back.

<p>Thanks</p><p>Customer</p></p>

My order #101088.",Defect / Refund,Negative
100515,02/12/2023,C0243,Electronics,Tablet A,533,1,Paid,533.0,2023-12-02,False,0.0,,,None,None
100693,2023-12-06,C0001,Accessories,Laptop Sleeve,26.83,2,Paid,26.83,2023-12-06,False,0.0,,,None,None
100682,2023-12-05,C0223,Accessories,Screen Protector,"7,50 EUR",2,Paid,7.5,2023-12-05,False,2.0,Not working as expected | Product defective,"The product is broken.<br>Poor quality.<br>I want a replacement.<br>Also: poor quality.<br><br>Sent from my iPhone

Ref: TX-100682 | The product is not working.
This should not happen.
What are my options?

Sent from my Android device

Order number: 100682",Connectivity,Neutral
101037,2023-12-12,C0003,Electronics,NoiseCancel Headphones,"308,13 EUR",1,Paid,308.13,2023-12-12,True,0.0,,,None,None
100106,19/11/2023,C0020,Accessories,USB-C Cable,14.99,2,Paid,14.99,2023-11-19,False,0.0,,,None,None
100786,2023-12-07,C0112,Smart Home,NordLock Pro,"245,31 EUR",1,Paid,245.31,2023-12-07,True,1.0,Locked out of my home,"I am locked out — the lock does not respond.<br>The app shows offline.<br>This is urgent.<br><br>Sent from my Android device

My order #100786.",Connectivity,Negative
100915,2023-12-10,C0028,Accessories,USB-C Cable,"15,71 EUR",1,Failed,15.71,2023-12-10,False,0.0,,,None,None
100821,08/12/2023,C0001,Accessories,Screen Protector,"6,18 EUR",1,Paid,6.18,2023-12-08,False,0.0,,,None,None
100268,2023-11-25,C0005,Electronics,TV Pro,1187.59,1,Pending,1187.59,2023-11-25,False,0.0,,,None,None
101148,27/11/2023,C0220,Accessories,Phone Case,"31,01 EUR",4,Paid,31.01,2023-11-27,False,0.0,,,None,None
100789,2023-12-07,C0030,Electronics,Laptop X,1363,1,Paid,1363.0,2023-12-07,False,0.0,,,None,None
100967,2023-12-11,C0002,Accessories,Screen Protector,"14,65 EUR",2,Pending,14.65,2023-12-11,False,0.0,,,None,None
100448,30/11/2023,C0001,Accessories,Screen Protector,13.04,2,Paid,13.04,2023-11-30,False,0.0,,,None,None
100041,2023-11-16,C0007,Accessories,Accessory Bundle,"96,52 EUR",1,Paid,96.52,2023-11-16,False,0.0,,,None,None
100533,2023-12-02,C0034,Accessories,Laptop Sleeve,"32,30 EUR",3,Paid,32.3,2023-12-02,False,0.0,,,None,None
100301,2023-11-26,C0046,Accessories,Charger,15.37,1,Paid,15.37,2023-11-26,True,0.0,,,None,None
100434,2023-11-29,C0005,Electronics,NoiseCancel Headphones,$344.00,1,Paid,344.0,2023-11-29,False,0.0,,,None,None
100802,2023-12-08,C0183,Smart Home,NordLock Pro,"200,86 EUR",1,Paid,200.86,2023-12-08,True,1.0,NordLock Pro battery drains fast,"<p>My NordLock Pro dies in 48 hours.
I tried new batteries and it still dies.
I can't rely on this.
Also: 2 days.

Sent from my iPhone</p><br><p>This is unacceptable.</p>

Order number: 100802",Battery Issue,Negative
101126,14/12/2023,C0001,Smart Home,NordLock Pro,"206,17 EUR",1,Paid,206.17,2023-12-14,False,0.0,,,None,None
100269,2023-11-25,C0070,Electronics,Laptop X,"1466,72 EUR",1,Pending,1466.72,2023-11-25,False,0.0,,,None,None
100619,04/12/2023,C0001,Electronics,TV Pro,1574.14,1,Paid,1574.14,2023-12-04,False,0.0,,,None,None
100633,2023-12-04,C0040,Accessories,USB-C Cable,13,3,Paid,13.0,2023-12-04,False,0.0,,,None,None
101029,2023-12-12,C0001,Accessories,Laptop Sleeve,"37,26 EUR",2,Paid,37.26,2023-12-12,False,0.0,,,None,None
101081,2023-12-13,C0004,Smart Home,NordPlug,$21.26,1,Paid,21.26,2023-12-13,False,0.0,,,None,None
100297,26/11/2023,C0015,Smart Home,NordLock Pro,248,1,Paid,248.0,2023-11-26,False,0.0,,,None,None
101155,08/12/2023,C0042,Electronics,Laptop X,1620.72,1,Paid,1620.72,2023-12-08,False,0.0,,,None,None
100703,06/12/2023,C0001,Smart Home,NordLock Pro,225.82,1,Paid,225.82,2023-12-06,False,0.0,,,None,None
100594,2023-12-03,C0147,Electronics,Tablet A,"724,89 EUR",1,Paid,724.89,2023-12-03,False,1.0,App cannot connect to WiFi,"<p>The app will not connect to WiFi.
I tried reinstalling the app but it fails.
Please advise.

—
Regards,
A very unhappy customer</p>

My order #100594.",Connectivity,Negative
100971,2023-12-11,C0002,Electronics,TV Pro,1667.73,1,Paid,1667.73,2023-12-11,False,0.0,,,None,None
100299,2023-11-26,C0018,Electronics,NoiseCancel Headphones,281.50,1,Paid,281.5,2023-11-26,False,0.0,,,None,None
101095,2023-12-14,C0002,Smart Home,NordLock Pro,"238,51 EUR",1,Paid,238.51,2023-12-14,False,0.0,,,None,None
100905,2023-12-10,C0311,Electronics,TV Pro,1080,1,Paid,1080.0,2023-12-10,False,0.0,,,None,None
100208,23/11/2023,C0002,Accessories,USB-C Cable,$11.04,1,Paid,11.04,2023-11-23,False,0.0,,,None,None
100704,06/12/2023,C0010,Smart Home,NordLock Pro,241,1,Paid,241.0,2023-12-06,False,0.0,,,None,None
100896,2023-12-10,C0001,Accessories,USB-C Cable,"18,60 EUR",1,Paid,18.6,2023-12-10,False,0.0,,,None,None
101132,2023-12-14,C0001,Electronics,Tablet A,$589.01,1,Paid,589.01,2023-12-14,False,0.0,,,None,None
100144,2023-11-21,C0001,Accessories,Laptop Sleeve,31.36,3,Paid,31.36,2023-11-21,False,0.0,,,None,None
100251,24/11/2023,C0001,Accessories,Charger,41.99,3,Paid,41.99,2023-11-24,False,0.0,,,None,None
100514,01/12/2023,C0095,Electronics,Laptop X,1623,1,Paid,1623.0,2023-12-01,False,0.0,,,None,None
100978,2023-12-11,C0003,Electronics,NoiseCancel Headphones,279.88,1,Paid,279.88,2023-12-11,False,0.0,,,None,None
100824,2023-12-08,C0007,Electronics,Tablet A,524.82,1,Paid,524.82,2023-12-08,False,0.0,,,None,None
101082,2023-12-13,C0014,Smart Home,NordLock Pro,"231,99 EUR",1,Paid,231.99,2023-12-13,False,0.0,,,None,None
100717,2023-12-06,C0001,Accessories,Phone Case,"39,48 EUR",1,Paid,39.48,2023-12-06,False,0.0,,,None,None
100732,2023-12-06,C0001,Electronics,TV Pro,$1144.44,1,Paid,1144.44,2023-12-06,False,0.0,,,None,None
100164,2023-11-22,C0015,Electronics,Smartphone Z,"845,23 EUR",1,Paid,845.23,2023-11-22,False,0.0,,,None,None
100501,2023-12-01,C0002,Electronics,NoiseCancel Headphones,$255.15,1,Paid,255.15,2023-12-01,False,0.0,,,None,None
100264,2023-11-25,C0316,Smart Home,NordLock Pro,"208,11 EUR",1,Paid,208.11,2023-11-25,False,0.0,,,None,None
100082,2023-11-18,C0001,Electronics,Laptop X,1457.02,2,Paid,1457.02,2023-11-18,False,0.0,,,None,None
101142,2023-11-17,C0061,Electronics,TV Pro,1046.02,1,Paid,1046.02,2023-11-17,False,0.0,,,None,None
100768,2023-12-07,C0001,Accessories,Accessory Bundle,"55,24 EUR",1,Paid,55.24,2023-12-07,False,0.0,,,None,None
100325,2023-11-27,C0125,Smart Home,NordLock Pro,220.55,1,Paid,220.55,2023-11-27,False,1.0,Where is my order?,"My delivery is late.<br>Tracking shows pending.<br>This is taking too long.<br><br><p>Thanks</p><p>Customer</p>

My order #100325.",Delivery,Neutral
100473,2023-11-30,C0004,Electronics,NoiseCancel Headphones,"316,19 EUR",1,Paid,316.19,2023-11-30,False,0.0,,,None,None
100564,2023-12-03,C0001,Smart Home,NordLock Pro,223.08,1,Paid,223.08,2023-12-03,False,0.0,,,None,None
100145,21/11/2023,C0170,Accessories,Charger,30.35,2,Paid,30.35,2023-11-21,False,0.0,,,None,None
100663,2023-12-05,C0066,Smart Home,NordLock Pro,200.01,1,Paid,200.01,2023-12-05,True,3.0,NordLock Pro won't unlock | Can't connect the app | Battery problem with my lock,"<p>I am locked out — the lock will not unlock.
The app shows offline.
This is urgent.

<p>Thanks</p><p>Customer</p></p><br><p>ASAP</p>

My order #100663. | <p>The app cannot connect to WiFi.
I tried pairing again but it fails.
It worked once and then stopped.

—
Regards,
A very unhappy customer</p><br><p>This is unacceptable.</p>

My order #100663. | My NordLock Pro dies in a day.
I changed batteries and it still drains quickly.
This is unacceptable.

<p>Thanks</p><p>Customer</p>

My order #100663.",Battery Issue,Negative
100814,08/12/2023,C0001,Smart Home,NordLock Pro,"181,89 EUR",1,Paid,181.89,2023-12-08,False,0.0,,,None,None
100275,2023-11-25,C0004,Accessories,Phone Case,"19,93 EUR",2,Paid,19.93,2023-11-25,False,0.0,,,None,None
100972,11/12/2023,C0005,Smart Home,NordLock Pro,216.12,2,Pending,216.12,2023-12-11,False,0.0,,,None,None
100673,2023-12-05,C0016,Electronics,Tablet A,507.23,1,Paid,507.23,2023-12-05,False,0.0,,,None,None
100793,07/12/2023,C0083,Accessories,USB-C Cable,19.69,2,Paid,19.69,2023-12-07,False,0.0,,,None,None
100752,2023-12-07,C0271,Smart Home,NordLock Pro,212.22,2,Paid,212.22,2023-12-07,False,2.0,App cannot connect to WiFi | Can't connect the app,"<p>The app cannot connect to the lock.
I tried resetting but it fails.
It worked once and then stopped.

Sent from my iPhone</p>

Order number: 100752 | <p>The app will not connect to the lock.
I tried reinstalling the app but it fails.
Please advise.

—
Regards,
A very unhappy customer</p><br><p>ASAP</p>

My order #100752.",Connectivity,Negative
100730,2023-12-06,C0115,Accessories,Wireless Mouse,58.87,1,Paid,58.87,2023-12-06,False,1.0,Battery dies in 2 days,"My NordLock Pro dies in a day.
I tried new batteries and it still dies.
I can't rely on this.

Sent from my Android device

My order #100730.",Battery Issue,Neutral
100609,2023-12-04,C0004,Smart Home,NordCam Mini,62,1,Paid,62.0,2023-12-04,False,0.0,,,None,None
100825,08/12/2023,C0021,Electronics,Tablet A,652.84,1,Paid,652.84,2023-12-08,False,0.0,,,None,None
100088,2023-11-18,C0027,Accessories,Charger,"20,20 EUR",1,Paid,20.2,2023-11-18,False,0.0,,,None,None
100945,2023-12-11,C0012,Electronics,Tablet A,"736,42 EUR",2,Paid,736.42,2023-12-11,False,0.0,,,None,None
100853,09/12/2023,C0042,Electronics,Smartphone Z,1004,1,Paid,1004.0,2023-12-09,False,0.0,,,None,None
100307,2023-11-26,C0003,Electronics,Smartphone Z,912.54,1,Paid,912.54,2023-11-26,False,0.0,,,None,None
100552,2023-12-02,C0145,Electronics,TV Pro,1419,1,Paid,1419.0,2023-12-02,False,0.0,,,None,None
100188,2023-11-22,C0001,Electronics,Smartphone Z,"851,41 EUR",1,Paid,851.41,2023-11-22,False,0.0,,,None,None
100892,2023-12-10,C0009,Accessories,Wireless Mouse,25.68,1,Paid,25.68,2023-12-10,False,0.0,,,None,None
100288,2023-11-25,C0003,Accessories,Charger,$29.37,1,Paid,29.37,2023-11-25,False,0.0,,,None,None
100871,2023-12-09,C0075,Smart Home,NordLock Pro,185.47,1,Paid,185.47,2023-12-09,False,2.0,Battery dies in 2 days | NordLock Pro pairing issue,"My NordLock Pro dies in 2 days.
I tried new batteries and it still drains quickly.
Please help ASAP.

Sent from my Android device

Ref: TX-100871 | The app will not connect to WiFi.
I tried pairing again but it fails.
Is there a fix?

<p>Thanks</p><p>Customer</p>

My order #100871.",Battery Issue,Negative
100668,2023-12-05,C0030,Electronics,Laptop X,$1686.77,1,Paid,1686.77,2023-12-05,False,0.0,,,None,None
101001,12/12/2023,C0004,Smart Home,NordLock Pro,$186.38,1,Pending,186.38,2023-12-12,False,0.0,,,None,None
101061,2023-12-13,C0001,Accessories,Screen Protector,8.08,2,Paid,8.08,2023-12-13,False,0.0,,,None,None
100756,2023-12-07,C0001,Accessories,Charger,43.27,1,Paid,43.27,2023-12-07,False,0.0,,,None,None
100372,2023-11-28,C0005,Accessories,Accessory Bundle,$36.70,2,Paid,36.7,2023-11-28,False,0.0,,,None,None
100050,2023-11-17,C0003,Electronics,Tablet A,336.05,2,Paid,336.05,2023-11-17,False,0.0,,,None,None
100454,2023-11-30,C0006,Electronics,Smartphone Z,$1061.74,1,Paid,1061.74,2023-11-30,False,0.0,,,None,None
100549,02/12/2023,C0001,Smart Home,NordLock Pro,190.10,1,Paid,190.1,2023-12-02,False,0.0,,,None,None
100248,2023-11-24,C0001,Accessories,Wireless Mouse,26.62,1,Paid,26.62,2023-11-24,False,0.0,,,None,None
101195,2023-11-23,C0002,Electronics,Laptop X,1577,1,Paid,1577.0,2023-11-23,False,0.0,,,None,None
100398,2023-11-29,C0019,Smart Home,NordLock Pro,201.64,1,Paid,201.64,2023-11-29,False,0.0,,,None,None
100865,2023-12-09,C0055,Electronics,Tablet A,"772,98 EUR",1,Paid,772.98,2023-12-09,False,1.0,App cannot connect to WiFi,"<p>The app will not connect to the lock.
I tried resetting but it fails.
Is there a fix?

Sent from my Android device</p>

Order number: 100865",Connectivity,Neutral
100601,2023-12-04,C0001,Accessories,Wireless Mouse,32,1,Pending,32.0,2023-12-04,False,0.0,,,None,None
100662,2023-12-05,C0004,Smart Home,NordLock Pro,"238,67 EUR",1,Paid,238.67,2023-12-05,False,0.0,,,None,None
100833,2023-12-08,C0027,Electronics,NoiseCancel Headphones,"248,37 EUR",1,Paid,248.37,2023-12-08,False,0.0,,,None,None
101124,14/12/2023,C0197,Accessories,Screen Protector,"12,14 EUR",1,Paid,12.14,2023-12-14,False,0.0,,,None,None
100838,2023-12-08,C0003,Smart Home,NordLock Pro,$188.83,1,Paid,188.83,2023-12-08,True,1.0,Not working as expected,"The product is broken.<br>This should not happen.<br>What are my options?<br><br><br><br>--<br>NordTech Customer

Order number: 100838",Connectivity,Neutral
100034,16/11/2023,C0001,Accessories,Accessory Bundle,$34.22,2,Paid,34.22,2023-11-16,False,0.0,,,None,None
100089,2023-11-18,C0002,Accessories,Screen Protector,12.91,1,Paid,12.91,2023-11-18,False,0.0,,,None,None
100357,2023-11-28,C0208,Electronics,Smartphone Z,1034.43,1,Paid,1034.43,2023-11-28,False,1.0,Not working as expected,"The product is broken.<br>Poor quality.<br>I want a replacement.<br><br><br><br>--<br>NordTech Customer

My order #100357.",Defect / Refund,Neutral
100567,2023-12-03,C0001,Electronics,Tablet A,631.82,1,Paid,631.82,2023-12-03,False,0.0,,,None,None
100918,2023-12-10,C0035,Accessories,Accessory Bundle,98.54,1,Paid,98.54,2023-12-10,True,2.0,Battery dies in 2 days | Return request,"My NordLock Pro battery drains in 48 hours.<br>I tried new batteries and it still dies.<br>Please help ASAP.<br>Also: battery drains.<br><br><br><br>--<br>NordTech Customer

My order #100918. | I want to get a refund for this product.<br>It is defective.<br>Please send return instructions.<br>Also: RMA.<br><br><br><br>--<br>NordTech Customer

Ref: TX-100918",Battery Issue,Negative
100517,02/12/2023,C0117,Accessories,Phone Case,33.43,1,Paid,33.43,2023-12-02,False,0.0,,,None,None
100085,18/11/2023,C0020,Accessories,Charger,$45.43,2,Paid,45.43,2023-11-18,False,0.0,,,None,None
100773,2023-12-07,C0004,Electronics,Smartphone Z,"893,14 EUR",1,Paid,893.14,2023-12-07,False,0.0,,,None,None
100347,27/11/2023,C0006,Electronics,TV Pro,937.66,2,Paid,937.66,2023-11-27,False,0.0,,,None,None
100539,2023-12-02,C0008,Electronics,TV Pro,$1441.81,1,Paid,1441.81,2023-12-02,False,0.0,,,None,None
100132,2023-11-20,C0001,Electronics,Laptop X,"1612,31 EUR",2,Paid,1612.31,2023-11-20,False,0.0,,,None,None
100376,2023-11-28,C0006,Smart Home,NordLock Pro,224.20,1,Paid,224.2,2023-11-28,False,0.0,,,None,None
101034,12/12/2023,C0214,Accessories,Charger,15.36,2,Paid,15.36,2023-12-12,False,0.0,,,None,None
100616,2023-12-04,C0005,Accessories,Screen Protector,$5.04,1,Failed,5.04,2023-12-04,False,0.0,,,None,None
100822,2023-12-08,C0242,Smart Home,NordLock Pro,200.64,1,Paid,200.64,2023-12-08,False,0.0,,,None,None
100362,2023-11-28,C0004,Accessories,Charger,43.85,2,Paid,43.85,2023-11-28,False,0.0,,,None,None
100428,2023-11-29,C0027,Accessories,Accessory Bundle,"69,78 EUR",1,Paid,69.78,2023-11-29,False,0.0,,,None,None
101032,2023-12-12,C0125,Accessories,Phone Case,"38,23 EUR",2,Paid,38.23,2023-12-12,False,1.0,Battery dies in 2 days,"My NordLock Pro dies in a day.
I tried new batteries and it still dies.
This is unacceptable.
Also: dead battery.

<p>Thanks</p><p>Customer</p>

My order #101032.",Battery Issue,Negative
100342,2023-11-27,C0024,Accessories,Phone Case,"36,96 EUR",2,Paid,36.96,2023-11-27,False,0.0,,,None,None
100498,2023-12-01,C0013,Accessories,Screen Protector,9.20,1,Paid,9.2,2023-12-01,False,0.0,,,None,None
100758,2023-12-07,C0057,Smart Home,NordLock Pro,$239.23,1,Paid,239.23,2023-12-07,False,2.0,Battery dies in 2 days | Locked out of my home,"My NordLock Pro dies in 2 days.<br>I tried new batteries and it still drains quickly.<br>This is unacceptable.<br><br>Sent from my iPhone

Order number: 100758 | I am stuck outside — the lock does not respond.<br>The app shows not responding.<br>I can't get into my house.<br>Also: stuck outside.<br><br>—<br>Regards,<br>A very unhappy customer

Order number: 100758",Battery Issue,Negative
101020,12/12/2023,C0013,Accessories,Screen Protector,12.92,1,Paid,12.92,2023-12-12,False,0.0,,,None,None
101146,03/12/2023,C0002,Smart Home,NordLock Pro,"192,26 EUR",1,Paid,192.26,2023-12-03,False,0.0,,,None,None
100734,06/12/2023,C0009,Smart Home,NordTherm,106.57,1,Failed,106.57,2023-12-06,False,0.0,,,None,None
100063,17/11/2023,C0046,Electronics,TV Pro,1698.27,1,Paid,1698.27,2023-11-17,False,0.0,,,None,None
100636,04/12/2023,C0008,Accessories,Accessory Bundle,37.42,4,Paid,37.42,2023-12-04,False,0.0,,,None,None
100914,2023-12-10,C0118,Accessories,USB-C Cable,"14,98 EUR",1,Paid,14.98,2023-12-10,False,2.0,Return request | Very disappointed,"<p>I want to return this product.
It is not as described.
Please send return instructions.
Also: money back.

<br><br>--<br>NordTech Customer</p>

Order number: 100914 | The product is defective.
Poor quality.
I want a replacement.

Sent from my iPhone

My order #100914.",Defect / Refund,Neutral
100468,2023-11-30,C0001,Electronics,TV Pro,"958,27 EUR",1,Paid,958.27,2023-11-30,False,0.0,,,None,None
100220,2023-11-24,C0073,Accessories,Accessory Bundle,"44,98 EUR",2,Paid,44.98,2023-11-24,False,1.0,NordLock Pro won't unlock,"<p>I am stuck outside — the lock will not unlock.
The app shows offline.
I need immediate assistance.

Sent from my iPhone</p>

My order #100220.",Connectivity,Negative
100443,30/11/2023,C0009,Electronics,Tablet A,487.70,1,Paid,487.7,2023-11-30,False,0.0,,,None,None
100153,2023-11-21,C0106,Electronics,Laptop X,1426.23,1,Paid,1426.23,2023-11-21,False,0.0,,,None,None
100326,2023-11-27,C0019,Smart Home,NordLock Pro,"238,66 EUR",1,Paid,238.66,2023-11-27,False,0.0,,,None,None
100308,2023-11-26,C0301,Accessories,Charger,42,1,Paid,42.0,2023-11-26,False,0.0,,,None,None
100859,2023-12-09,C0047,Electronics,TV Pro,1295.10,1,Paid,1295.1,2023-12-09,False,2.0,Not working as expected | NordLock Pro won't unlock,"<p>The product is defective.
Very disappointed.
What are my options?
Also: poor quality.

—
Regards,
A very unhappy customer</p><br><p>This is unacceptable.</p>

Order number: 100859 | I am locked out — the lock does not respond.
The app shows not responding.
I can't get into my house.
Also: locked out.

Sent from my Android device

Order number: 100859",Connectivity,Negative
100613,2023-12-04,C0005,Electronics,Smartphone Z,"701,94 EUR",1,Paid,701.94,2023-12-04,False,0.0,,,None,None
100585,2023-12-03,C0067,Smart Home,NordTherm,84.35,1,Paid,84.35,2023-12-03,False,0.0,,,None,None
100606,2023-12-04,C0003,Accessories,Screen Protector,5,2,Paid,5.0,2023-12-04,True,0.0,,,None,None
100204,23/11/2023,C0239,Electronics,NoiseCancel Headphones,204.43,1,Paid,204.43,2023-11-23,False,0.0,,,None,None
100772,07/12/2023,C0001,Accessories,Charger,43.23,1,Paid,43.23,2023-12-07,False,0.0,,,None,None
100399,29/11/2023,C0262,Electronics,NoiseCancel Headphones,186.48,1,Paid,186.48,2023-11-29,False,0.0,,,None,None
100005,15/11/2023,C0003,Electronics,Tablet A,"553,75 EUR",1,Paid,553.75,2023-11-15,False,0.0,,,None,None
101147,2023-11-24,C0276,Smart Home,NordLock Pro,205.21,1,Paid,205.21,2023-11-24,True,4.0,Battery problem with my lock | Where is my order? | Can't connect the app | I want a refund,"My smart lock battery drains in a day.
I changed batteries and it still dies.
This is unacceptable.

Sent from my Android device

Order number: 101147 | <p>My delivery is stuck.
Tracking shows no updates.
Please update me.
Also: delivery late.

Sent from my Android device</p>

My order #101147. | The app will not connect to WiFi.
I tried reinstalling the app but it fails.
It worked once and then stopped.

<br><br>--<br>NordTech Customer

Order number: 101147 | I want to get a refund for this product.
It is not as described.
I need my money back.

Sent from my iPhone

Order number: 101147",Battery Issue,Negative
100893,2023-12-10,C0224,Accessories,Accessory Bundle,47.39,1,Paid,47.39,2023-12-10,False,0.0,,,None,None
100900,2023-12-10,C0001,Accessories,USB-C Cable,"11,88 EUR",1,Paid,11.88,2023-12-10,False,0.0,,,None,None
100130,2023-11-20,C0271,Electronics,Laptop X,"1 394,09 EUR",1,Paid,1394.09,2023-11-20,False,0.0,,,None,None
100701,06/12/2023,C0120,Accessories,USB-C Cable,"17,86 EUR",2,Paid,17.86,2023-12-06,False,0.0,,,None,None
100845,09/12/2023,C0001,Smart Home,NordLock Pro,"202,58 EUR",1,Paid,202.58,2023-12-09,False,0.0,,,None,None
100994,12/12/2023,C0023,Smart Home,NordLock Pro,$192.70,1,Paid,192.7,2023-12-12,False,0.0,,,None,None
100458,2023-11-30,C0030,Smart Home,NordLock Pro,$214.91,1,Paid,214.91,2023-11-30,False,0.0,,,None,None
100072,2023-11-18,C0001,Accessories,Phone Case,25,1,Paid,25.0,2023-11-18,False,0.0,,,None,None
101053,13/12/2023,C0004,Electronics,TV Pro,"1 346,87 EUR",1,Paid,1346.87,2023-12-13,False,0.0,,,None,None
100672,2023-12-05,C0007,Electronics,NoiseCancel Headphones,196,1,Paid,196.0,2023-12-05,False,0.0,,,None,None
100656,05/12/2023,C0001,Smart Home,NordLock Pro,210,1,Paid,210.0,2023-12-05,False,0.0,,,None,None
101164,29/11/2023,C0296,Accessories,Accessory Bundle,"52,01 EUR",2,Paid,52.01,2023-11-29,False,0.0,,,None,None
100262,2023-11-25,C0033,Electronics,Smartphone Z,948.32,1,Paid,948.32,2023-11-25,True,0.0,,,None,None
101043,13/12/2023,C0002,Accessories,Accessory Bundle,"46,99 EUR",2,Paid,46.99,2023-12-13,False,0.0,,,None,None
100538,02/12/2023,C0007,Accessories,Accessory Bundle,"82,45 EUR",2,Paid,82.45,2023-12-02,False,0.0,,,None,None
100203,23/11/2023,C0079,Accessories,USB-C Cable,11.15,1,Paid,11.15,2023-11-23,False,0.0,,,None,None
101152,2023-11-24,C0126,Accessories,USB-C Cable,"9,10 EUR",1,Paid,9.1,2023-11-24,False,0.0,,,None,None
100071,2023-11-17,C0035,Accessories,USB-C Cable,15,4,Paid,15.0,2023-11-17,False,0.0,,,None,None
101128,14/12/2023,C0283,Electronics,TV Pro,1490.50,1,Paid,1490.5,2023-12-14,False,0.0,,,None,None
100954,2023-12-11,C0187,Accessories,Accessory Bundle,"97,99 EUR",2,Paid,97.99,2023-12-11,False,1.0,Where is my order?,"My delivery is stuck.
Tracking shows no updates.
This is taking too long.

Sent from my Android device

My order #100954.",Delivery,Negative
100128,2023-11-20,C0120,Accessories,Phone Case,33.65,1,Paid,33.65,2023-11-20,False,0.0,,,None,None
100371,28/11/2023,C0013,Electronics,Smartphone Z,"922,19 EUR",1,Paid,922.19,2023-11-28,False,0.0,,,None,None
100135,20/11/2023,C0098,Electronics,Laptop X,1417.96,1,Paid,1417.96,2023-11-20,False,0.0,,,None,None
100485,01/12/2023,C0060,Electronics,NoiseCancel Headphones,327.51,1,Paid,327.51,2023-12-01,False,0.0,,,None,None
100816,2023-12-08,C0031,Smart Home,NordLock Pro,"207,28 EUR",1,Paid,207.28,2023-12-08,True,1.0,Delivery delay,"<p>My delivery is delayed.
Tracking shows no updates.
Please update me.

—
Regards,
A very unhappy customer</p><br><p>ASAP</p>

My order #100816.",Connectivity,Negative
100222,2023-11-24,C0070,Accessories,Wireless Mouse,"39,86 EUR",1,Paid,39.86,2023-11-24,False,0.0,,,None,None
101093,2023-12-14,C0001,Electronics,NoiseCancel Headphones,"307,32 EUR",1,Paid,307.32,2023-12-14,False,0.0,,,None,None
101050,13/12/2023,C0012,Electronics,NoiseCancel Headphones,"223,42 EUR",1,Paid,223.42,2023-12-13,False,0.0,,,None,None
101129,2023-12-14,C0001,Electronics,TV Pro,$932.28,1,Paid,932.28,2023-12-14,False,0.0,,,None,None
100697,06/12/2023,C0001,Electronics,TV Pro,$1320.84,2,Paid,1320.84,2023-12-06,False,0.0,,,None,None
100657,2023-12-05,C0001,Smart Home,NordPlug,31.03,1,Failed,31.03,2023-12-05,False,0.0,,,None,None
100406,2023-11-29,C0143,Electronics,Tablet A,349.95,1,Paid,349.95,2023-11-29,False,0.0,,,None,None
100736,2023-12-06,C0002,Smart Home,NordTherm,"85,29 EUR",1,Paid,85.29,2023-12-06,False,0.0,,,None,None
100531,02/12/2023,C0004,Accessories,Wireless Mouse,23.82,1,Paid,23.82,2023-12-02,False,0.0,,,None,None
101090,14/12/2023,C0002,Smart Home,NordLock Pro,219.32,1,Paid,219.32,2023-12-14,False,0.0,,,None,None
100602,2023-12-04,C0007,Electronics,Tablet A,"529,46 EUR",1,Paid,529.46,2023-12-04,False,0.0,,,None,None
100211,2023-11-23,C0005,Electronics,Smartphone Z,988,1,Paid,988.0,2023-11-23,False,0.0,,,None,None
100388,28/11/2023,C0001,Electronics,Tablet A,$599.27,2,Paid,599.27,2023-11-28,False,0.0,,,None,None
101158,2023-12-04,C0040,Accessories,USB-C Cable,13,3,Paid,13.0,2023-12-04,False,1.0,Battery dies in 2 days,"<p>My smart lock dies in a day.
I changed batteries and it still drains quickly.
Please help ASAP.

Sent from my iPhone</p>

My order #101158.",Battery Issue,Negative
100711,2023-12-06,C0010,Accessories,Wireless Mouse,"29,11 EUR",1,Paid,29.11,2023-12-06,False,0.0,,,None,None
100848,2023-12-09,C0007,Accessories,Accessory Bundle,83,2,Paid,83.0,2023-12-09,False,0.0,,,None,None
100263,2023-11-25,C0001,Electronics,Smartphone Z,"740,02 EUR",1,Paid,740.02,2023-11-25,False,0.0,,,None,None
100305,2023-11-26,C0160,Accessories,Charger,17.05,3,Paid,17.05,2023-11-26,False,2.0,Product defective | Where is my order?,"<p>The product is not working.
This should not happen.
I want a replacement.

Sent from my Android device</p>

My order #100305. | <p>My delivery is stuck.
Tracking shows pending.
Please update me.

<br><br>--<br>NordTech Customer</p>

My order #100305.",Connectivity,Negative
100283,25/11/2023,C0003,Electronics,NoiseCancel Headphones,$343.43,1,Paid,343.43,2023-11-25,False,0.0,,,None,None
100997,12/12/2023,C0001,Electronics,Smartphone Z,"706,88 EUR",1,Paid,706.88,2023-12-12,False,0.0,,,None,None
101119,14/12/2023,C0064,Smart Home,NordLock Pro,188.97,2,Paid,188.97,2023-12-14,False,0.0,,,None,None
100465,30/11/2023,C0081,Accessories,Accessory Bundle,62.27,1,Paid,62.27,2023-11-30,False,0.0,,,None,None
100340,27/11/2023,C0059,Accessories,Accessory Bundle,26.09,2,Paid,26.09,2023-11-27,False,0.0,,,None,None
100337,2023-11-27,C0009,Accessories,Screen Protector,"6,38 EUR",1,Pending,6.38,2023-11-27,False,0.0,,,None,None
100156,2023-11-21,C0003,Electronics,TV Pro,1131.22,1,Failed,1131.22,2023-11-21,False,0.0,,,None,None
100513,2023-12-01,C0001,Smart Home,NordPlug,18.39,1,Paid,18.39,2023-12-01,False,0.0,,,None,None
100808,08/12/2023,C0028,Smart Home,NordLock Pro,"193,67 EUR",1,Paid,193.67,2023-12-08,False,0.0,,,None,None
100646,2023-12-04,C0102,Accessories,USB-C Cable,"18,98 EUR",1,Paid,18.98,2023-12-04,False,0.0,,,None,None
100540,02/12/2023,C0035,Electronics,TV Pro,978.66,1,Paid,978.66,2023-12-02,False,0.0,,,None,None
100074,2023-11-18,C0129,Smart Home,NordLock Pro,227.10,1,Paid,227.1,2023-11-18,False,1.0,Battery dies in 2 days,"My smart lock dies in a day.<br>I changed batteries and it still dies.<br>I can't rely on this.<br>Also: dead battery.<br><br>Sent from my iPhone

Ref: TX-100074",Battery Issue,Neutral
100044,2023-11-16,C0003,Electronics,NoiseCancel Headphones,207.57,1,Paid,207.57,2023-11-16,False,0.0,,,None,None
101198,2023-12-13,C0013,Accessories,Wireless Mouse,26.47,2,Paid,26.47,2023-12-13,False,0.0,,,None,None
100776,2023-12-07,C0093,Accessories,Screen Protector,10.13,3,Paid,10.13,2023-12-07,False,0.0,,,None,None
100801,08/12/2023,C0318,Accessories,Phone Case,30.35,4,Paid,30.35,2023-12-08,False,0.0,,,None,None
100627,2023-12-04,C0022,Accessories,Screen Protector,8.38,1,Paid,8.38,2023-12-04,False,1.0,Not working as expected,"The product is broken.
This should not happen.
Please help.

—
Regards,
A very unhappy customer

My order #100627.",Connectivity,Negative
100795,2023-12-07,C0002,Accessories,USB-C Cable,"9,83 EUR",1,Paid,9.83,2023-12-07,False,0.0,,,None,None
100569,2023-12-03,C0001,Accessories,Charger,28,1,Paid,28.0,2023-12-03,False,0.0,,,None,None
100254,2023-11-24,C0084,Electronics,Smartphone Z,906.32,1,Paid,906.32,2023-11-24,False,0.0,,,None,None
101003,2023-12-12,C0003,Smart Home,NordLock Pro,217.71,2,Paid,217.71,2023-12-12,False,0.0,,,None,None
100097,19/11/2023,C0001,Smart Home,NordLock Pro,$205.02,1,Paid,205.02,2023-11-19,False,0.0,,,None,None
100279,25/11/2023,C0002,Electronics,Tablet A,"791,92 EUR",1,Paid,791.92,2023-11-25,False,0.0,,,None,None
100710,2023-12-06,C0181,Electronics,Laptop X,$1439.35,1,Paid,1439.35,2023-12-06,False,0.0,,,None,None
100296,2023-11-26,C0028,Electronics,TV Pro,1020.82,1,Paid,1020.82,2023-11-26,False,0.0,,,None,None
100723,2023-12-06,C0020,Accessories,Laptop Sleeve,"15,59 EUR",2,Paid,15.59,2023-12-06,False,0.0,,,None,None
100346,2023-11-27,C0001,Smart Home,NordLock Pro,210.90,1,Paid,210.9,2023-11-27,False,0.0,,,None,None
100655,2023-12-05,C0023,Accessories,Accessory Bundle,"59,55 EUR",1,Paid,59.55,2023-12-05,True,1.0,Battery problem with my lock,"My smart lock battery drains in a day.<br>I tried new batteries and it still dies.<br>This is unacceptable.<br><br>Sent from my iPhone

Order number: 100655",Battery Issue,Negative
100099,2023-11-19,C0001,Electronics,TV Pro,$926.93,1,Paid,926.93,2023-11-19,False,0.0,,,None,None
100470,2023-11-30,C0200,Smart Home,NordLock Pro,"189,66 EUR",1,Paid,189.66,2023-11-30,False,3.0,Return request | Delivery delay | I want a refund,"I want to get a refund for this product.<br>It is defective.<br>Please send return instructions.<br><br><br><br>--<br>NordTech Customer

Ref: TX-100470 | My delivery is late.
Tracking shows no updates.
Where is my order?
Also: where is my order.

<br><br>--<br>NordTech Customer

Ref: TX-100470 | I want to get a refund for this product.<br>It is defective.<br>Please send return instructions.<br>Also: return.<br><br><p>Thanks</p><p>Customer</p>

Order number: 100470",Delivery,Negative
100504,2023-12-01,C0037,Accessories,Charger,42.66,1,Paid,42.66,2023-12-01,False,1.0,Delivery delay,"My delivery is stuck.<br>Tracking shows in transit for days.<br>This is taking too long.<br>Also: still not received.<br><br>Sent from my Android device

Order number: 100504",Delivery,Negative
100075,2023-11-18,C0022,Accessories,Wireless Mouse,"44,32 EUR",2,Paid,44.32,2023-11-18,False,0.0,,,None,None
100266,25/11/2023,C0007,Smart Home,NordCam Mini,"94,60 EUR",1,Paid,94.6,2023-11-25,False,0.0,,,None,None
101004,12/12/2023,C0030,Accessories,Charger,"19,80 EUR",3,Paid,19.8,2023-12-12,False,0.0,,,None,None
100131,20/11/2023,C0004,Accessories,Screen Protector,12.93,1,Paid,12.93,2023-11-20,False,0.0,,,None,None
100509,2023-12-01,C0015,Accessories,USB-C Cable,16.14,1,Paid,16.14,2023-12-01,False,1.0,Where is my order?,"My delivery is stuck.<br>Tracking shows pending.<br>Where is my order?<br><br>Sent from my Android device

My order #100509.",Delivery,Negative
100064,17/11/2023,C0012,Accessories,Phone Case,12,1,Paid,12.0,2023-11-17,False,0.0,,,None,None
100012,2023-11-15,C0005,Electronics,Laptop X,1546,2,Paid,1546.0,2023-11-15,False,0.0,,,None,None
101192,2023-11-25,C0003,Electronics,Smartphone Z,1056.70,1,Paid,1056.7,2023-11-25,False,0.0,,,None,None
100356,2023-11-28,C0037,Electronics,Tablet A,"556,99 EUR",1,Paid,556.99,2023-11-28,False,0.0,,,None,None
100028,2023-11-16,C0253,Accessories,Laptop Sleeve,29.42,1,Paid,29.42,2023-11-16,False,1.0,Battery dies in 2 days,"My smart lock dies in a day.
I tried new batteries and it still drains quickly.
Please help ASAP.

Sent from my Android device

My order #100028.",Battery Issue,Negative
100923,2023-12-10,C0022,Electronics,Smartphone Z,"711,15 EUR",1,Paid,711.15,2023-12-10,False,1.0,Battery problem with my lock,"My NordLock Pro dies in 48 hours.<br>I changed batteries and it still drains quickly.<br>This is unacceptable.<br>Also: dead battery.<br><br>—<br>Regards,<br>A very unhappy customer

My order #100923.",Battery Issue,Negative
100766,07/12/2023,C0034,Electronics,Tablet A,715,1,Paid,715.0,2023-12-07,False,0.0,,,None,None
100784,2023-12-07,C0019,Accessories,USB-C Cable,19.73,1,Paid,19.73,2023-12-07,False,3.0,Very disappointed | Very disappointed | App cannot connect to WiFi,"The product is broken.<br>Poor quality.<br>What are my options?<br><br><br><br>--<br>NordTech Customer

Order number: 100784 | The product is not working.<br>This should not happen.<br>Please help.<br><br><p>Thanks</p><p>Customer</p>

Order number: 100784 | <p>The app will not connect to WiFi.
I tried pairing again but it fails.
Please advise.

Sent from my iPhone</p>

Order number: 100784",Connectivity,Neutral
100425,2023-11-29,C0002,Accessories,USB-C Cable,$9.35,1,Pending,9.35,2023-11-29,False,0.0,,,None,None
100025,16/11/2023,C0001,Electronics,TV Pro,"929,16 EUR",1,Paid,929.16,2023-11-16,False,0.0,,,None,None
100959,2023-12-11,C0028,Electronics,TV Pro,1060.75,1,Paid,1060.75,2023-12-11,False,1.0,App cannot connect to WiFi,"The app cannot connect to the lock.<br>I tried resetting but it fails.<br>Is there a fix?<br><br><br><br>--<br>NordTech Customer

Order number: 100959",Connectivity,Neutral
100331,2023-11-27,C0058,Electronics,TV Pro,"1 145,46 EUR",1,Paid,1145.46,2023-11-27,False,0.0,,,None,None
101196,29/11/2023,C0003,Accessories,Laptop Sleeve,36.68,2,Paid,36.68,2023-11-29,False,0.0,,,None,None
100403,2023-11-29,C0025,Smart Home,NordLock Pro,190.38,1,Paid,190.38,2023-11-29,False,0.0,,,None,None
100192,2023-11-23,C0003,Accessories,Wireless Mouse,"56,45 EUR",1,Paid,56.45,2023-11-23,False,0.0,,,None,None
100626,04/12/2023,C0001,Electronics,Tablet A,"503,52 EUR",1,Failed,503.52,2023-12-04,False,0.0,,,None,None
100651,2023-12-05,C0002,Electronics,Smartphone Z,966.41,1,Paid,966.41,2023-12-05,False,0.0,,,None,None
100129,20/11/2023,C0051,Smart Home,NordLock Pro,$247.01,1,Paid,247.01,2023-11-20,False,0.0,,,None,None
100678,2023-12-05,C0033,Smart Home,NordLock Pro,229.79,1,Paid,229.79,2023-12-05,False,0.0,,,None,None
101133,14/12/2023,C0042,Electronics,TV Pro,1610.06,1,Paid,1610.06,2023-12-14,False,0.0,,,None,None
100169,2023-11-22,C0006,Electronics,NoiseCancel Headphones,"333,41 EUR",1,Paid,333.41,2023-11-22,False,0.0,,,None,None
100287,25/11/2023,C0072,Accessories,Charger,$17.47,1,Paid,17.47,2023-11-25,False,0.0,,,None,None
100383,2023-11-28,C0237,Smart Home,NordLock Pro,$208.61,2,Paid,208.61,2023-11-28,False,2.0,Battery dies in 2 days | Locked out of my home,"My NordLock Pro dies in 2 days.
I tried new batteries and it still dies.
Please help ASAP.

<br><br>--<br>NordTech Customer

My order #100383. | I am locked out — the lock will not unlock.
The app shows not responding.
I need immediate assistance.

<p>Thanks</p><p>Customer</p>

Order number: 100383",Battery Issue,Negative
100940,2023-12-11,C0002,Electronics,TV Pro,"1 465,79 EUR",1,Paid,1465.79,2023-12-11,False,0.0,,,None,None
100924,2023-12-10,C0087,Accessories,Accessory Bundle,"77,62 EUR",2,Paid,77.62,2023-12-10,False,0.0,,,None,None
101102,14/12/2023,C0002,Electronics,NoiseCancel Headphones,"227,69 EUR",1,Paid,227.69,2023-12-14,False,0.0,,,None,None
100857,2023-12-09,C0001,Electronics,NoiseCancel Headphones,150.30,1,Paid,150.3,2023-12-09,False,0.0,,,None,None
101086,2023-12-14,C0007,Smart Home,NordLock Pro,220.54,1,Paid,220.54,2023-12-14,False,0.0,,,None,None
100536,2023-12-02,C0001,Accessories,USB-C Cable,14,1,Paid,14.0,2023-12-02,False,0.0,,,None,None
100015,15/11/2023,C0013,Accessories,Laptop Sleeve,"28,15 EUR",1,Paid,28.15,2023-11-15,False,0.0,,,None,None
100420,2023-11-29,C0001,Accessories,Phone Case,"18,25 EUR",4,Paid,18.25,2023-11-29,False,0.0,,,None,None
100189,22/11/2023,C0001,Electronics,Laptop X,1507.54,2,Paid,1507.54,2023-11-22,False,0.0,,,None,None
101107,14/12/2023,C0003,Electronics,NoiseCancel Headphones,183.96,1,Paid,183.96,2023-12-14,False,0.0,,,None,None
101024,2023-12-12,C0003,Smart Home,NordLock Pro,226.20,1,Paid,226.2,2023-12-12,False,1.0,NordLock Pro battery drains fast,"My NordLock Pro dies in 48 hours.
I tried new batteries and it still dies.
Please help ASAP.

<br><br>--<br>NordTech Customer

Order number: 101024",Battery Issue,Negative
100437,2023-11-30,C0008,Electronics,Tablet A,$355.20,1,Paid,355.2,2023-11-30,False,0.0,,,None,None
101025,12/12/2023,C0120,Accessories,Charger,29,1,Paid,29.0,2023-12-12,False,0.0,,,None,None
100769,07/12/2023,C0050,Electronics,NoiseCancel Headphones,"282,69 EUR",1,Paid,282.69,2023-12-07,False,0.0,,,None,None
100375,2023-11-28,C0009,Accessories,Phone Case,"35,08 EUR",3,Paid,35.08,2023-11-28,False,0.0,,,None,None
100373,2023-11-28,C0024,Accessories,USB-C Cable,$17.66,1,Paid,17.66,2023-11-28,False,0.0,,,None,None
100591,2023-12-03,C0017,Smart Home,NordLock Pro,"239,52 EUR",1,Paid,239.52,2023-12-03,True,0.0,,,None,None
100675,05/12/2023,C0002,Accessories,Charger,46.60,1,Paid,46.6,2023-12-05,False,0.0,,,None,None
100417,2023-11-29,C0078,Accessories,Screen Protector,"6,53 EUR",1,Paid,6.53,2023-11-29,False,1.0,Can't open the door,"I am stuck outside — the lock will not unlock.<br>The app shows not responding.<br>I can't get into my house.<br><br><br><br>--<br>NordTech Customer

Order number: 100417",Connectivity,Negative
100195,23/11/2023,C0037,Smart Home,NordLock Pro,"181,85 EUR",1,Paid,181.85,2023-11-23,False,0.0,,,None,None
100450,30/11/2023,C0002,Accessories,Screen Protector,11.57,2,Paid,11.57,2023-11-30,False,0.0,,,None,None
100810,08/12/2023,C0002,Smart Home,NordLock Pro,180.92,1,Paid,180.92,2023-12-08,False,0.0,,,None,None
100775,2023-12-07,C0001,Accessories,USB-C Cable,"13,71 EUR",1,Paid,13.71,2023-12-07,False,0.0,,,None,None
100962,2023-12-11,C0006,Smart Home,NordLock Pro,190.08,1,Paid,190.08,2023-12-11,True,0.0,,,None,None
100962,2023-12-11,C0006,Smart Home,NordLock Pro,190.08,1,Paid,190.08,2023-12-11,True,0.0,,,None,None
101039,2023-12-12,C0001,Smart Home,NordLock Pro,"219,18 EUR",1,Paid,219.18,2023-12-12,False,0.0,,,None,None
100408,29/11/2023,C0005,Accessories,Laptop Sleeve,44.52,3,Paid,44.52,2023-11-29,False,0.0,,,None,None
100397,29/11/2023,C0007,Smart Home,NordLock Pro,199.29,1,Pending,199.29,2023-11-29,False,0.0,,,None,None
100615,04/12/2023,C0011,Electronics,NoiseCancel Headphones,$262.06,1,Paid,262.06,2023-12-04,False,0.0,,,None,None
100963,2023-12-11,C0024,Smart Home,NordLock Pro,206,1,Paid,206.0,2023-12-11,True,0.0,,,None,None
100749,07/12/2023,C0256,Accessories,Phone Case,"14,51 EUR",4,Paid,14.51,2023-12-07,False,0.0,,,None,None
100863,09/12/2023,C0011,Smart Home,NordLock Pro,"192,18 EUR",1,Paid,192.18,2023-12-09,False,0.0,,,None,None
100193,23/11/2023,C0010,Electronics,Tablet A,"752,45 EUR",1,Paid,752.45,2023-11-23,False,0.0,,,None,None
100150,2023-11-21,C0002,Electronics,NoiseCancel Headphones,"227,04 EUR",1,Paid,227.04,2023-11-21,False,0.0,,,None,None
100688,05/12/2023,C0006,Electronics,Tablet A,"644,02 EUR",1,Paid,644.02,2023-12-05,False,0.0,,,None,None
100791,2023-12-07,C0002,Electronics,Tablet A,$636.80,1,Paid,636.8,2023-12-07,False,0.0,,,None,None
100740,07/12/2023,C0047,Electronics,Smartphone Z,712.48,1,Paid,712.48,2023-12-07,False,0.0,,,None,None
100300,2023-11-26,C0009,Accessories,Phone Case,"18,67 EUR",3,Paid,18.67,2023-11-26,False,0.0,,,None,None
100708,2023-12-06,C0003,Electronics,Tablet A,"612,79 EUR",1,Paid,612.79,2023-12-06,False,0.0,,,None,None
100950,2023-12-11,C0258,Electronics,NoiseCancel Headphones,"200,27 EUR",1,Paid,200.27,2023-12-11,False,0.0,,,None,None
100241,2023-11-24,C0065,Smart Home,NordPlug,32.73,1,Paid,32.73,2023-11-24,False,0.0,,,None,None
100200,2023-11-23,C0063,Electronics,Tablet A,714.86,1,Paid,714.86,2023-11-23,False,0.0,,,None,None
100046,2023-11-17,C0009,Electronics,TV Pro,$1312.23,1,Paid,1312.23,2023-11-17,False,0.0,,,None,None
100713,2023-12-06,C0030,Smart Home,NordLock Pro,239,1,Paid,239.0,2023-12-06,True,0.0,,,None,None
100588,2023-12-03,C0016,Accessories,Wireless Mouse,40,1,Paid,40.0,2023-12-03,False,0.0,,,None,None
100138,20/11/2023,C0001,Accessories,Wireless Mouse,"59,52 EUR",1,Paid,59.52,2023-11-20,False,0.0,,,None,None
101099,2023-12-14,C0008,Electronics,Laptop X,1431.88,1,Pending,1431.88,2023-12-14,False,0.0,,,None,None
100534,2023-12-02,C0018,Accessories,Screen Protector,$14.10,1,Paid,14.1,2023-12-02,False,1.0,Not working as expected,"The product is defective.
This should not happen.
Please help.

Sent from my Android device

Ref: TX-100534",Connectivity,Neutral
100661,2023-12-05,C0029,Smart Home,NordLock Pro,247,2,Paid,247.0,2023-12-05,False,0.0,,,None,None
100781,2023-12-07,C0003,Accessories,Charger,$36.62,2,Paid,36.62,2023-12-07,False,0.0,,,None,None
100665,2023-12-05,C0004,Accessories,Screen Protector,"5,76 EUR",1,Paid,5.76,2023-12-05,False,0.0,,,None,None
101120,2023-12-14,C0001,Smart Home,NordLock Pro,226,1,Paid,226.0,2023-12-14,False,0.0,,,None,None
100382,28/11/2023,C0147,Accessories,Charger,"39,53 EUR",2,Paid,39.53,2023-11-28,False,0.0,,,None,None
100642,2023-12-04,C0022,Accessories,Phone Case,"19,39 EUR",3,Paid,19.39,2023-12-04,False,0.0,,,None,None
101182,2023-11-30,C0303,Accessories,Wireless Mouse,23,1,Paid,23.0,2023-11-30,False,0.0,,,None,None
100449,2023-11-30,C0003,Smart Home,NordLock Pro,239.22,1,Paid,239.22,2023-11-30,False,0.0,,,None,None
100511,2023-12-01,C0001,Accessories,Laptop Sleeve,"42,01 EUR",2,Paid,42.01,2023-12-01,False,0.0,,,None,None
100424,2023-11-29,C0006,Accessories,USB-C Cable,"8,80 EUR",1,Paid,8.8,2023-11-29,False,0.0,,,None,None
100007,15/11/2023,C0003,Accessories,Phone Case,28.53,1,Paid,28.53,2023-11-15,False,0.0,,,None,None
100098,2023-11-19,C0019,Electronics,TV Pro,$1266.38,1,Paid,1266.38,2023-11-19,False,0.0,,,None,None
100411,2023-11-29,C0065,Electronics,Tablet A,"440,32 EUR",1,Pending,440.32,2023-11-29,False,0.0,,,None,None
100159,2023-11-21,C0012,Electronics,Tablet A,"394,06 EUR",1,Paid,394.06,2023-11-21,False,0.0,,,None,None
100919,2023-12-10,C0001,Electronics,TV Pro,"970,60 EUR",1,Paid,970.6,2023-12-10,False,0.0,,,None,None
100653,2023-12-05,C0020,Accessories,Screen Protector,9.37,2,Paid,9.37,2023-12-05,False,0.0,,,None,None
100033,2023-11-16,C0007,Electronics,Tablet A,615,1,Paid,615.0,2023-11-16,False,0.0,,,None,None
100799,2023-12-08,C0011,Smart Home,NordPlug,"24,63 EUR",1,Paid,24.63,2023-12-08,False,1.0,Battery problem with my lock,"<p>My smart lock battery drains in 48 hours.
I changed batteries and it still drains quickly.
Please help ASAP.

Sent from my iPhone</p>

Ref: TX-100799",Battery Issue,Negative
100760,2023-12-07,C0002,Electronics,Tablet A,"520,14 EUR",1,Paid,520.14,2023-12-07,False,0.0,,,None,None
100522,2023-12-02,C0003,Accessories,Charger,"39,36 EUR",1,Paid,39.36,2023-12-02,False,0.0,,,None,None
100335,2023-11-27,C0040,Electronics,Smartphone Z,1004.81,1,Paid,1004.81,2023-11-27,False,0.0,,,None,None
100491,01/12/2023,C0001,Accessories,Accessory Bundle,45.49,2,Paid,45.49,2023-12-01,False,0.0,,,None,None
100259,2023-11-24,C0013,Electronics,Smartphone Z,718.54,1,Paid,718.54,2023-11-24,False,0.0,,,None,None
100172,2023-11-22,C0007,Accessories,Laptop Sleeve,39.84,1,Paid,39.84,2023-11-22,False,0.0,,,None,None
101108,2023-12-14,C0024,Accessories,Laptop Sleeve,"19,89 EUR",4,Pending,19.89,2023-12-14,False,0.0,,,None,None
100548,2023-12-02,C0001,Electronics,TV Pro,"1184,65 EUR",1,Paid,1184.65,2023-12-02,False,0.0,,,None,None
100237,2023-11-24,C0301,Accessories,Laptop Sleeve,38.99,1,Paid,38.99,2023-11-24,False,0.0,,,None,None
100385,2023-11-28,C0015,Accessories,Laptop Sleeve,"24,00 EUR",3,Paid,24.0,2023-11-28,False,0.0,,,None,None
100659,2023-12-05,C0008,Accessories,Charger,"40,01 EUR",1,Paid,40.01,2023-12-05,False,0.0,,,None,None
100024,2023-11-16,C0002,Accessories,Charger,"25,01 EUR",1,Paid,25.01,2023-11-16,False,0.0,,,None,None
100809,2023-12-08,C0158,Electronics,Laptop X,"1 730,99 EUR",1,Paid,1730.99,2023-12-08,False,0.0,,,None,None
101012,2023-12-12,C0001,Electronics,Laptop X,"1535,84 EUR",1,Failed,1535.84,2023-12-12,False,0.0,,,None,None
100885,09/12/2023,C0010,Electronics,TV Pro,"947,14 EUR",1,Paid,947.14,2023-12-09,False,0.0,,,None,None
100546,02/12/2023,C0079,Accessories,USB-C Cable,"9,98 EUR",1,Paid,9.98,2023-12-02,False,0.0,,,None,None
100641,04/12/2023,C0015,Accessories,Laptop Sleeve,33.86,3,Paid,33.86,2023-12-04,False,0.0,,,None,None
100478,2023-11-30,C0003,Electronics,TV Pro,"1393,62 EUR",1,Paid,1393.62,2023-11-30,False,0.0,,,None,None
101178,2023-12-13,C0001,Accessories,Charger,46.12,2,Paid,46.12,2023-12-13,False,0.0,,,None,None
100680,2023-12-05,C0001,Electronics,Laptop X,1719,1,Paid,1719.0,2023-12-05,False,0.0,,,None,None
100830,2023-12-08,C0016,Accessories,Laptop Sleeve,39,1,Paid,39.0,2023-12-08,False,1.0,NordLock Pro pairing issue,"<p>The app cannot connect to WiFi.
I tried resetting but it fails.
Please advise.

Sent from my Android device</p><br><p>This is unacceptable.</p>

My order #100830.",Connectivity,Negative
100154,21/11/2023,C0014,Accessories,Accessory Bundle,46.00,1,Paid,46.0,2023-11-21,False,0.0,,,None,None
100123,2023-11-20,C0314,Accessories,Laptop Sleeve,"33,17 EUR",1,Paid,33.17,2023-11-20,False,0.0,,,None,None
100698,2023-12-06,C0001,Electronics,TV Pro,1205,1,Paid,1205.0,2023-12-06,False,0.0,,,None,None
100121,19/11/2023,C0113,Smart Home,NordPlug,"23,36 EUR",2,Paid,23.36,2023-11-19,False,0.0,,,None,None
100904,10/12/2023,C0149,Electronics,TV Pro,1184.42,1,Paid,1184.42,2023-12-10,False,0.0,,,None,None
100464,2023-11-30,C0001,Accessories,Laptop Sleeve,20,2,Paid,20.0,2023-11-30,False,0.0,,,None,None
101121,14/12/2023,C0067,Electronics,TV Pro,"928,65 EUR",1,Paid,928.65,2023-12-14,False,0.0,,,None,None
100628,2023-12-04,C0187,Accessories,Wireless Mouse,"19,96 EUR",1,Paid,19.96,2023-12-04,False,1.0,Very disappointed,"<p>The product is broken.
Poor quality.
I want a replacement.

<br><br>--<br>NordTech Customer</p>

My order #100628.",Defect / Refund,Neutral
101075,2023-12-13,C0002,Smart Home,NordCam Mini,"62,13 EUR",1,Paid,62.13,2023-12-13,False,0.0,,,None,None
100985,2023-12-11,C0086,Electronics,Tablet A,"783,57 EUR",1,Paid,783.57,2023-12-11,False,0.0,,,None,None
100520,2023-12-02,C0021,Accessories,USB-C Cable,10.00,1,Paid,10.0,2023-12-02,False,0.0,,,None,None
100951,11/12/2023,C0054,Accessories,Accessory Bundle,"96,87 EUR",2,Paid,96.87,2023-12-11,False,0.0,,,None,None
100966,2023-12-11,C0035,Accessories,Phone Case,"16,30 EUR",1,Paid,16.3,2023-12-11,False,0.0,,,None,None
101177,2023-11-28,C0037,Electronics,Tablet A,"556,99 EUR",1,Paid,556.99,2023-11-28,False,0.0,,,None,None
100587,2023-12-03,C0001,Accessories,Screen Protector,$10.14,2,Paid,10.14,2023-12-03,False,0.0,,,None,None
101046,13/12/2023,C0273,Accessories,Charger,"34,08 EUR",1,Paid,34.08,2023-12-13,False,0.0,,,None,None
100787,2023-12-07,C0003,Electronics,NoiseCancel Headphones,"273,02 EUR",1,Pending,273.02,2023-12-07,False,0.0,,,None,None
100523,2023-12-02,C0025,Electronics,Smartphone Z,940.92,1,Paid,940.92,2023-12-02,False,3.0,Can't open the door | Battery dies in 2 days | NordLock Pro won't unlock,"I am stuck outside — the lock does not respond.<br>The app shows not responding.<br>I can't get into my house.<br><br>Sent from my Android device

My order #100523. | <p>My smart lock dies in 2 days.
I changed batteries and it still dies.
Please help ASAP.
Also: battery drains.

<p>Thanks</p><p>Customer</p></p>

My order #100523. | <p>I am locked out — the lock does not respond.
The app shows offline.
I need immediate assistance.

<p>Thanks</p><p>Customer</p></p><br><p>This is unacceptable.</p>

Ref: TX-100523",Battery Issue,Negative
100358,2023-11-28,C0001,Accessories,Wireless Mouse,56.52,1,Paid,56.52,2023-11-28,False,0.0,,,None,None
100949,11/12/2023,C0046,Smart Home,NordLock Pro,204.69,1,Paid,204.69,2023-12-11,False,0.0,,,None,None
101041,13/12/2023,C0002,Smart Home,NordLock Pro,219.45,1,Paid,219.45,2023-12-13,False,0.0,,,None,None
100151,2023-11-21,C0002,Electronics,Smartphone Z,"752,21 EUR",1,Paid,752.21,2023-11-21,False,0.0,,,None,None
100529,2023-12-02,C0017,Electronics,Tablet A,326,1,Paid,326.0,2023-12-02,False,0.0,,,None,None
100181,2023-11-22,C0001,Electronics,NoiseCancel Headphones,185.90,1,Pending,185.9,2023-11-22,False,0.0,,,None,None
100292,2023-11-25,C0082,Electronics,NoiseCancel Headphones,"258,19 EUR",2,Paid,258.19,2023-11-25,False,1.0,NordLock Pro battery drains fast,"My smart lock dies in 2 days.<br>I changed batteries and it still dies.<br>This is unacceptable.<br><br>Sent from my iPhone

Order number: 100292",Battery Issue,Negative
100650,2023-12-05,C0054,Smart Home,NordLock Pro,213.11,1,Paid,213.11,2023-12-05,True,0.0,,,None,None
100867,2023-12-09,C0029,Smart Home,NordLock Pro,"209,05 EUR",1,Paid,209.05,2023-12-09,False,0.0,,,None,None
100175,2023-11-22,C0002,Accessories,Laptop Sleeve,"27,74 EUR",1,Paid,27.74,2023-11-22,False,0.0,,,None,None
100743,2023-12-07,C0097,Accessories,Laptop Sleeve,20.81,1,Paid,20.81,2023-12-07,False,1.0,Tracking shows no updates,"<p>My delivery is delayed.
Tracking shows in transit for days.
Please update me.

<br><br>--<br>NordTech Customer</p>

My order #100743.",Delivery,Neutral
100258,2023-11-24,C0099,Smart Home,NordLock Pro,"214,74 EUR",1,Paid,214.74,2023-11-24,False,2.0,Delivery delay | Delivery delay,"My delivery is late.<br>Tracking shows no updates.<br>Please update me.<br><br>Sent from my Android device

My order #100258. | My delivery is late.<br>Tracking shows no updates.<br>Please update me.<br><br>Sent from my Android device

My order #100258.",Delivery,Neutral
100692,2023-12-06,C0206,Electronics,Laptop X,"1 379,55 EUR",1,Paid,1379.55,2023-12-06,False,0.0,,,None,None
100862,2023-12-09,C0003,Accessories,USB-C Cable,"17,87 EUR",1,Paid,17.87,2023-12-09,False,0.0,,,None,None
100022,2023-11-16,C0003,Electronics,NoiseCancel Headphones,"176,57 EUR",1,Paid,176.57,2023-11-16,False,0.0,,,None,None
101013,2023-12-12,C0001,Accessories,USB-C Cable,13,3,Paid,13.0,2023-12-12,False,0.0,,,None,None
101149,06/12/2023,C0009,Smart Home,NordTherm,106.57,1,Failed,106.57,2023-12-06,False,0.0,,,None,None
100783,2023-12-07,C0211,Smart Home,NordLock Pro,"183,60 EUR",1,Pending,183.6,2023-12-07,False,0.0,,,None,None
100482,30/11/2023,C0007,Electronics,NoiseCancel Headphones,"176,13 EUR",1,Paid,176.13,2023-11-30,False,0.0,,,None,None
100475,2023-11-30,C0222,Electronics,NoiseCancel Headphones,"254,73 EUR",1,Paid,254.73,2023-11-30,False,0.0,,,None,None
100804,2023-12-08,C0006,Accessories,Laptop Sleeve,"29,83 EUR",3,Paid,29.83,2023-12-08,False,0.0,,,None,None
100119,2023-11-19,C0001,Accessories,Accessory Bundle,27,2,Paid,27.0,2023-11-19,False,0.0,,,None,None
100179,2023-11-22,C0004,Electronics,Laptop X,1755.32,2,Paid,1755.32,2023-11-22,False,0.0,,,None,None
101159,2023-12-12,C0003,Electronics,NoiseCancel Headphones,"308,13 EUR",1,Paid,308.13,2023-12-12,False,0.0,,,None,None
100338,27/11/2023,C0003,Electronics,NoiseCancel Headphones,"321,06 EUR",1,Paid,321.06,2023-11-27,False,0.0,,,None,None
101019,12/12/2023,C0002,Accessories,Accessory Bundle,75,2,Paid,75.0,2023-12-12,False,0.0,,,None,None
100298,2023-11-26,C0006,Electronics,NoiseCancel Headphones,236.41,1,Paid,236.41,2023-11-26,False,0.0,,,None,None
101200,2023-12-11,C0024,Smart Home,NordLock Pro,206,1,Paid,206.0,2023-12-11,False,2.0,Very disappointed | Very disappointed,"The product is not working.<br>Very disappointed.<br>Please help.<br><br>Sent from my iPhone

Order number: 101200 | The product is not working.<br>Very disappointed.<br>Please help.<br><br>Sent from my iPhone

Order number: 101200",Connectivity,Negative
101118,2023-12-14,C0001,Accessories,Accessory Bundle,"78,76 EUR",2,Paid,78.76,2023-12-14,False,0.0,,,None,None
100110,2023-11-19,C0001,Electronics,Smartphone Z,"1007,22 EUR",1,Paid,1007.22,2023-11-19,False,0.0,,,None,None
100414,2023-11-29,C0001,Accessories,Screen Protector,8.16,3,Paid,8.16,2023-11-29,False,0.0,,,None,None
101111,2023-12-14,C0002,Smart Home,NordLock Pro,227,1,Paid,227.0,2023-12-14,False,0.0,,,None,None
100543,02/12/2023,C0270,Smart Home,NordLock Pro,"190,15 EUR",1,Paid,190.15,2023-12-02,False,0.0,,,None,None
100888,2023-12-09,C0001,Electronics,Smartphone Z,"897,04 EUR",1,Paid,897.04,2023-12-09,False,0.0,,,None,None
100306,2023-11-26,C0012,Smart Home,NordCam Mini,75,2,Paid,75.0,2023-11-26,False,1.0,Not working as expected,"The product is not working.
Poor quality.
Please help.

Sent from my iPhone

Order number: 100306",Defect / Refund,Neutral
100968,2023-12-11,C0106,Electronics,Laptop X,1406.83,1,Paid,1406.83,2023-12-11,False,2.0,Refund for my purchase | Can't connect the app,"<p>I want to get a refund for this product.
It is defective.
I need my money back.
Also: want a refund.

Sent from my Android device</p>

My order #100968. | The app cannot connect to the lock.
I tried reinstalling the app but it fails.
It worked once and then stopped.
Also: pairing.

<p>Thanks</p><p>Customer</p>

My order #100968.",Connectivity,Negative
100921,10/12/2023,C0002,Smart Home,NordPlug,16.05,1,Paid,16.05,2023-12-10,False,0.0,,,None,None
100021,2023-11-15,C0006,Smart Home,NordTherm,138.07,1,Paid,138.07,2023-11-15,False,0.0,,,None,None
100981,11/12/2023,C0014,Electronics,Tablet A,543.89,1,Paid,543.89,2023-12-11,False,0.0,,,None,None
100671,2023-12-05,C0010,Smart Home,NordLock Pro,$228.29,1,Paid,228.29,2023-12-05,False,0.0,,,None,None
101130,14/12/2023,C0002,Accessories,Laptop Sleeve,19,1,Paid,19.0,2023-12-14,False,0.0,,,None,None
100102,2023-11-19,C0010,Accessories,Laptop Sleeve,"24,31 EUR",1,Paid,24.31,2023-11-19,False,0.0,,,None,None
100140,2023-11-21,C0199,Smart Home,NordLock Pro,"222,11 EUR",1,Paid,222.11,2023-11-21,True,4.0,Can't connect the app | Battery problem with my lock | NordLock Pro battery drains fast | Delivery delay,"The app cannot connect to the lock.
I tried pairing again but it fails.
It worked once and then stopped.

—
Regards,
A very unhappy customer

My order #100140. | My NordLock Pro battery drains in 48 hours.
I tried new batteries and it still dies.
I can't rely on this.

Sent from my Android device

My order #100140. | <p>My smart lock dies in a day.
I tried new batteries and it still dies.
This is unacceptable.

Sent from my iPhone</p>

Ref: TX-100140 | My delivery is late.
Tracking shows in transit for days.
Where is my order?

<br><br>--<br>NordTech Customer

My order #100140.",Battery Issue,Negative
100224,2023-11-24,C0001,Electronics,TV Pro,"1 442,67 EUR",1,Paid,1442.67,2023-11-24,False,0.0,,,None,None
100922,10/12/2023,C0053,Accessories,Charger,35.94,3,Paid,35.94,2023-12-10,False,0.0,,,None,None
100553,2023-12-02,C0019,Smart Home,NordLock Pro,188.09,1,Paid,188.09,2023-12-02,False,0.0,,,None,None
100394,28/11/2023,C0016,Electronics,TV Pro,"1256,68 EUR",1,Paid,1256.68,2023-11-28,False,0.0,,,None,None
100461,2023-11-30,C0076,Electronics,Smartphone Z,989.24,2,Paid,989.24,2023-11-30,False,0.0,,,None,None
100856,2023-12-09,C0001,Accessories,Accessory Bundle,40.96,1,Paid,40.96,2023-12-09,False,0.0,,,None,None
100720,2023-12-06,C0002,Smart Home,NordLock Pro,208,1,Failed,208.0,2023-12-06,False,0.0,,,None,None
100206,2023-11-23,C0002,Electronics,Laptop X,1577,1,Paid,1577.0,2023-11-23,False,0.0,,,None,None
100912,10/12/2023,C0001,Electronics,Tablet A,342.14,1,Paid,342.14,2023-12-10,False,0.0,,,None,None
100589,03/12/2023,C0320,Accessories,USB-C Cable,"12,34 EUR",1,Paid,12.34,2023-12-03,False,0.0,,,None,None
100038,2023-11-16,C0002,Accessories,Phone Case,$12.88,2,Paid,12.88,2023-11-16,False,0.0,,,None,None
101017,12/12/2023,C0002,Accessories,Laptop Sleeve,$21.14,1,Failed,21.14,2023-12-12,False,0.0,,,None,None
100361,28/11/2023,C0004,Smart Home,NordLock Pro,"246,71 EUR",1,Paid,246.71,2023-11-28,False,0.0,,,None,None
101069,2023-12-13,C0004,Accessories,Accessory Bundle,"82,41 EUR",1,Paid,82.41,2023-12-13,False,0.0,,,None,None
100574,2023-12-03,C0071,Electronics,Smartphone Z,819.94,1,Paid,819.94,2023-12-03,False,1.0,App cannot connect to WiFi,"The app will not connect to the lock.
I tried pairing again but it fails.
It worked once and then stopped.
Also: connectivity.

—
Regards,
A very unhappy customer

Order number: 100574",Connectivity,Negative
101089,2023-12-14,C0107,Electronics,TV Pro,"1 209,60 EUR",1,Paid,1209.6,2023-12-14,False,0.0,,,None,None
100596,2023-12-04,C0158,Accessories,Charger,19.56,1,Paid,19.56,2023-12-04,False,1.0,Can't connect the app,"The app cannot connect to the lock.
I tried resetting but it fails.
Please advise.

<br><br>--<br>NordTech Customer

Ref: TX-100596",Connectivity,Neutral
100125,20/11/2023,C0001,Accessories,Accessory Bundle,"52,50 EUR",2,Paid,52.5,2023-11-20,False,0.0,,,None,None
100624,2023-12-04,C0001,Smart Home,NordCam Mini,91,1,Paid,91.0,2023-12-04,False,0.0,,,None,None
100396,29/11/2023,C0296,Accessories,Accessory Bundle,"52,01 EUR",2,Paid,52.01,2023-11-29,False,0.0,,,None,None
100897,10/12/2023,C0110,Smart Home,NordLock Pro,$245.24,1,Paid,245.24,2023-12-10,False,0.0,,,None,None
100185,22/11/2023,C0001,Smart Home,NordTherm,127.55,1,Paid,127.55,2023-11-22,False,0.0,,,None,None
100056,17/11/2023,C0014,Accessories,Charger,"15,88 EUR",3,Paid,15.88,2023-11-17,False,0.0,,,None,None
100882,2023-12-09,C0003,Electronics,TV Pro,$1195.36,1,Paid,1195.36,2023-12-09,False,0.0,,,None,None
101027,2023-12-12,C0001,Smart Home,NordLock Pro,244,1,Paid,244.0,2023-12-12,False,0.0,,,None,None
101112,14/12/2023,C0001,Accessories,Laptop Sleeve,23.93,1,Paid,23.93,2023-12-14,False,0.0,,,None,None
100166,2023-11-22,C0203,Accessories,USB-C Cable,16.30,3,Paid,16.3,2023-11-22,False,0.0,,,None,None
101014,12/12/2023,C0291,Smart Home,NordLock Pro,200,2,Paid,200.0,2023-12-12,False,0.0,,,None,None
100116,2023-11-19,C0009,Electronics,Smartphone Z,"1065,43 EUR",1,Paid,1065.43,2023-11-19,False,0.0,,,None,None
100311,2023-11-26,C0191,Electronics,NoiseCancel Headphones,318,1,Paid,318.0,2023-11-26,False,2.0,Tracking shows no updates | Battery problem with my lock,"My delivery is stuck.<br>Tracking shows in transit for days.<br>Please update me.<br><br>—<br>Regards,<br>A very unhappy customer

Order number: 100311 | My smart lock battery drains in 2 days.
I tried new batteries and it still dies.
I can't rely on this.

<p>Thanks</p><p>Customer</p>

My order #100311.",Battery Issue,Negative
100909,2023-12-10,C0080,Electronics,TV Pro,"1355,85 EUR",1,Paid,1355.85,2023-12-10,False,0.0,,,None,None
100476,2023-11-30,C0016,Smart Home,NordLock Pro,"223,28 EUR",1,Paid,223.28,2023-11-30,False,0.0,,,None,None
100421,2023-11-29,C0003,Accessories,Screen Protector,"14,39 EUR",1,Paid,14.39,2023-11-29,False,0.0,,,None,None
100199,23/11/2023,C0003,Electronics,NoiseCancel Headphones,234,1,Paid,234.0,2023-11-23,False,0.0,,,None,None
100555,2023-12-02,C0038,Electronics,NoiseCancel Headphones,"246,91 EUR",1,Paid,246.91,2023-12-02,False,0.0,,,None,None
101174,2023-11-29,C0008,Accessories,Screen Protector,8.41,3,Paid,8.41,2023-11-29,True,0.0,,,None,None
100219,2023-11-23,C0249,Electronics,Smartphone Z,903,1,Paid,903.0,2023-11-23,False,2.0,Return request | Delivery delay,"I want to get a refund for this product.
It is not as described.
Please send return instructions.

<p>Thanks</p><p>Customer</p>

Ref: TX-100219 | My delivery is late.
Tracking shows pending.
Please update me.

Sent from my Android device

Order number: 100219",Delivery,Negative
100212,2023-11-23,C0014,Accessories,Screen Protector,6.11,2,Paid,6.11,2023-11-23,False,0.0,,,None,None
100635,04/12/2023,C0003,Electronics,Laptop X,$1648.66,1,Paid,1648.66,2023-12-04,False,0.0,,,None,None
100840,2023-12-08,C0004,Accessories,Wireless Mouse,18.18,1,Paid,18.18,2023-12-08,False,0.0,,,None,None
100727,2023-12-06,C0050,Electronics,Laptop X,1588.34,1,Paid,1588.34,2023-12-06,True,0.0,,,None,None
100055,2023-11-17,C0002,Accessories,Accessory Bundle,"94,78 EUR",1,Pending,94.78,2023-11-17,False,0.0,,,None,None
100532,02/12/2023,C0078,Smart Home,NordLock Pro,185.66,2,Failed,185.66,2023-12-02,False,0.0,,,None,None
100815,2023-12-08,C0282,Smart Home,NordLock Pro,210.20,1,Paid,210.2,2023-12-08,True,5.0,Product defective | NordLock Pro pairing issue | NordLock Pro pairing issue | Battery dies in 2 days | NordLock Pro won't unlock,"<p>The product is defective.
Very disappointed.
I want a replacement.
Also: defective.

Sent from my Android device</p>

My order #100815. | The app cannot connect to WiFi.
I tried resetting but it fails.
Please advise.

—
Regards,
A very unhappy customer

Order number: 100815 | The app will not connect to WiFi.<br>I tried resetting but it fails.<br>Is there a fix?<br><br>Sent from my Android device

My order #100815. | <p>My smart lock battery drains in a day.
I changed batteries and it still drains quickly.
This is unacceptable.

<br><br>--<br>NordTech Customer</p>

My order #100815. | I am locked out — the lock does not respond.<br>The app shows offline.<br>I need immediate assistance.<br><br>Sent from my Android device

My order #100815.",Battery Issue,Negative
100649,2023-12-05,C0300,Accessories,Phone Case,16.63,1,Paid,16.63,2023-12-05,False,0.0,,,None,None
100908,2023-12-10,C0021,Accessories,Phone Case,17.63,1,Paid,17.63,2023-12-10,False,0.0,,,None,None
100571,2023-12-03,C0023,Electronics,Tablet A,$370.25,2,Paid,370.25,2023-12-03,False,1.0,Tracking shows no updates,"<p>My delivery is late.
Tracking shows in transit for days.
This is taking too long.
Also: tracking.

Sent from my Android device</p>

My order #100571.",Delivery,Neutral
100927,2023-12-10,C0062,Accessories,Wireless Mouse,32.09,1,Paid,32.09,2023-12-10,False,1.0,NordLock Pro pairing issue,"<p>The app will not connect to WiFi.
I tried reinstalling the app but it fails.
Is there a fix?

<p>Thanks</p><p>Customer</p></p>

My order #100927.",Connectivity,Neutral
100330,2023-11-27,C0006,Smart Home,NordLock Pro,$180.97,1,Paid,180.97,2023-11-27,False,0.0,,,None,None
100493,2023-12-01,C0260,Accessories,Charger,"36,46 EUR",2,Paid,36.46,2023-12-01,False,0.0,,,None,None
100691,06/12/2023,C0003,Electronics,Smartphone Z,901.62,1,Paid,901.62,2023-12-06,False,0.0,,,None,None
100751,07/12/2023,C0001,Accessories,Phone Case,"13,03 EUR",1,Paid,13.03,2023-12-07,False,0.0,,,None,None
100832,08/12/2023,C0051,Accessories,Accessory Bundle,40.78,1,Paid,40.78,2023-12-08,False,0.0,,,None,None
100148,2023-11-21,C0001,Electronics,Smartphone Z,935.86,1,Pending,935.86,2023-11-21,False,0.0,,,None,None
100255,2023-11-24,C0034,Electronics,NoiseCancel Headphones,"264,94 EUR",1,Paid,264.94,2023-11-24,False,0.0,,,None,None
100829,2023-12-08,C0013,Smart Home,NordLock Pro,"209,14 EUR",1,Paid,209.14,2023-12-08,False,1.0,Tracking shows no updates,"<p>My delivery is stuck.
Tracking shows no updates.
Please update me.
Also: where is my order.

<br><br>--<br>NordTech Customer</p><br><p>This is unacceptable.</p>

Order number: 100829",Delivery,Negative
100566,2023-12-03,C0064,Electronics,Laptop X,1695.77,1,Paid,1695.77,2023-12-03,False,3.0,Battery problem with my lock | Return request | Battery dies in 2 days,"My NordLock Pro battery drains in 48 hours.
I changed batteries and it still drains quickly.
I can't rely on this.

—
Regards,
A very unhappy customer

Order number: 100566 | I want to return this product.<br>It is defective.<br>How do I start an RMA?<br>Also: want a refund.<br><br>—<br>Regards,<br>A very unhappy customer

My order #100566. | <p>My smart lock dies in a day.
I tried new batteries and it still drains quickly.
This is unacceptable.
Also: 2 days.

<br><br>--<br>NordTech Customer</p>

Order number: 100566",Battery Issue,Negative
100393,2023-11-28,C0238,Electronics,TV Pro,"1338,77 EUR",1,Paid,1338.77,2023-11-28,False,1.0,Tracking shows no updates,"My delivery is delayed.<br>Tracking shows no updates.<br>Please update me.<br>Also: courier.<br><br>Sent from my Android device

My order #100393.",Delivery,Neutral
100836,2023-12-08,C0181,Smart Home,NordCam Mini,"53,95 EUR",1,Paid,53.95,2023-12-08,False,0.0,,,None,None
101051,2023-12-13,C0002,Electronics,Laptop X,$1696.76,1,Paid,1696.76,2023-12-13,False,0.0,,,None,None
100231,24/11/2023,C0001,Electronics,NoiseCancel Headphones,"182,17 EUR",2,Paid,182.17,2023-11-24,False,0.0,,,None,None
100147,2023-11-21,C0006,Electronics,TV Pro,1399.86,1,Paid,1399.86,2023-11-21,False,0.0,,,None,None
101153,2023-11-30,C0004,Electronics,NoiseCancel Headphones,"316,19 EUR",1,Paid,316.19,2023-11-30,False,0.0,,,None,None
100168,2023-11-22,C0021,Accessories,USB-C Cable,"7,78 EUR",1,Paid,7.78,2023-11-22,False,0.0,,,None,None
101185,2023-11-25,C0033,Electronics,Smartphone Z,948.32,1,Paid,948.32,2023-11-25,False,2.0,NordLock Pro won't unlock | NordLock Pro won't unlock,"I am stuck outside — the lock will not unlock.
The app shows offline.
This is urgent.
Also: can't get in.

—
Regards,
A very unhappy customer

Order number: 101185 | I am stuck outside — the lock will not unlock.
The app shows offline.
This is urgent.
Also: can't get in.

—
Regards,
A very unhappy customer

Order number: 101185",Connectivity,Negative
100902,2023-12-10,C0004,Electronics,Smartphone Z,$1084.69,1,Paid,1084.69,2023-12-10,False,0.0,,,None,None
100599,2023-12-04,C0001,Electronics,NoiseCancel Headphones,$308.58,1,Paid,308.58,2023-12-04,True,0.0,,,None,None
101055,2023-12-13,C0002,Smart Home,NordLock Pro,"246,13 EUR",1,Paid,246.13,2023-12-13,False,0.0,,,None,None
101011,12/12/2023,C0002,Electronics,TV Pro,$1098.61,1,Paid,1098.61,2023-12-12,False,0.0,,,None,None
100557,2023-12-03,C0003,Electronics,NoiseCancel Headphones,186.46,1,Paid,186.46,2023-12-03,True,0.0,,,None,None
100687,05/12/2023,C0006,Accessories,Laptop Sleeve,"33,29 EUR",2,Paid,33.29,2023-12-05,False,0.0,,,None,None
100302,26/11/2023,C0057,Smart Home,NordCam Mini,$96.99,1,Failed,96.99,2023-11-26,False,0.0,,,None,None
100400,29/11/2023,C0003,Accessories,Laptop Sleeve,36.68,2,Paid,36.68,2023-11-29,False,0.0,,,None,None
100664,05/12/2023,C0012,Accessories,Charger,$47.42,1,Paid,47.42,2023-12-05,False,0.0,,,None,None
100817,08/12/2023,C0002,Accessories,Phone Case,16.73,2,Paid,16.73,2023-12-08,False,0.0,,,None,None
100652,2023-12-05,C0011,Electronics,Tablet A,"314,93 EUR",1,Paid,314.93,2023-12-05,False,0.0,,,None,None
100163,2023-11-22,C0004,Accessories,Screen Protector,10.08,2,Paid,10.08,2023-11-22,False,0.0,,,None,None
100469,2023-11-30,C0001,Electronics,NoiseCancel Headphones,260.09,1,Paid,260.09,2023-11-30,False,0.0,,,None,None
100762,2023-12-07,C0009,Electronics,NoiseCancel Headphones,"225,04 EUR",1,Paid,225.04,2023-12-07,False,0.0,,,None,None
100598,2023-12-04,C0070,Accessories,Wireless Mouse,"22,02 EUR",1,Paid,22.02,2023-12-04,True,1.0,Locked out of my home,"I am stuck outside — the lock will not unlock.<br>The app shows not responding.<br>I need immediate assistance.<br><br>Sent from my Android device

My order #100598.",Connectivity,Negative
101044,13/12/2023,C0001,Smart Home,NordLock Pro,"185,80 EUR",1,Paid,185.8,2023-12-13,False,0.0,,,None,None
100348,27/11/2023,C0220,Accessories,Phone Case,"31,01 EUR",4,Paid,31.01,2023-11-27,False,0.0,,,None,None
100572,03/12/2023,C0002,Smart Home,NordLock Pro,"192,26 EUR",1,Paid,192.26,2023-12-03,False,0.0,,,None,None
100281,2023-11-25,C0017,Smart Home,NordCam Mini,"91,10 EUR",1,Paid,91.1,2023-11-25,False,0.0,,,None,None
100899,2023-12-10,C0001,Accessories,USB-C Cable,$8.25,1,Paid,8.25,2023-12-10,False,0.0,,,None,None
101070,13/12/2023,C0023,Smart Home,NordLock Pro,216.40,1,Paid,216.4,2023-12-13,False,0.0,,,None,None
100716,06/12/2023,C0036,Accessories,Charger,"44,54 EUR",4,Paid,44.54,2023-12-06,False,0.0,,,None,None
100010,2023-11-15,C0001,Accessories,Charger,"32,57 EUR",3,Paid,32.57,2023-11-15,False,0.0,,,None,None
100764,2023-12-07,C0006,Electronics,Smartphone Z,"998,04 EUR",1,Paid,998.04,2023-12-07,False,0.0,,,None,None
100271,2023-11-25,C0008,Electronics,Laptop X,1718.34,1,Paid,1718.34,2023-11-25,False,0.0,,,None,None
100984,11/12/2023,C0124,Electronics,NoiseCancel Headphones,"247,73 EUR",1,Paid,247.73,2023-12-11,False,0.0,,,None,None
100495,2023-12-01,C0004,Electronics,Smartphone Z,$795.93,1,Paid,795.93,2023-12-01,False,0.0,,,None,None
101022,2023-12-12,C0076,Electronics,Tablet A,"565,36 EUR",1,Paid,565.36,2023-12-12,False,2.0,NordLock Pro pairing issue | Return request,"The app will not connect to WiFi.
I tried reinstalling the app but it fails.
Please advise.

Sent from my Android device

My order #101022. | <p>I want to get a refund for this product.
It is defective.
How do I start an RMA?

—
Regards,
A very unhappy customer</p><br><p>This is unacceptable.</p>

Order number: 101022",Connectivity,Negative
100286,2023-11-25,C0007,Electronics,Tablet A,732.66,1,Paid,732.66,2023-11-25,False,0.0,,,None,None
100542,2023-12-02,C0077,Accessories,Laptop Sleeve,"41,10 EUR",1,Pending,41.1,2023-12-02,False,0.0,,,None,None
100977,2023-12-11,C0017,Smart Home,NordLock Pro,183,1,Paid,183.0,2023-12-11,False,3.0,NordLock Pro pairing issue | Can't open the door | Tracking shows no updates,"<p>The app will not connect to the lock.
I tried reinstalling the app but it fails.
Please advise.

<p>Thanks</p><p>Customer</p></p>

Ref: TX-100977 | I am locked out — the lock will not unlock.<br>The app shows offline.<br>This is urgent.<br><br>Sent from my Android device

Ref: TX-100977 | <p>My delivery is delayed.
Tracking shows pending.
Please update me.

Sent from my iPhone</p><br><p>Please help!</p>

Order number: 100977",Connectivity,Negative
100445,2023-11-30,C0001,Accessories,Accessory Bundle,"34,98 EUR",1,Paid,34.98,2023-11-30,False,0.0,,,None,None
101180,04/12/2023,C0015,Accessories,Laptop Sleeve,33.86,3,Paid,33.86,2023-12-04,False,0.0,,,None,None
100933,2023-12-11,C0003,Accessories,Laptop Sleeve,41.18,3,Paid,41.18,2023-12-11,False,0.0,,,None,None
101073,2023-12-13,C0015,Smart Home,NordLock Pro,"214,13 EUR",1,Paid,214.13,2023-12-13,False,2.0,Battery dies in 2 days | Battery dies in 2 days,"<p>My NordLock Pro dies in 48 hours.
I tried new batteries and it still dies.
This is unacceptable.

Sent from my iPhone</p><br><p>ASAP</p>

Ref: TX-101073 | <p>My smart lock dies in 2 days.
I changed batteries and it still dies.
I can't rely on this.
Also: battery drains.

—
Regards,
A very unhappy customer</p>

Ref: TX-101073",Battery Issue,Negative
100100,2023-11-19,C0143,Accessories,Charger,21.14,1,Paid,21.14,2023-11-19,False,0.0,,,None,None
100847,2023-12-09,C0136,Accessories,Laptop Sleeve,43.74,1,Paid,43.74,2023-12-09,False,0.0,,,None,None
100496,2023-12-01,C0032,Electronics,NoiseCancel Headphones,282,1,Paid,282.0,2023-12-01,False,0.0,,,None,None
100433,2023-11-29,C0027,Electronics,NoiseCancel Headphones,306.26,1,Paid,306.26,2023-11-29,False,0.0,,,None,None
100143,21/11/2023,C0002,Accessories,USB-C Cable,7.06,1,Paid,7.06,2023-11-21,False,0.0,,,None,None
101134,2023-12-14,C0002,Smart Home,NordLock Pro,"200,59 EUR",2,Paid,200.59,2023-12-14,False,0.0,,,None,None
101197,2023-11-24,C0065,Smart Home,NordPlug,32.73,1,Paid,32.73,2023-11-24,False,2.0,Return request | Refund for my purchase,"I want to get a refund for this product.
It is defective.
I need my money back.

Sent from my iPhone

My order #101197. | I want to return this product.
It is not working.
I need my money back.
Also: RMA.

<p>Thanks</p><p>Customer</p>

My order #101197.",Defect / Refund,Negative
100167,2023-11-22,C0001,Electronics,Tablet A,"499,07 EUR",1,Paid,499.07,2023-11-22,False,0.0,,,None,None
100162,2023-11-22,C0081,Electronics,TV Pro,1615.87,1,Paid,1615.87,2023-11-22,False,2.0,App cannot connect to WiFi | Delivery delay,"The app cannot connect to the lock.
I tried reinstalling the app but it fails.
Please advise.

—
Regards,
A very unhappy customer

Order number: 100162 | <p>My delivery is late.
Tracking shows in transit for days.
Please update me.
Also: where is my order.

—
Regards,
A very unhappy customer</p><br><p>This is unacceptable.</p>

My order #100162.",Connectivity,Negative
100643,2023-12-04,C0005,Smart Home,NordLock Pro,"244,97 EUR",1,Paid,244.97,2023-12-04,False,1.0,Return request,"I want to get a refund for this product.
It is not as described.
Please send return instructions.
Also: refund.

<p>Thanks</p><p>Customer</p>

My order #100643.",Defect / Refund,Negative
100137,20/11/2023,C0001,Electronics,NoiseCancel Headphones,260.84,2,Paid,260.84,2023-11-20,False,0.0,,,None,None
100878,09/12/2023,C0001,Accessories,Laptop Sleeve,"36,99 EUR",1,Paid,36.99,2023-12-09,False,0.0,,,None,None
100017,2023-11-15,C0003,Accessories,Charger,"26,91 EUR",1,Paid,26.91,2023-11-15,False,0.0,,,None,None
100114,2023-11-19,C0148,Electronics,Tablet A,"457,81 EUR",1,Paid,457.81,2023-11-19,False,1.0,Very disappointed,"The product is not working.
Very disappointed.
Please help.
Also: broken.

—
Regards,
A very unhappy customer

Ref: TX-100114",Connectivity,Negative
100008,15/11/2023,C0001,Accessories,Charger,36.45,3,Paid,36.45,2023-11-15,False,0.0,,,None,None
100196,2023-11-23,C0001,Electronics,Smartphone Z,"1016,16 EUR",1,Paid,1016.16,2023-11-23,False,0.0,,,None,None
100866,2023-12-09,C0102,Electronics,NoiseCancel Headphones,"233,49 EUR",1,Paid,233.49,2023-12-09,False,1.0,I want a refund,"I want to get a refund for this product.<br>It is not as described.<br>I need my money back.<br><br><p>Thanks</p><p>Customer</p>

My order #100866.",Defect / Refund,Negative
100174,2023-11-22,C0001,Smart Home,NordLock Pro,"215,47 EUR",1,Paid,215.47,2023-11-22,False,0.0,,,None,None
100447,2023-11-30,C0001,Accessories,Accessory Bundle,60,1,Paid,60.0,2023-11-30,False,0.0,,,None,None
100101,2023-11-19,C0001,Accessories,Accessory Bundle,"49,17 EUR",1,Paid,49.17,2023-11-19,False,0.0,,,None,None
101092,14/12/2023,C0244,Smart Home,NordTherm,"83,17 EUR",1,Paid,83.17,2023-12-14,False,0.0,,,None,None
100580,03/12/2023,C0092,Accessories,Screen Protector,"7,07 EUR",2,Paid,7.07,2023-12-03,False,0.0,,,None,None
100474,30/11/2023,C0002,Accessories,Charger,"17,37 EUR",2,Paid,17.37,2023-11-30,False,0.0,,,None,None
100205,2023-11-23,C0024,Electronics,Laptop X,1339.22,1,Paid,1339.22,2023-11-23,False,0.0,,,None,None
100581,2023-12-03,C0027,Electronics,NoiseCancel Headphones,"348,89 EUR",2,Paid,348.89,2023-12-03,False,0.0,,,None,None
100157,2023-11-21,C0027,Electronics,Smartphone Z,$787.19,2,Paid,787.19,2023-11-21,False,0.0,,,None,None
100894,10/12/2023,C0002,Smart Home,NordLock Pro,"221,02 EUR",1,Paid,221.02,2023-12-10,False,0.0,,,None,None
101040,2023-12-12,C0015,Smart Home,NordLock Pro,"195,56 EUR",1,Paid,195.56,2023-12-12,False,0.0,,,None,None
100486,2023-12-01,C0007,Smart Home,NordLock Pro,237,2,Paid,237.0,2023-12-01,False,0.0,,,None,None
100645,2023-12-04,C0076,Smart Home,NordLock Pro,200.03,1,Paid,200.03,2023-12-04,True,0.0,,,None,None
101140,04/12/2023,C0042,Smart Home,NordLock Pro,"223,67 EUR",2,Paid,223.67,2023-12-04,False,0.0,,,None,None
100712,2023-12-06,C0007,Accessories,Phone Case,"16,50 EUR",3,Paid,16.5,2023-12-06,False,0.0,,,None,None
100928,2023-12-10,C0002,Smart Home,NordCam Mini,59.35,1,Paid,59.35,2023-12-10,False,0.0,,,None,None
101006,2023-12-12,C0187,Electronics,Tablet A,661.51,1,Paid,661.51,2023-12-12,False,0.0,,,None,None
100004,2023-11-15,C0019,Accessories,Phone Case,36.72,1,Paid,36.72,2023-11-15,True,0.0,,,None,None
100378,28/11/2023,C0229,Accessories,Charger,16.51,1,Paid,16.51,2023-11-28,False,0.0,,,None,None
101021,2023-12-12,C0016,Smart Home,NordLock Pro,"182,28 EUR",1,Paid,182.28,2023-12-12,False,0.0,,,None,None
100359,2023-11-28,C0029,Electronics,TV Pro,1552.56,1,Paid,1552.56,2023-11-28,False,0.0,,,None,None
100429,29/11/2023,C0001,Accessories,Laptop Sleeve,26,1,Paid,26.0,2023-11-29,False,0.0,,,None,None
100277,2023-11-25,C0008,Electronics,NoiseCancel Headphones,$172.79,1,Paid,172.79,2023-11-25,False,0.0,,,None,None
100267,2023-11-25,C0182,Smart Home,NordLock Pro,220.58,1,Paid,220.58,2023-11-25,False,3.0,Delivery delay | NordLock Pro pairing issue | Locked out of my home,"<p>My delivery is stuck.
Tracking shows pending.
Where is my order?
Also: courier.

<p>Thanks</p><p>Customer</p></p><br><p>This is unacceptable.</p>

My order #100267. | The app cannot connect to the lock.<br>I tried reinstalling the app but it fails.<br>Is there a fix?<br><br>Sent from my Android device

My order #100267. | I am stuck outside — the lock will not unlock.
The app shows offline.
This is urgent.

—
Regards,
A very unhappy customer

Ref: TX-100267",Connectivity,Negative
100860,2023-12-09,C0009,Accessories,USB-C Cable,"7,49 EUR",1,Paid,7.49,2023-12-09,False,0.0,,,None,None
100943,11/12/2023,C0115,Accessories,Charger,15.61,1,Paid,15.61,2023-12-11,False,0.0,,,None,None
100230,24/11/2023,C0003,Smart Home,NordPlug,"30,79 EUR",1,Paid,30.79,2023-11-24,False,0.0,,,None,None
101038,12/12/2023,C0002,Electronics,Laptop X,"1674,10 EUR",1,Paid,1674.1,2023-12-12,False,0.0,,,None,None
100719,2023-12-06,C0007,Electronics,NoiseCancel Headphones,"224,64 EUR",1,Paid,224.64,2023-12-06,False,0.0,,,None,None
101009,2023-12-12,C0001,Electronics,NoiseCancel Headphones,"255,44 EUR",1,Pending,255.44,2023-12-12,False,0.0,,,None,None
100446,2023-11-30,C0026,Smart Home,NordLock Pro,"219,40 EUR",1,Paid,219.4,2023-11-30,False,1.0,NordLock Pro battery drains fast,"My NordLock Pro dies in 48 hours.
I changed batteries and it still dies.
I can't rely on this.

Sent from my Android device

My order #100446.",Battery Issue,Neutral
100761,2023-12-07,C0120,Accessories,Charger,"49,62 EUR",3,Paid,49.62,2023-12-07,False,0.0,,,None,None
100374,2023-11-28,C0001,Electronics,Tablet A,798.57,1,Paid,798.57,2023-11-28,True,0.0,,,None,None
100826,08/12/2023,C0001,Smart Home,NordLock Pro,$188.48,1,Paid,188.48,2023-12-08,False,0.0,,,None,None
100695,06/12/2023,C0260,Electronics,Laptop X,"1595,69 EUR",1,Paid,1595.69,2023-12-06,False,0.0,,,None,None
100870,2023-12-09,C0005,Smart Home,NordLock Pro,"180,98 EUR",1,Paid,180.98,2023-12-09,False,0.0,,,None,None
100117,19/11/2023,C0001,Electronics,Laptop X,1769.87,1,Pending,1769.87,2023-11-19,False,0.0,,,None,None
100223,2023-11-24,C0114,Accessories,Laptop Sleeve,$15.24,1,Paid,15.24,2023-11-24,False,1.0,Battery dies in 2 days,"My NordLock Pro dies in 48 hours.
I tried new batteries and it still dies.
I can't rely on this.

<br><br>--<br>NordTech Customer

My order #100223.",Battery Issue,Neutral
100459,2023-11-30,C0004,Accessories,Phone Case,13.42,1,Paid,13.42,2023-11-30,False,1.0,NordLock Pro pairing issue,"The app will not connect to WiFi.
I tried resetting but it fails.
It worked once and then stopped.
Also: app won't connect.

—
Regards,
A very unhappy customer

My order #100459.",Connectivity,Negative
100618,2023-12-04,C0218,Accessories,Wireless Mouse,24.87,2,Paid,24.87,2023-12-04,False,0.0,,,None,None
101193,2023-12-12,C0187,Electronics,Tablet A,661.51,1,Paid,661.51,2023-12-12,True,0.0,,,None,None
100201,2023-11-23,C0030,Accessories,Phone Case,"36,25 EUR",1,Paid,36.25,2023-11-23,False,0.0,,,None,None
100550,2023-12-02,C0016,Accessories,Wireless Mouse,40.97,1,Paid,40.97,2023-12-02,False,0.0,,,None,None
100654,2023-12-05,C0019,Electronics,Tablet A,466,1,Paid,466.0,2023-12-05,False,0.0,,,None,None
100947,11/12/2023,C0177,Electronics,Laptop X,"1 501,09 EUR",1,Paid,1501.09,2023-12-11,False,0.0,,,None,None
100343,27/11/2023,C0060,Accessories,USB-C Cable,20,4,Paid,20.0,2023-11-27,False,0.0,,,None,None
101083,13/12/2023,C0024,Accessories,USB-C Cable,7.31,2,Paid,7.31,2023-12-13,False,0.0,,,None,None
100632,2023-12-04,C0021,Electronics,Tablet A,331.45,1,Paid,331.45,2023-12-04,False,0.0,,,None,None
100006,2023-11-15,C0065,Electronics,Tablet A,"728,62 EUR",1,Paid,728.62,2023-11-15,False,0.0,,,None,None
100109,19/11/2023,C0001,Electronics,NoiseCancel Headphones,"174,17 EUR",1,Paid,174.17,2023-11-19,False,0.0,,,None,None
100502,01/12/2023,C0038,Accessories,Accessory Bundle,55.24,3,Paid,55.24,2023-12-01,False,0.0,,,None,None
100392,2023-11-28,C0026,Accessories,Charger,"28,59 EUR",1,Paid,28.59,2023-11-28,False,1.0,Product defective,"The product is not working.
This should not happen.
Please help.

Sent from my iPhone

My order #100392.",Connectivity,Neutral
100942,2023-12-11,C0018,Smart Home,NordLock Pro,"228,75 EUR",1,Paid,228.75,2023-12-11,True,0.0,,,None,None
100518,2023-12-02,C0003,Smart Home,NordTherm,$114.81,1,Paid,114.81,2023-12-02,False,0.0,,,None,None
100480,2023-11-30,C0001,Electronics,Laptop X,"1688,15 EUR",1,Paid,1688.15,2023-11-30,False,0.0,,,None,None
100800,08/12/2023,C0130,Electronics,NoiseCancel Headphones,"218,36 EUR",1,Paid,218.36,2023-12-08,False,0.0,,,None,None
100035,2023-11-16,C0103,Electronics,Laptop X,1462,1,Paid,1462.0,2023-11-16,False,0.0,,,None,None
100920,2023-12-10,C0013,Electronics,Smartphone Z,"1052,91 EUR",2,Paid,1052.91,2023-12-10,False,0.0,,,None,None
100009,15/11/2023,C0001,Electronics,NoiseCancel Headphones,"250,52 EUR",1,Paid,250.52,2023-11-15,False,0.0,,,None,None
100790,2023-12-07,C0041,Accessories,Laptop Sleeve,25,1,Paid,25.0,2023-12-07,False,1.0,Delivery delay,"<p>My delivery is delayed.
Tracking shows in transit for days.
Where is my order?

—
Regards,
A very unhappy customer</p>

My order #100790.",Connectivity,Negative
100527,2023-12-02,C0028,Smart Home,NordLock Pro,"219,22 EUR",1,Failed,219.22,2023-12-02,False,0.0,,,None,None
100232,24/11/2023,C0252,Smart Home,NordLock Pro,249,1,Paid,249.0,2023-11-24,False,0.0,,,None,None
100320,27/11/2023,C0001,Accessories,Laptop Sleeve,$41.30,2,Failed,41.3,2023-11-27,False,0.0,,,None,None
100441,2023-11-30,C0303,Accessories,Wireless Mouse,23,1,Paid,23.0,2023-11-30,False,0.0,,,None,None
100526,02/12/2023,C0010,Smart Home,NordLock Pro,196.94,1,Paid,196.94,2023-12-02,False,0.0,,,None,None
100625,2023-12-04,C0001,Accessories,Accessory Bundle,"75,73 EUR",1,Paid,75.73,2023-12-04,False,0.0,,,None,None
100611,2023-12-04,C0024,Accessories,Phone Case,"10,55 EUR",3,Paid,10.55,2023-12-04,False,0.0,,,None,None
100073,2023-11-18,C0001,Smart Home,NordLock Pro,"230,39 EUR",1,Paid,230.39,2023-11-18,False,0.0,,,None,None
100349,27/11/2023,C0044,Electronics,NoiseCancel Headphones,"157,01 EUR",2,Paid,157.01,2023-11-27,False,0.0,,,None,None
100973,2023-12-11,C0001,Smart Home,NordLock Pro,$186.97,1,Paid,186.97,2023-12-11,False,0.0,,,None,None
100095,18/11/2023,C0028,Accessories,Phone Case,"27,74 EUR",1,Paid,27.74,2023-11-18,False,0.0,,,None,None
100544,2023-12-02,C0001,Accessories,USB-C Cable,15.85,4,Paid,15.85,2023-12-02,False,0.0,,,None,None
101169,2023-11-30,C0001,Accessories,Wireless Mouse,49.02,1,Paid,49.02,2023-11-30,False,0.0,,,None,None
100210,23/11/2023,C0002,Electronics,Tablet A,367.82,1,Paid,367.82,2023-11-23,False,0.0,,,None,None
100176,2023-11-22,C0007,Electronics,NoiseCancel Headphones,$163.31,1,Failed,163.31,2023-11-22,False,0.0,,,None,None
100481,2023-11-30,C0003,Accessories,Laptop Sleeve,22,1,Paid,22.0,2023-11-30,False,0.0,,,None,None
100282,25/11/2023,C0035,Electronics,NoiseCancel Headphones,"176,84 EUR",1,Paid,176.84,2023-11-25,False,0.0,,,None,None
100107,2023-11-19,C0001,Accessories,Accessory Bundle,$62.22,1,Paid,62.22,2023-11-19,False,0.0,,,None,None
101005,2023-12-12,C0003,Accessories,Wireless Mouse,"53,67 EUR",1,Paid,53.67,2023-12-12,False,1.0,Locked out of my home,"<p>I am stuck outside — the lock will not unlock.
The app shows offline.
This is urgent.
Also: can't unlock.

—
Regards,
A very unhappy customer</p><br><p>ASAP</p>

My order #101005.",Connectivity,Negative
100834,2023-12-08,C0001,Accessories,Charger,"39,15 EUR",2,Paid,39.15,2023-12-08,False,0.0,,,None,None
100252,2023-11-24,C0312,Accessories,Charger,26,1,Paid,26.0,2023-11-24,False,2.0,Battery problem with my lock | App cannot connect to WiFi,"My NordLock Pro dies in 48 hours.<br>I changed batteries and it still dies.<br>I can't rely on this.<br><br>Sent from my iPhone

Order number: 100252 | <p>The app cannot connect to WiFi.
I tried pairing again but it fails.
Please advise.

Sent from my Android device</p>

Order number: 100252",Battery Issue,Neutral
101166,2023-11-17,C0003,Electronics,Tablet A,336.05,2,Paid,336.05,2023-11-17,False,0.0,,,None,None
100390,2023-11-28,C0002,Accessories,Charger,30.55,2,Paid,30.55,2023-11-28,False,0.0,,,None,None
100929,2023-12-10,C0083,Accessories,Phone Case,$22.44,1,Paid,22.44,2023-12-10,False,1.0,Tracking shows no updates,"<p>My delivery is late.
Tracking shows in transit for days.
Where is my order?
Also: tracking.

Sent from my Android device</p><br><p>ASAP</p>

Order number: 100929",Delivery,Negative
100939,2023-12-11,C0001,Accessories,USB-C Cable,$11.22,1,Paid,11.22,2023-12-11,False,0.0,,,None,None
100328,2023-11-27,C0001,Accessories,Phone Case,10.00,3,Paid,10.0,2023-11-27,False,0.0,,,None,None
100969,2023-12-11,C0006,Accessories,Screen Protector,$13.28,1,Paid,13.28,2023-12-11,False,1.0,NordLock Pro pairing issue,"<p>The app cannot connect to the lock.
I tried pairing again but it fails.
Please advise.
Also: pairing.

Sent from my Android device</p>

My order #100969.",Connectivity,Neutral
100013,15/11/2023,C0261,Accessories,Laptop Sleeve,$33.90,2,Paid,33.9,2023-11-15,False,0.0,,,None,None
101026,2023-12-12,C0001,Electronics,Smartphone Z,"829,05 EUR",1,Paid,829.05,2023-12-12,False,0.0,,,None,None
100669,05/12/2023,C0002,Smart Home,NordPlug,"31,30 EUR",2,Paid,31.3,2023-12-05,False,0.0,,,None,None
101074,13/12/2023,C0048,Smart Home,NordLock Pro,235.67,1,Paid,235.67,2023-12-13,False,0.0,,,None,None
100937,11/12/2023,C0076,Electronics,Smartphone Z,$889.83,1,Paid,889.83,2023-12-11,False,0.0,,,None,None
101076,2023-12-13,C0005,Smart Home,NordLock Pro,$187.08,1,Paid,187.08,2023-12-13,False,1.0,Locked out of my home,"I am stuck outside — the lock will not unlock.<br>The app shows offline.<br>This is urgent.<br><br>—<br>Regards,<br>A very unhappy customer

My order #101076.",Connectivity,Negative
100934,2023-12-11,C0002,Accessories,Charger,"38,56 EUR",1,Paid,38.56,2023-12-11,False,0.0,,,None,None
100989,12/12/2023,C0040,Smart Home,NordLock Pro,185.28,2,Paid,185.28,2023-12-12,False,0.0,,,None,None
100214,23/11/2023,C0002,Smart Home,NordLock Pro,$212.69,1,Paid,212.69,2023-11-23,False,0.0,,,None,None
100217,2023-11-23,C0001,Electronics,Smartphone Z,"706,71 EUR",2,Paid,706.71,2023-11-23,False,0.0,,,None,None
100917,2023-12-10,C0007,Electronics,TV Pro,$1563.41,1,Paid,1563.41,2023-12-10,False,0.0,,,None,None
100614,2023-12-04,C0002,Accessories,Wireless Mouse,"28,43 EUR",1,Paid,28.43,2023-12-04,False,0.0,,,None,None
100823,2023-12-08,C0001,Smart Home,NordLock Pro,"229,47 EUR",1,Paid,229.47,2023-12-08,False,0.0,,,None,None
100423,29/11/2023,C0021,Accessories,Screen Protector,14.89,2,Paid,14.89,2023-11-29,False,0.0,,,None,None
100999,2023-12-12,C0052,Smart Home,NordLock Pro,"207,41 EUR",1,Paid,207.41,2023-12-12,False,1.0,NordLock Pro battery drains fast,"<p>My smart lock dies in 2 days.
I changed batteries and it still dies.
I can't rely on this.

Sent from my iPhone</p>

My order #100999.",Battery Issue,Neutral
100568,2023-12-03,C0083,Smart Home,NordCam Mini,63.87,1,Paid,63.87,2023-12-03,False,1.0,Battery problem with my lock,"<p>My smart lock battery drains in a day.
I changed batteries and it still dies.
This is unacceptable.

Sent from my Android device</p><br><p>This is unacceptable.</p>

My order #100568.",Battery Issue,Negative
100422,29/11/2023,C0001,Electronics,Laptop X,1419.85,1,Paid,1419.85,2023-11-29,False,0.0,,,None,None
100069,2023-11-17,C0006,Accessories,Phone Case,34.42,2,Paid,34.42,2023-11-17,False,0.0,,,None,None
100554,2023-12-02,C0003,Accessories,Accessory Bundle,"84,79 EUR",4,Paid,84.79,2023-12-02,False,0.0,,,None,None
100086,18/11/2023,C0001,Electronics,TV Pro,"1344,25 EUR",1,Paid,1344.25,2023-11-18,False,0.0,,,None,None
100247,2023-11-24,C0005,Smart Home,NordLock Pro,229.97,1,Paid,229.97,2023-11-24,False,0.0,,,None,None
100467,30/11/2023,C0001,Electronics,Tablet A,"359,78 EUR",1,Paid,359.78,2023-11-30,False,0.0,,,None,None
100430,29/11/2023,C0099,Electronics,Smartphone Z,1003.81,2,Paid,1003.81,2023-11-29,False,0.0,,,None,None
100418,2023-11-29,C0002,Electronics,Smartphone Z,$741.10,1,Paid,741.1,2023-11-29,False,0.0,,,None,None
100413,2023-11-29,C0094,Electronics,NoiseCancel Headphones,245,1,Paid,245.0,2023-11-29,False,0.0,,,None,None
100647,2023-12-05,C0071,Electronics,Smartphone Z,"796,55 EUR",1,Paid,796.55,2023-12-05,False,0.0,,,None,None
100197,23/11/2023,C0001,Electronics,Tablet A,"308,88 EUR",1,Paid,308.88,2023-11-23,False,0.0,,,None,None
100226,2023-11-24,C0002,Electronics,TV Pro,1686.65,1,Paid,1686.65,2023-11-24,False,0.0,,,None,None
100729,06/12/2023,C0003,Accessories,Charger,$21.85,2,Paid,21.85,2023-12-06,False,0.0,,,None,None
100285,2023-11-25,C0020,Electronics,TV Pro,"1544,21 EUR",1,Paid,1544.21,2023-11-25,False,1.0,Product defective,"<p>The product is defective.
Poor quality.
Please help.

—
Regards,
A very unhappy customer</p>

My order #100285.",Connectivity,Negative
100660,2023-12-05,C0014,Smart Home,NordCam Mini,$89.26,2,Paid,89.26,2023-12-05,False,0.0,,,None,None
100879,09/12/2023,C0030,Smart Home,NordLock Pro,$202.78,1,Paid,202.78,2023-12-09,False,0.0,,,None,None
100112,2023-11-19,C0042,Smart Home,NordLock Pro,194,1,Paid,194.0,2023-11-19,False,0.0,,,None,None
100545,2023-12-02,C0032,Electronics,Laptop X,"1364,71 EUR",1,Paid,1364.71,2023-12-02,False,0.0,,,None,None
101123,2023-12-14,C0002,Electronics,TV Pro,1327,1,Pending,1327.0,2023-12-14,False,0.0,,,None,None
100993,2023-12-12,C0003,Electronics,Tablet A,654.25,1,Paid,654.25,2023-12-12,False,0.0,,,None,None
100685,05/12/2023,C0034,Electronics,TV Pro,"1683,74 EUR",1,Paid,1683.74,2023-12-05,False,0.0,,,None,None
100818,2023-12-08,C0033,Electronics,Smartphone Z,900.82,1,Paid,900.82,2023-12-08,False,2.0,NordLock Pro pairing issue | Refund for my purchase,"The app cannot connect to the lock.
I tried resetting but it fails.
Please advise.

<br><br>--<br>NordTech Customer

My order #100818. | <p>I want to return this product.
It is not working.
I need my money back.

—
Regards,
A very unhappy customer</p>

Order number: 100818",Connectivity,Negative
100381,2023-11-28,C0073,Electronics,Tablet A,"565,48 EUR",1,Paid,565.48,2023-11-28,False,1.0,Return request,"<p>I want to get a refund for this product.
It is not as described.
Please send return instructions.

<p>Thanks</p><p>Customer</p></p>

My order #100381.",Defect / Refund,Negative
100500,2023-12-01,C0002,Smart Home,NordLock Pro,214,1,Paid,214.0,2023-12-01,False,0.0,,,None,None
101042,13/12/2023,C0001,Smart Home,NordLock Pro,"245,35 EUR",1,Paid,245.35,2023-12-13,False,0.0,,,None,None
100926,2023-12-10,C0229,Smart Home,NordTherm,$126.44,1,Paid,126.44,2023-12-10,False,1.0,Battery problem with my lock,"My NordLock Pro battery drains in 2 days.<br>I changed batteries and it still dies.<br>This is unacceptable.<br><br><p>Thanks</p><p>Customer</p>

Order number: 100926",Battery Issue,Negative
100780,2023-12-07,C0003,Accessories,Laptop Sleeve,"36,14 EUR",2,Paid,36.14,2023-12-07,False,0.0,,,None,None
100291,2023-11-25,C0003,Electronics,Smartphone Z,1056.70,1,Paid,1056.7,2023-11-25,False,0.0,,,None,None
100389,2023-11-28,C0001,Smart Home,NordLock Pro,210.88,1,Paid,210.88,2023-11-28,False,0.0,,,None,None
100360,2023-11-28,C0001,Electronics,TV Pro,1020.44,1,Paid,1020.44,2023-11-28,False,0.0,,,None,None
100407,2023-11-29,C0001,Electronics,Laptop X,$1506.44,1,Paid,1506.44,2023-11-29,False,0.0,,,None,None
100365,2023-11-28,C0023,Electronics,TV Pro,"1015,17 EUR",1,Paid,1015.17,2023-11-28,True,0.0,,,None,None
100525,02/12/2023,C0001,Electronics,Smartphone Z,899,1,Paid,899.0,2023-12-02,False,0.0,,,None,None
100575,2023-12-03,C0203,Electronics,TV Pro,1308.91,1,Paid,1308.91,2023-12-03,False,1.0,Where is my order?,"<p>My delivery is late.
Tracking shows no updates.
This is taking too long.

Sent from my Android device</p>

Order number: 100575",Delivery,Neutral
100683,2023-12-05,C0187,Accessories,Accessory Bundle,"87,50 EUR",1,Pending,87.5,2023-12-05,False,0.0,,,None,None
101033,2023-12-12,C0002,Smart Home,NordLock Pro,208,2,Paid,208.0,2023-12-12,True,0.0,,,None,None
100694,2023-12-06,C0002,Electronics,Tablet A,"362,00 EUR",1,Paid,362.0,2023-12-06,False,0.0,,,None,None
100705,06/12/2023,C0083,Smart Home,NordLock Pro,$203.62,1,Paid,203.62,2023-12-06,False,0.0,,,None,None
100702,2023-12-06,C0149,Electronics,NoiseCancel Headphones,203,1,Paid,203.0,2023-12-06,False,0.0,,,None,None
100113,2023-11-19,C0003,Accessories,Laptop Sleeve,36.03,2,Paid,36.03,2023-11-19,False,0.0,,,None,None
100103,19/11/2023,C0005,Electronics,Tablet A,647.19,1,Paid,647.19,2023-11-19,False,0.0,,,None,None
100415,2023-11-29,C0015,Electronics,NoiseCancel Headphones,327.37,1,Pending,327.37,2023-11-29,False,0.0,,,None,None
100590,2023-12-03,C0003,Electronics,Laptop X,"1488,81 EUR",1,Paid,1488.81,2023-12-03,False,0.0,,,None,None
100191,2023-11-23,C0062,Electronics,Tablet A,"382,77 EUR",1,Paid,382.77,2023-11-23,False,0.0,,,None,None
101137,2023-12-14,C0014,Electronics,Laptop X,"1653,81 EUR",1,Paid,1653.81,2023-12-14,False,1.0,NordLock Pro battery drains fast,"<p>My NordLock Pro dies in a day.
I tried new batteries and it still drains quickly.
Please help ASAP.

—
Regards,
A very unhappy customer</p>

My order #101137.",Battery Issue,Negative
100957,2023-12-11,C0007,Accessories,Accessory Bundle,"44,45 EUR",1,Paid,44.45,2023-12-11,False,0.0,,,None,None
100741,2023-12-07,C0015,Electronics,NoiseCancel Headphones,$163.13,1,Paid,163.13,2023-12-07,False,0.0,,,None,None
100053,2023-11-17,C0003,Electronics,NoiseCancel Headphones,"266,47 EUR",1,Paid,266.47,2023-11-17,False,0.0,,,None,None
100029,16/11/2023,C0011,Accessories,Screen Protector,"8,60 EUR",1,Paid,8.6,2023-11-16,False,0.0,,,None,None
100066,2023-11-17,C0048,Electronics,Laptop X,1460,1,Paid,1460.0,2023-11-17,False,1.0,NordLock Pro pairing issue,"The app will not connect to the lock.<br>I tried reinstalling the app but it fails.<br>Is there a fix?<br>Also: connectivity.<br><br>Sent from my Android device

My order #100066.",Connectivity,Neutral
100875,2023-12-09,C0016,Electronics,Tablet A,"496,60 EUR",1,Paid,496.6,2023-12-09,False,0.0,,,None,None
100246,2023-11-24,C0017,Accessories,Phone Case,"34,84 EUR",1,Paid,34.84,2023-11-24,False,0.0,,,None,None
100803,2023-12-08,C0241,Electronics,Tablet A,474.94,1,Paid,474.94,2023-12-08,False,0.0,,,None,None
101078,13/12/2023,C0006,Accessories,Charger,"25,23 EUR",1,Paid,25.23,2023-12-13,False,0.0,,,None,None
101127,14/12/2023,C0001,Accessories,Phone Case,"24,22 EUR",3,Paid,24.22,2023-12-14,False,0.0,,,None,None
100844,2023-12-08,C0067,Electronics,TV Pro,1183.75,1,Paid,1183.75,2023-12-08,False,0.0,,,None,None
100595,2023-12-03,C0023,Electronics,NoiseCancel Headphones,$265.61,1,Paid,265.61,2023-12-03,False,0.0,,,None,None
100309,2023-11-26,C0002,Accessories,Wireless Mouse,"54,66 EUR",4,Paid,54.66,2023-11-26,False,0.0,,,None,None
100903,2023-12-10,C0001,Smart Home,NordLock Pro,228.51,1,Paid,228.51,2023-12-10,False,0.0,,,None,None
100387,28/11/2023,C0001,Accessories,Phone Case,"39,44 EUR",2,Paid,39.44,2023-11-28,False,0.0,,,None,None
100872,09/12/2023,C0003,Electronics,Tablet A,696,1,Paid,696.0,2023-12-09,False,0.0,,,None,None
100355,2023-11-28,C0001,Electronics,Smartphone Z,917.35,2,Paid,917.35,2023-11-28,False,0.0,,,None,None
101023,2023-12-12,C0001,Accessories,Charger,18.52,1,Paid,18.52,2023-12-12,False,0.0,,,None,None
100160,2023-11-21,C0001,Accessories,Screen Protector,13.38,1,Paid,13.38,2023-11-21,False,0.0,,,None,None
100187,2023-11-22,C0245,Accessories,USB-C Cable,"7,37 EUR",3,Paid,7.37,2023-11-22,False,0.0,,,None,None
100245,2023-11-24,C0041,Electronics,Laptop X,1469,1,Paid,1469.0,2023-11-24,False,0.0,,,None,None
101056,2023-12-13,C0009,Electronics,Laptop X,"1 727,39 EUR",1,Paid,1727.39,2023-12-13,False,0.0,,,None,None
100076,2023-11-18,C0007,Electronics,Laptop X,1388.82,1,Paid,1388.82,2023-11-18,False,0.0,,,None,None
100158,21/11/2023,C0228,Smart Home,NordCam Mini,93,1,Paid,93.0,2023-11-21,False,0.0,,,None,None
100127,20/11/2023,C0064,Accessories,Charger,"21,16 EUR",1,Paid,21.16,2023-11-20,False,0.0,,,None,None
100745,07/12/2023,C0004,Accessories,Screen Protector,10.85,2,Paid,10.85,2023-12-07,False,0.0,,,None,None
100724,06/12/2023,C0002,Electronics,NoiseCancel Headphones,"172,37 EUR",1,Paid,172.37,2023-12-06,False,0.0,,,None,None
100323,2023-11-27,C0006,Accessories,Charger,$34.90,1,Paid,34.9,2023-11-27,False,0.0,,,None,None
100874,2023-12-09,C0001,Electronics,Laptop X,"1451,05 EUR",1,Paid,1451.05,2023-12-09,False,0.0,,,None,None
101054,2023-12-13,C0114,Electronics,Laptop X,1363.58,1,Paid,1363.58,2023-12-13,False,0.0,,,None,None
100805,08/12/2023,C0060,Electronics,TV Pro,1323.10,1,Paid,1323.1,2023-12-08,False,0.0,,,None,None
100213,2023-11-23,C0135,Electronics,Tablet A,522.41,1,Paid,522.41,2023-11-23,False,1.0,Locked out of my home,"I am locked out — the lock will not unlock.<br>The app shows not responding.<br>This is urgent.<br>Also: door won't open.<br><br><p>Thanks</p><p>Customer</p>

Order number: 100213",Connectivity,Negative
100778,07/12/2023,C0001,Accessories,Laptop Sleeve,"27,03 EUR",2,Paid,27.03,2023-12-07,False,0.0,,,None,None
100104,2023-11-19,C0004,Electronics,Laptop X,1568.65,1,Paid,1568.65,2023-11-19,False,0.0,,,None,None
100754,2023-12-07,C0006,Accessories,Charger,"30,68 EUR",2,Paid,30.68,2023-12-07,False,1.0,Very disappointed,"The product is defective.
This should not happen.
Please help.
Also: broken.

Sent from my iPhone

Ref: TX-100754",Connectivity,Neutral
101110,2023-12-14,C0001,Electronics,Tablet A,386.48,1,Paid,386.48,2023-12-14,False,0.0,,,None,None
100960,2023-12-11,C0001,Electronics,TV Pro,$969.19,1,Paid,969.19,2023-12-11,False,0.0,,,None,None
100846,2023-12-09,C0054,Accessories,Laptop Sleeve,"41,46 EUR",3,Paid,41.46,2023-12-09,False,3.0,App cannot connect to WiFi | Not working as expected | I want a refund,"The app cannot connect to WiFi.
I tried resetting but it fails.
Please advise.

Sent from my Android device

Ref: TX-100846 | The product is broken.<br>This should not happen.<br>I want a replacement.<br><br>—<br>Regards,<br>A very unhappy customer

My order #100846. | <p>I want to return this product.
It is not working.
I need my money back.
Also: refund.

Sent from my iPhone</p>

My order #100846.",Connectivity,Negative
101194,14/12/2023,C0042,Electronics,TV Pro,1610.06,1,Paid,1610.06,2023-12-14,False,0.0,,,None,None
100521,02/12/2023,C0002,Smart Home,NordPlug,"16,97 EUR",1,Paid,16.97,2023-12-02,False,0.0,,,None,None
101136,2023-12-14,C0007,Electronics,Smartphone Z,"1070,71 EUR",2,Paid,1070.71,2023-12-14,False,0.0,,,None,None
100771,07/12/2023,C0030,Accessories,Laptop Sleeve,20.44,2,Paid,20.44,2023-12-07,False,0.0,,,None,None
100229,2023-11-24,C0002,Accessories,Phone Case,"10,91 EUR",2,Paid,10.91,2023-11-24,False,0.0,,,None,None
100750,2023-12-07,C0003,Smart Home,NordLock Pro,"190,45 EUR",2,Paid,190.45,2023-12-07,True,0.0,,,None,None
100274,25/11/2023,C0012,Electronics,Laptop X,"1 700,98 EUR",1,Paid,1700.98,2023-11-25,False,0.0,,,None,None
100876,2023-12-09,C0007,Accessories,USB-C Cable,16.85,3,Paid,16.85,2023-12-09,False,0.0,,,None,None
100183,22/11/2023,C0094,Smart Home,NordLock Pro,$221.01,1,Paid,221.01,2023-11-22,False,0.0,,,None,None
100975,11/12/2023,C0001,Smart Home,NordLock Pro,"187,04 EUR",1,Failed,187.04,2023-12-11,False,0.0,,,None,None
101016,2023-12-12,C0001,Electronics,TV Pro,1462.11,1,Paid,1462.11,2023-12-12,False,0.0,,,None,None
100198,2023-11-23,C0156,Electronics,NoiseCancel Headphones,"296,85 EUR",1,Paid,296.85,2023-11-23,False,0.0,,,None,None
100794,07/12/2023,C0038,Electronics,Tablet A,$588.66,1,Paid,588.66,2023-12-07,False,0.0,,,None,None
100670,2023-12-05,C0024,Electronics,NoiseCancel Headphones,250.75,1,Paid,250.75,2023-12-05,False,0.0,,,None,None
100463,2023-11-30,C0013,Accessories,USB-C Cable,"8,39 EUR",1,Paid,8.39,2023-11-30,False,0.0,,,None,None
100452,30/11/2023,C0072,Electronics,Smartphone Z,983.68,1,Paid,983.68,2023-11-30,False,0.0,,,None,None
100090,18/11/2023,C0003,Electronics,Smartphone Z,"717,75 EUR",1,Paid,717.75,2023-11-18,False,0.0,,,None,None
101139,27/11/2023,C0044,Electronics,NoiseCancel Headphones,"157,01 EUR",2,Paid,157.01,2023-11-27,False,0.0,,,None,None
101096,14/12/2023,C0086,Smart Home,NordCam Mini,"85,43 EUR",1,Paid,85.43,2023-12-14,False,0.0,,,None,None
100487,2023-12-01,C0240,Accessories,Accessory Bundle,"27,89 EUR",1,Paid,27.89,2023-12-01,True,1.0,Battery problem with my lock,"<p>My NordLock Pro dies in a day.
I tried new batteries and it still drains quickly.
This is unacceptable.
Also: dead battery.

Sent from my iPhone</p><br><p>This is unacceptable.</p>

My order #100487.",Battery Issue,Negative
100051,2023-11-17,C0006,Electronics,Tablet A,"740,00 EUR",1,Paid,740.0,2023-11-17,False,0.0,,,None,None
100700,2023-12-06,C0001,Electronics,Tablet A,549.96,1,Failed,549.96,2023-12-06,False,0.0,,,None,None
100854,2023-12-09,C0084,Accessories,Wireless Mouse,26,1,Paid,26.0,2023-12-09,False,1.0,NordLock Pro battery drains fast,"<p>My smart lock battery drains in 48 hours.
I tried new batteries and it still drains quickly.
Please help ASAP.

Sent from my Android device</p><br><p>This is unacceptable.</p>

My order #100854.",Battery Issue,Negative
100416,2023-11-29,C0125,Accessories,Laptop Sleeve,39.40,3,Paid,39.4,2023-11-29,False,0.0,,,None,None
100677,05/12/2023,C0207,Electronics,Smartphone Z,"735,52 EUR",1,Paid,735.52,2023-12-05,False,0.0,,,None,None
100367,28/11/2023,C0016,Electronics,Tablet A,"740,02 EUR",1,Paid,740.02,2023-11-28,False,0.0,,,None,None
100535,02/12/2023,C0001,Smart Home,NordLock Pro,"220,39 EUR",1,Paid,220.39,2023-12-02,False,0.0,,,None,None
100831,08/12/2023,C0042,Electronics,Laptop X,1620.72,1,Paid,1620.72,2023-12-08,False,0.0,,,None,None
100235,2023-11-24,C0002,Electronics,Tablet A,386.12,1,Paid,386.12,2023-11-24,False,0.0,,,None,None
100490,01/12/2023,C0001,Accessories,Laptop Sleeve,34.29,1,Paid,34.29,2023-12-01,False,0.0,,,None,None
100681,2023-12-05,C0002,Electronics,Laptop X,$1495.01,1,Paid,1495.01,2023-12-05,False,0.0,,,None,None
101007,2023-12-12,C0008,Electronics,Tablet A,"332,54 EUR",1,Paid,332.54,2023-12-12,False,0.0,,,None,None
100868,2023-12-09,C0002,Smart Home,NordLock Pro,187,2,Paid,187.0,2023-12-09,True,0.0,,,None,None
100582,2023-12-03,C0257,Electronics,Laptop X,1783.31,1,Failed,1783.31,2023-12-03,False,0.0,,,None,None
100402,2023-11-29,C0022,Electronics,Laptop X,1456.95,2,Paid,1456.95,2023-11-29,False,0.0,,,None,None
100699,06/12/2023,C0057,Accessories,Screen Protector,"6,05 EUR",1,Paid,6.05,2023-12-06,False,0.0,,,None,None
100738,07/12/2023,C0138,Accessories,Charger,"34,63 EUR",1,Paid,34.63,2023-12-07,False,0.0,,,None,None
100439,2023-11-30,C0001,Smart Home,NordLock Pro,"216,05 EUR",1,Paid,216.05,2023-11-30,False,0.0,,,None,None
100528,02/12/2023,C0239,Accessories,Wireless Mouse,"33,63 EUR",2,Paid,33.63,2023-12-02,False,0.0,,,None,None
100995,12/12/2023,C0041,Accessories,Accessory Bundle,"96,03 EUR",3,Paid,96.03,2023-12-12,False,0.0,,,None,None
100369,28/11/2023,C0006,Electronics,Laptop X,1403.95,1,Paid,1403.95,2023-11-28,False,0.0,,,None,None
100877,2023-12-09,C0002,Smart Home,NordLock Pro,"218,56 EUR",1,Paid,218.56,2023-12-09,False,0.0,,,None,None
100718,2023-12-06,C0109,Smart Home,NordLock Pro,$195.57,1,Failed,195.57,2023-12-06,False,0.0,,,None,None
100864,2023-12-09,C0001,Accessories,Laptop Sleeve,23,1,Paid,23.0,2023-12-09,False,0.0,,,None,None
100152,21/11/2023,C0056,Accessories,Laptop Sleeve,$19.03,1,Paid,19.03,2023-11-21,False,0.0,,,None,None
101171,06/12/2023,C0009,Smart Home,NordTherm,106.57,1,Failed,106.57,2023-12-06,False,0.0,,,None,None
100133,20/11/2023,C0001,Accessories,USB-C Cable,$18.72,3,Paid,18.72,2023-11-20,False,0.0,,,None,None
100739,2023-12-07,C0061,Electronics,Smartphone Z,$1073.23,1,Paid,1073.23,2023-12-07,False,0.0,,,None,None
100030,2023-11-16,C0027,Accessories,USB-C Cable,$7.17,2,Paid,7.17,2023-11-16,False,0.0,,,None,None
100640,2023-12-04,C0257,Smart Home,NordLock Pro,"224,35 EUR",1,Paid,224.35,2023-12-04,False,2.0,NordLock Pro battery drains fast | Refund for my purchase,"<p>My NordLock Pro battery drains in 48 hours.
I changed batteries and it still drains quickly.
Please help ASAP.
Also: 2 days.

Sent from my iPhone</p>

Ref: TX-100640 | <p>I want to return this product.
It is not working.
I need my money back.

<p>Thanks</p><p>Customer</p></p>

My order #100640.",Battery Issue,Negative
100941,11/12/2023,C0004,Accessories,USB-C Cable,16,1,Paid,16.0,2023-12-11,False,0.0,,,None,None
100239,2023-11-24,C0126,Accessories,USB-C Cable,"9,10 EUR",1,Paid,9.1,2023-11-24,False,4.0,NordLock Pro battery drains fast | Very disappointed | NordLock Pro battery drains fast | Tracking shows no updates,"<p>My NordLock Pro battery drains in 2 days.
I changed batteries and it still dies.
This is unacceptable.

<br><br>--<br>NordTech Customer</p><br><p>Please help!</p>

My order #100239. | The product is broken.
Poor quality.
What are my options?

<br><br>--<br>NordTech Customer

Order number: 100239 | My NordLock Pro battery drains in 2 days.<br>I changed batteries and it still drains quickly.<br>This is unacceptable.<br><br>—<br>Regards,<br>A very unhappy customer

Ref: TX-100239 | <p>My delivery is delayed.
Tracking shows no updates.
Please update me.

<p>Thanks</p><p>Customer</p></p>

My order #100239.",Battery Issue,Negative
100674,2023-12-05,C0002,Electronics,Laptop X,"1614,66 EUR",1,Paid,1614.66,2023-12-05,False,0.0,,,None,None
101170,2023-11-17,C0157,Electronics,Tablet A,479,1,Paid,479.0,2023-11-17,False,0.0,,,None,None
100774,2023-12-07,C0058,Smart Home,NordLock Pro,248.12,1,Paid,248.12,2023-12-07,False,3.0,NordLock Pro battery drains fast | App cannot connect to WiFi | Delivery delay,"My NordLock Pro dies in 2 days.
I tried new batteries and it still dies.
I can't rely on this.

Sent from my Android device

Order number: 100774 | The app cannot connect to WiFi.
I tried resetting but it fails.
Please advise.
Also: connectivity.

<p>Thanks</p><p>Customer</p>

My order #100774. | My delivery is delayed.
Tracking shows pending.
Where is my order?

<p>Thanks</p><p>Customer</p>

Ref: TX-100774",Battery Issue,Neutral
101010,2023-12-12,C0016,Accessories,Laptop Sleeve,15.70,3,Paid,15.7,2023-12-12,False,1.0,Battery problem with my lock,"My smart lock dies in 2 days.
I changed batteries and it still dies.
I can't rely on this.
Also: 2 days.

<br><br>--<br>NordTech Customer

Order number: 101010",Battery Issue,Neutral
100324,2023-11-27,C0002,Accessories,Screen Protector,12.57,4,Paid,12.57,2023-11-27,False,0.0,,,None,None
100629,04/12/2023,C0002,Smart Home,NordTherm,"117,11 EUR",1,Paid,117.11,2023-12-04,False,0.0,,,None,None
101144,2023-12-03,C0012,Accessories,Wireless Mouse,"51,21 EUR",1,Pending,51.21,2023-12-03,False,0.0,,,None,None
100855,2023-12-09,C0005,Electronics,NoiseCancel Headphones,190.71,1,Paid,190.71,2023-12-09,False,0.0,,,None,None
100770,07/12/2023,C0001,Accessories,Phone Case,27.76,1,Paid,27.76,2023-12-07,False,0.0,,,None,None
100746,2023-12-07,C0198,Smart Home,NordLock Pro,"235,60 EUR",1,Paid,235.6,2023-12-07,False,1.0,NordLock Pro battery drains fast,"My smart lock dies in a day.<br>I changed batteries and it still drains quickly.<br>I can't rely on this.<br><br><p>Thanks</p><p>Customer</p>

My order #100746.",Battery Issue,Neutral
101165,2023-12-11,C0002,Accessories,Charger,"38,56 EUR",1,Paid,38.56,2023-12-11,True,1.0,Delivery delay,"My delivery is late.
Tracking shows in transit for days.
This is taking too long.

—
Regards,
A very unhappy customer

My order #101165.",Connectivity,Negative
101138,2023-11-28,C0237,Smart Home,NordLock Pro,$208.61,2,Paid,208.61,2023-11-28,False,0.0,,,None,None
100380,28/11/2023,C0031,Electronics,TV Pro,$1095.55,1,Paid,1095.55,2023-11-28,False,0.0,,,None,None
100559,03/12/2023,C0001,Accessories,Wireless Mouse,35.34,3,Paid,35.34,2023-12-03,False,0.0,,,None,None
100516,2023-12-02,C0003,Accessories,Screen Protector,12,2,Paid,12.0,2023-12-02,False,0.0,,,None,None
100881,2023-12-09,C0267,Smart Home,NordLock Pro,"228,02 EUR",1,Paid,228.02,2023-12-09,False,2.0,NordLock Pro won't unlock | Delivery delay,"<p>I am stuck outside — the lock does not respond.
The app shows offline.
I need immediate assistance.

Sent from my Android device</p>

My order #100881. | My delivery is stuck.<br>Tracking shows pending.<br>Where is my order?<br>Also: courier.<br><br>—<br>Regards,<br>A very unhappy customer

My order #100881.",Connectivity,Negative
100952,11/12/2023,C0001,Accessories,USB-C Cable,$13.80,2,Paid,13.8,2023-12-11,False,0.0,,,None,None
101008,12/12/2023,C0004,Smart Home,NordLock Pro,242.09,1,Paid,242.09,2023-12-12,False,0.0,,,None,None
100748,2023-12-07,C0002,Accessories,Accessory Bundle,$84.53,1,Paid,84.53,2023-12-07,False,1.0,Can't connect the app,"<p>The app will not connect to WiFi.
I tried pairing again but it fails.
Is there a fix?

—
Regards,
A very unhappy customer</p><br><p>This is unacceptable.</p>

Order number: 100748",Connectivity,Negative
100031,16/11/2023,C0001,Accessories,Charger,"44,80 EUR",1,Failed,44.8,2023-11-16,False,0.0,,,None,None
100667,2023-12-05,C0001,Accessories,Laptop Sleeve,"26,60 EUR",1,Paid,26.6,2023-12-05,False,0.0,,,None,None
101186,2023-12-12,C0001,Accessories,USB-C Cable,13,3,Paid,13.0,2023-12-12,False,0.0,,,None,None
100351,2023-11-27,C0002,Electronics,Laptop X,$1494.48,1,Paid,1494.48,2023-11-27,False,0.0,,,None,None
101172,22/11/2023,C0094,Smart Home,NordLock Pro,$221.01,1,Paid,221.01,2023-11-22,False,0.0,,,None,None
101036,2023-12-12,C0035,Accessories,Laptop Sleeve,28,1,Paid,28.0,2023-12-12,False,0.0,,,None,None
100792,2023-12-07,C0003,Smart Home,NordLock Pro,$246.21,1,Paid,246.21,2023-12-07,False,0.0,,,None,None
100052,17/11/2023,C0003,Accessories,Screen Protector,12.69,1,Paid,12.69,2023-11-17,False,0.0,,,None,None
100508,2023-12-01,C0001,Smart Home,NordLock Pro,$225.99,2,Pending,225.99,2023-12-01,False,0.0,,,None,None
100037,2023-11-16,C0055,Smart Home,NordLock Pro,"222,22 EUR",1,Paid,222.22,2023-11-16,False,0.0,,,None,None
100610,2023-12-04,C0004,Smart Home,NordPlug,"32,97 EUR",2,Paid,32.97,2023-12-04,False,0.0,,,None,None
100079,18/11/2023,C0011,Accessories,Laptop Sleeve,44,1,Paid,44.0,2023-11-18,False,0.0,,,None,None
100014,2023-11-15,C0115,Accessories,Charger,19.07,1,Paid,19.07,2023-11-15,False,0.0,,,None,None
100676,2023-12-05,C0025,Electronics,NoiseCancel Headphones,247,1,Failed,247.0,2023-12-05,False,0.0,,,None,None
100059,2023-11-17,C0157,Electronics,Tablet A,479,1,Paid,479.0,2023-11-17,False,1.0,NordLock Pro battery drains fast,"<p>My NordLock Pro dies in 48 hours.
I tried new batteries and it still dies.
This is unacceptable.
Also: dead battery.

—
Regards,
A very unhappy customer</p><br><p>This is unacceptable.</p>

Order number: 100059",Battery Issue,Negative
100576,03/12/2023,C0023,Electronics,Smartphone Z,976.35,1,Paid,976.35,2023-12-03,False,0.0,,,None,None
100234,2023-11-24,C0003,Electronics,Tablet A,"525,74 EUR",1,Paid,525.74,2023-11-24,False,0.0,,,None,None
100744,2023-12-07,C0001,Smart Home,NordCam Mini,"58,18 EUR",1,Failed,58.18,2023-12-07,False,0.0,,,None,None
100479,2023-11-30,C0003,Accessories,Accessory Bundle,$92.28,1,Paid,92.28,2023-11-30,False,0.0,,,None,None
101000,12/12/2023,C0009,Smart Home,NordLock Pro,"191,58 EUR",1,Pending,191.58,2023-12-12,False,0.0,,,None,None
100194,2023-11-23,C0055,Electronics,TV Pro,"965,81 EUR",1,Pending,965.81,2023-11-23,False,0.0,,,None,None
100405,2023-11-29,C0204,Accessories,Phone Case,24,1,Paid,24.0,2023-11-29,False,0.0,,,None,None
100884,09/12/2023,C0009,Electronics,TV Pro,1041.39,1,Paid,1041.39,2023-12-09,False,0.0,,,None,None
100488,2023-12-01,C0003,Smart Home,NordTherm,"109,04 EUR",1,Paid,109.04,2023-12-01,False,0.0,,,None,None
100472,2023-11-30,C0009,Accessories,Phone Case,26,1,Paid,26.0,2023-11-30,False,0.0,,,None,None
100257,2023-11-24,C0013,Accessories,Accessory Bundle,40.65,3,Paid,40.65,2023-11-24,False,2.0,Delivery delay | NordLock Pro battery drains fast,"My delivery is stuck.
Tracking shows pending.
This is taking too long.

—
Regards,
A very unhappy customer

Ref: TX-100257 | <p>My NordLock Pro battery drains in a day.
I tried new batteries and it still dies.
Please help ASAP.

<p>Thanks</p><p>Customer</p></p><br><p>ASAP</p>

Ref: TX-100257",Battery Issue,Negative
100895,2023-12-10,C0014,Electronics,Laptop X,1779,1,Paid,1779.0,2023-12-10,False,0.0,,,None,None
101091,2023-12-14,C0001,Electronics,NoiseCancel Headphones,$158.87,1,Paid,158.87,2023-12-14,False,0.0,,,None,None
100139,21/11/2023,C0198,Electronics,Smartphone Z,798.87,1,Paid,798.87,2023-11-21,False,0.0,,,None,None
100492,01/12/2023,C0025,Electronics,TV Pro,1384.66,1,Paid,1384.66,2023-12-01,False,0.0,,,None,None
100579,2023-12-03,C0045,Accessories,Accessory Bundle,86.12,2,Paid,86.12,2023-12-03,False,0.0,,,None,None
100707,2023-12-06,C0029,Accessories,Wireless Mouse,41.44,1,Paid,41.44,2023-12-06,False,0.0,,,None,None
100207,2023-11-23,C0244,Electronics,Laptop X,"1 442,20 EUR",1,Paid,1442.2,2023-11-23,False,2.0,NordLock Pro pairing issue | Battery problem with my lock,"<p>The app cannot connect to the lock.
I tried resetting but it fails.
Please advise.
Also: wifi.

Sent from my Android device</p><br><p>ASAP</p>

Ref: TX-100207 | My smart lock dies in 2 days.<br>I changed batteries and it still dies.<br>I can't rely on this.<br><br><p>Thanks</p><p>Customer</p>

My order #100207.",Battery Issue,Negative
100849,09/12/2023,C0026,Accessories,Laptop Sleeve,"17,69 EUR",1,Paid,17.69,2023-12-09,False,0.0,,,None,None
101179,2023-11-22,C0245,Accessories,USB-C Cable,"7,37 EUR",3,Paid,7.37,2023-11-22,False,0.0,,,None,None
100001,15/11/2023,C0001,Accessories,Phone Case,$13.56,2,Paid,13.56,2023-11-15,False,0.0,,,None,None
100227,2023-11-24,C0015,Accessories,Screen Protector,"13,01 EUR",3,Paid,13.01,2023-11-24,False,0.0,,,None,None
100250,2023-11-24,C0057,Smart Home,NordLock Pro,203.53,1,Paid,203.53,2023-11-24,False,0.0,,,None,None
100890,2023-12-09,C0001,Smart Home,NordPlug,"31,47 EUR",1,Paid,31.47,2023-12-09,False,0.0,,,None,None
100706,2023-12-06,C0010,Smart Home,NordLock Pro,$181.27,1,Paid,181.27,2023-12-06,False,0.0,,,None,None
100980,11/12/2023,C0145,Accessories,Screen Protector,"5,13 EUR",4,Paid,5.13,2023-12-11,False,0.0,,,None,None
101030,12/12/2023,C0005,Electronics,Laptop X,"1456,47 EUR",1,Paid,1456.47,2023-12-12,False,0.0,,,None,None
100284,2023-11-25,C0001,Electronics,Tablet A,$671.18,1,Paid,671.18,2023-11-25,False,0.0,,,None,None
100314,2023-11-26,C0004,Smart Home,NordCam Mini,$87.73,1,Paid,87.73,2023-11-26,False,0.0,,,None,None
100597,2023-12-04,C0176,Accessories,Phone Case,36.31,1,Paid,36.31,2023-12-04,False,1.0,Very disappointed,"<p>The product is not working.
This should not happen.
I want a replacement.

Sent from my Android device</p>

My order #100597.",Connectivity,Neutral
100060,17/11/2023,C0048,Accessories,Phone Case,31.47,2,Paid,31.47,2023-11-17,False,0.0,,,None,None
100048,2023-11-17,C0068,Electronics,Laptop X,1571,1,Pending,1571.0,2023-11-17,False,0.0,,,None,None
101122,2023-12-14,C0082,Electronics,Smartphone Z,"700,68 EUR",1,Pending,700.68,2023-12-14,False,0.0,,,None,None
101080,13/12/2023,C0158,Accessories,Accessory Bundle,61.58,1,Paid,61.58,2023-12-13,False,0.0,,,None,None
100987,11/12/2023,C0028,Smart Home,NordLock Pro,188,1,Paid,188.0,2023-12-11,False,0.0,,,None,None
100970,2023-12-11,C0001,Electronics,NoiseCancel Headphones,164.02,1,Paid,164.02,2023-12-11,False,0.0,,,None,None
101157,2023-12-10,C0224,Accessories,Accessory Bundle,47.39,1,Paid,47.39,2023-12-10,False,1.0,Locked out of my home,"<p>I am locked out — the lock will not unlock.
The app shows not responding.
I need immediate assistance.
Also: can't unlock.

Sent from my Android device</p>

My order #101157.",Connectivity,Neutral
101145,2023-11-30,C0008,Electronics,Tablet A,$355.20,1,Paid,355.2,2023-11-30,False,0.0,,,None,None
100759,2023-12-07,C0004,Electronics,Smartphone Z,$1086.15,2,Paid,1086.15,2023-12-07,False,0.0,,,None,None
100979,11/12/2023,C0003,Accessories,Phone Case,13.89,1,Paid,13.89,2023-12-11,False,0.0,,,None,None
101113,14/12/2023,C0074,Electronics,Laptop X,"1 396,43 EUR",1,Paid,1396.43,2023-12-14,False,0.0,,,None,None
100313,2023-11-26,C0003,Electronics,Smartphone Z,955.30,1,Paid,955.3,2023-11-26,False,0.0,,,None,None
100092,18/11/2023,C0001,Electronics,TV Pro,$1264.20,1,Paid,1264.2,2023-11-18,False,0.0,,,None,None
100722,2023-12-06,C0007,Accessories,USB-C Cable,12.52,4,Paid,12.52,2023-12-06,False,0.0,,,None,None
100735,2023-12-06,C0001,Electronics,NoiseCancel Headphones,"206,95 EUR",1,Paid,206.95,2023-12-06,False,0.0,,,None,None
100812,2023-12-08,C0006,Electronics,Tablet A,$470.11,2,Paid,470.11,2023-12-08,True,0.0,,,None,None
100460,2023-11-30,C0002,Electronics,Smartphone Z,"1 062,04 EUR",1,Paid,1062.04,2023-11-30,False,0.0,,,None,None
101125,2023-12-14,C0023,Smart Home,NordLock Pro,226.29,1,Paid,226.29,2023-12-14,False,0.0,,,None,None
100850,2023-12-09,C0005,Accessories,Screen Protector,"6,80 EUR",2,Paid,6.8,2023-12-09,False,0.0,,,None,None
100384,2023-11-28,C0051,Electronics,Tablet A,770,1,Paid,770.0,2023-11-28,False,2.0,Return request | Where is my order?,"<p>I want to return this product.
It is not as described.
How do I start an RMA?

—
Regards,
A very unhappy customer</p>

Ref: TX-100384 | My delivery is stuck.
Tracking shows pending.
Please update me.

Sent from my iPhone

Order number: 100384",Connectivity,Negative
100018,2023-11-15,C0009,Accessories,Wireless Mouse,57.97,1,Paid,57.97,2023-11-15,False,0.0,,,None,None
100956,11/12/2023,C0014,Electronics,Tablet A,"743,70 EUR",1,Paid,743.7,2023-12-11,False,0.0,,,None,None
101077,2023-12-13,C0001,Accessories,Charger,46.12,2,Paid,46.12,2023-12-13,False,0.0,,,None,None
101067,13/12/2023,C0003,Accessories,Charger,$26.56,4,Paid,26.56,2023-12-13,False,0.0,,,None,None
100988,2023-12-11,C0001,Electronics,Smartphone Z,883,1,Paid,883.0,2023-12-11,False,0.0,,,None,None
101015,12/12/2023,C0001,Smart Home,NordLock Pro,$232.09,1,Paid,232.09,2023-12-12,False,0.0,,,None,None
101161,23/11/2023,C0063,Electronics,Smartphone Z,1077.99,1,Paid,1077.99,2023-11-23,False,0.0,,,None,None
101135,14/12/2023,C0004,Smart Home,NordCam Mini,"79,06 EUR",2,Pending,79.06,2023-12-14,False,0.0,,,None,None
100126,2023-11-20,C0023,Electronics,Tablet A,"511,14 EUR",1,Paid,511.14,2023-11-20,False,0.0,,,None,None
100512,2023-12-01,C0042,Electronics,TV Pro,1179,1,Paid,1179.0,2023-12-01,False,11.0,I want a refund | Very disappointed | Locked out of my home | Battery dies in 2 days | Where is my order? | Where is my order? | Delivery delay | Battery problem with my lock | Locked out of my home | App cannot connect to WiFi | I want a refund,"<p>I want to return this product.
It is not working.
I need my money back.

Sent from my Android device</p>

My order #100512. | <p>The product is broken.
Poor quality.
What are my options?

Sent from my Android device</p>

Ref: TX-100512 | I am locked out — the lock does not respond.<br>The app shows offline.<br>I can't get into my house.<br><br>Sent from my Android device

Order number: 100512 | My NordLock Pro dies in a day.
I changed batteries and it still dies.
This is unacceptable.

<br><br>--<br>NordTech Customer

Order number: 100512 | My delivery is late.<br>Tracking shows in transit for days.<br>Please update me.<br>Also: still not received.<br><br><br><br>--<br>NordTech Customer

My order #100512. | <p>My delivery is late.
Tracking shows no updates.
This is taking too long.
Also: still not received.

Sent from my Android device</p>

Ref: TX-100512 | <p>My delivery is late.
Tracking shows no updates.
Where is my order?

—
Regards,
A very unhappy customer</p>

Order number: 100512 | <p>My smart lock battery drains in a day.
I tried new batteries and it still drains quickly.
This is unacceptable.
Also: battery drains.

<br><br>--<br>NordTech Customer</p><br><p>Please help!</p>

Order number: 100512 | <p>I am stuck outside — the lock will not unlock.
The app shows offline.
I need immediate assistance.

—
Regards,
A very unhappy customer</p>

Ref: TX-100512 | The app cannot connect to the lock.<br>I tried pairing again but it fails.<br>Is there a fix?<br><br>—<br>Regards,<br>A very unhappy customer

Ref: TX-100512 | <p>I want to return this product.
It is not working.
I need my money back.

Sent from my Android device</p>

My order #100512.",Battery Issue,Negative
100077,2023-11-18,C0004,Accessories,Wireless Mouse,57.30,1,Paid,57.3,2023-11-18,False,0.0,,,None,None
100931,11/12/2023,C0049,Electronics,Tablet A,"554,07 EUR",1,Paid,554.07,2023-12-11,False,0.0,,,None,None
100142,21/11/2023,C0004,Electronics,Tablet A,"599,07 EUR",1,Paid,599.07,2023-11-21,False,0.0,,,None,None
100586,03/12/2023,C0001,Electronics,Smartphone Z,"860,95 EUR",1,Failed,860.95,2023-12-03,False,0.0,,,None,None
100819,2023-12-08,C0087,Smart Home,NordPlug,17.09,1,Paid,17.09,2023-12-08,False,0.0,,,None,None
101162,2023-11-20,C0271,Electronics,Laptop X,"1 394,09 EUR",1,Paid,1394.09,2023-11-20,False,0.0,,,None,None
100788,07/12/2023,C0151,Accessories,USB-C Cable,"8,71 EUR",2,Paid,8.71,2023-12-07,False,0.0,,,None,None
100556,2023-12-03,C0005,Electronics,Laptop X,1382.75,1,Paid,1382.75,2023-12-03,False,0.0,,,None,None
101057,2023-12-13,C0004,Smart Home,NordLock Pro,"223,76 EUR",1,Paid,223.76,2023-12-13,True,0.0,,,None,None
100016,2023-11-15,C0023,Electronics,TV Pro,"1449,46 EUR",1,Paid,1449.46,2023-11-15,False,0.0,,,None,None
100436,2023-11-30,C0001,Electronics,Smartphone Z,759.36,1,Failed,759.36,2023-11-30,False,0.0,,,None,None
100499,2023-12-01,C0068,Electronics,Tablet A,"461,35 EUR",1,Paid,461.35,2023-12-01,False,0.0,,,None,None
100620,04/12/2023,C0013,Accessories,Charger,$30.37,2,Pending,30.37,2023-12-04,False,0.0,,,None,None
100451,2023-11-30,C0001,Electronics,Laptop X,"1369,47 EUR",1,Failed,1369.47,2023-11-30,False,0.0,,,None,None
100767,2023-12-07,C0028,Accessories,Phone Case,"11,57 EUR",4,Paid,11.57,2023-12-07,False,2.0,Not working as expected | Locked out of my home,"The product is defective.<br>Poor quality.<br>I want a replacement.<br><br>Sent from my Android device

Ref: TX-100767 | <p>I am stuck outside — the lock will not unlock.
The app shows offline.
This is urgent.
Also: can't get in.

Sent from my Android device</p><br><p>Please help!</p>

Order number: 100767",Connectivity,Negative
100036,2023-11-16,C0063,Accessories,Laptop Sleeve,"26,31 EUR",1,Pending,26.31,2023-11-16,False,0.0,,,None,None
100948,2023-12-11,C0013,Electronics,Tablet A,635,1,Paid,635.0,2023-12-11,False,0.0,,,None,None
100982,2023-12-11,C0009,Electronics,Tablet A,646,1,Paid,646.0,2023-12-11,False,0.0,,,None,None
100242,2023-11-24,C0276,Smart Home,NordLock Pro,205.21,1,Paid,205.21,2023-11-24,False,0.0,,,None,None
100530,2023-12-02,C0005,Accessories,USB-C Cable,18.78,1,Paid,18.78,2023-12-02,False,0.0,,,None,None
100344,2023-11-27,C0013,Electronics,Tablet A,$691.81,1,Paid,691.81,2023-11-27,False,0.0,,,None,None
100887,09/12/2023,C0001,Accessories,USB-C Cable,14,1,Paid,14.0,2023-12-09,False,0.0,,,None,None
100507,2023-12-01,C0196,Electronics,Tablet A,"376,91 EUR",1,Paid,376.91,2023-12-01,False,0.0,,,None,None
101190,2023-11-27,C0001,Accessories,Phone Case,"12,21 EUR",2,Paid,12.21,2023-11-27,False,0.0,,,None,None
100216,2023-11-23,C0006,Smart Home,NordLock Pro,218.70,1,Paid,218.7,2023-11-23,False,0.0,,,None,None
100209,2023-11-23,C0007,Accessories,USB-C Cable,$13.23,1,Paid,13.23,2023-11-23,False,0.0,,,None,None
100946,2023-12-11,C0052,Accessories,USB-C Cable,16.38,1,Paid,16.38,2023-12-11,False,0.0,,,None,None
100065,2023-11-17,C0039,Accessories,Phone Case,$30.02,2,Paid,30.02,2023-11-17,False,0.0,,,None,None
100011,2023-11-15,C0002,Electronics,Laptop X,1491.63,1,Paid,1491.63,2023-11-15,False,0.0,,,None,None
100253,2023-11-24,C0294,Accessories,Wireless Mouse,"25,96 EUR",1,Paid,25.96,2023-11-24,False,0.0,,,None,None
100604,2023-12-04,C0001,Electronics,Tablet A,327.65,1,Paid,327.65,2023-12-04,False,0.0,,,None,None
100806,08/12/2023,C0001,Electronics,NoiseCancel Headphones,$333.30,1,Paid,333.3,2023-12-08,False,0.0,,,None,None
100315,2023-11-26,C0001,Smart Home,NordLock Pro,"247,46 EUR",1,Paid,247.46,2023-11-26,True,0.0,,,None,None
100519,02/12/2023,C0001,Accessories,USB-C Cable,"9,35 EUR",3,Paid,9.35,2023-12-02,False,0.0,,,None,None
100466,2023-11-30,C0002,Electronics,Smartphone Z,"916,13 EUR",1,Paid,916.13,2023-11-30,False,0.0,,,None,None
100932,2023-12-11,C0132,Accessories,USB-C Cable,"7,40 EUR",3,Paid,7.4,2023-12-11,False,0.0,,,None,None
100964,11/12/2023,C0003,Smart Home,NordLock Pro,227.48,1,Paid,227.48,2023-12-11,False,0.0,,,None,None
100843,08/12/2023,C0006,Accessories,Accessory Bundle,27.11,1,Paid,27.11,2023-12-08,False,0.0,,,None,None
100368,2023-11-28,C0029,Smart Home,NordLock Pro,"231,33 EUR",1,Paid,231.33,2023-11-28,False,0.0,,,None,None
100146,21/11/2023,C0001,Accessories,Screen Protector,"12,09 EUR",1,Paid,12.09,2023-11-21,False,0.0,,,None,None
100363,2023-11-28,C0020,Electronics,NoiseCancel Headphones,$263.87,1,Paid,263.87,2023-11-28,False,1.0,Tracking shows no updates,"My delivery is delayed.
Tracking shows in transit for days.
Please update me.
Also: courier.

—
Regards,
A very unhappy customer

Order number: 100363",Connectivity,Negative
100631,2023-12-04,C0002,Electronics,NoiseCancel Headphones,328,1,Paid,328.0,2023-12-04,False,0.0,,,None,None
100091,18/11/2023,C0001,Accessories,Laptop Sleeve,"16,45 EUR",3,Paid,16.45,2023-11-18,False,0.0,,,None,None
100322,2023-11-27,C0011,Electronics,Laptop X,$1704.39,1,Paid,1704.39,2023-11-27,False,0.0,,,None,None
100186,22/11/2023,C0041,Electronics,NoiseCancel Headphones,"191,23 EUR",1,Paid,191.23,2023-11-22,False,0.0,,,None,None
100925,2023-12-10,C0003,Accessories,Wireless Mouse,51.07,1,Pending,51.07,2023-12-10,False,0.0,,,None,None
100869,09/12/2023,C0056,Smart Home,NordLock Pro,"192,27 EUR",1,Paid,192.27,2023-12-09,False,0.0,,,None,None
100757,07/12/2023,C0047,Electronics,NoiseCancel Headphones,"229,65 EUR",2,Paid,229.65,2023-12-07,False,0.0,,,None,None
100120,19/11/2023,C0138,Electronics,Tablet A,"374,99 EUR",1,Paid,374.99,2023-11-19,False,0.0,,,None,None
101063,2023-12-13,C0037,Accessories,Charger,36,4,Paid,36.0,2023-12-13,False,0.0,,,None,None
100841,08/12/2023,C0016,Smart Home,NordLock Pro,224.32,1,Paid,224.32,2023-12-08,False,0.0,,,None,None
100494,01/12/2023,C0059,Accessories,Wireless Mouse,"46,58 EUR",1,Paid,46.58,2023-12-01,False,0.0,,,None,None
100444,2023-11-30,C0001,Accessories,Wireless Mouse,49.02,1,Paid,49.02,2023-11-30,False,0.0,,,None,None
100339,27/11/2023,C0002,Smart Home,NordTherm,142.29,2,Paid,142.29,2023-11-27,False,0.0,,,None,None
101109,2023-12-14,C0183,Smart Home,NordLock Pro,228.56,1,Paid,228.56,2023-12-14,True,1.0,Refund for my purchase,"I want to return this product.
It is not working.
Please send return instructions.
Also: return.

—
Regards,
A very unhappy customer

My order #101109.",Connectivity,Negative
100225,2023-11-24,C0240,Accessories,Screen Protector,14.17,2,Paid,14.17,2023-11-24,False,0.0,,,None,None
100020,2023-11-15,C0001,Electronics,Laptop X,$1645.89,1,Paid,1645.89,2023-11-15,False,0.0,,,None,None
101097,14/12/2023,C0276,Accessories,Phone Case,$22.51,1,Paid,22.51,2023-12-14,False,0.0,,,None,None
100419,29/11/2023,C0002,Electronics,Laptop X,"1724,19 EUR",1,Paid,1724.19,2023-11-29,False,0.0,,,None,None
101100,2023-12-14,C0007,Accessories,Charger,19.64,1,Paid,19.64,2023-12-14,False,0.0,,,None,None
100992,12/12/2023,C0001,Accessories,Wireless Mouse,50.82,1,Paid,50.82,2023-12-12,False,0.0,,,None,None
100386,28/11/2023,C0069,Smart Home,NordPlug,"21,62 EUR",1,Paid,21.62,2023-11-28,False,0.0,,,None,None
100930,2023-12-10,C0037,Accessories,Phone Case,"30,63 EUR",1,Paid,30.63,2023-12-10,False,0.0,,,None,None
100453,2023-11-30,C0005,Electronics,NoiseCancel Headphones,247.94,1,Paid,247.94,2023-11-30,False,1.0,Not working as expected,"The product is defective.
Very disappointed.
What are my options?

Sent from my iPhone

Order number: 100453",Connectivity,Negative
100265,2023-11-25,C0001,Electronics,Tablet A,662.20,1,Paid,662.2,2023-11-25,False,0.0,,,None,None
101065,2023-12-13,C0001,Smart Home,NordLock Pro,"237,74 EUR",1,Paid,237.74,2023-12-13,True,0.0,,,None,None
100161,21/11/2023,C0318,Electronics,Smartphone Z,$852.83,1,Paid,852.83,2023-11-21,False,0.0,,,None,None
100111,2023-11-19,C0188,Electronics,NoiseCancel Headphones,298,1,Paid,298.0,2023-11-19,False,0.0,,,None,None
100304,26/11/2023,C0008,Electronics,Laptop X,"1545,42 EUR",1,Paid,1545.42,2023-11-26,False,0.0,,,None,None
100049,17/11/2023,C0003,Accessories,Laptop Sleeve,$24.43,1,Paid,24.43,2023-11-17,False,0.0,,,None,None
100510,01/12/2023,C0001,Accessories,Laptop Sleeve,"30,16 EUR",2,Paid,30.16,2023-12-01,False,0.0,,,None,None
100019,2023-11-15,C0034,Smart Home,NordLock Pro,"181,24 EUR",2,Paid,181.24,2023-11-15,False,0.0,,,None,None
101068,2023-12-13,C0052,Electronics,Laptop X,"1467,19 EUR",1,Paid,1467.19,2023-12-13,False,1.0,NordLock Pro battery drains fast,"<p>My NordLock Pro battery drains in a day.
I changed batteries and it still dies.
I can't rely on this.
Also: battery drains.

<p>Thanks</p><p>Customer</p></p>

Order number: 101068",Battery Issue,Neutral
100935,11/12/2023,C0002,Accessories,USB-C Cable,$15.08,1,Paid,15.08,2023-12-11,False,0.0,,,None,None
101115,2023-12-14,C0307,Electronics,NoiseCancel Headphones,$222.14,1,Paid,222.14,2023-12-14,False,3.0,Battery problem with my lock | I want a refund | Product defective,"<p>My NordLock Pro dies in a day.
I changed batteries and it still dies.
This is unacceptable.

Sent from my iPhone</p><br><p>ASAP</p>

My order #101115. | I want to get a refund for this product.<br>It is defective.<br>How do I start an RMA?<br><br><p>Thanks</p><p>Customer</p>

Ref: TX-101115 | The product is broken.<br>Poor quality.<br>I want a replacement.<br><br>Sent from my iPhone

Ref: TX-101115",Battery Issue,Negative
100886,09/12/2023,C0016,Accessories,Screen Protector,$6.71,3,Paid,6.71,2023-12-09,False,0.0,,,None,None
100276,25/11/2023,C0098,Accessories,Wireless Mouse,"47,71 EUR",2,Paid,47.71,2023-11-25,False,0.0,,,None,None
100115,19/11/2023,C0005,Accessories,Screen Protector,9.78,3,Paid,9.78,2023-11-19,False,0.0,,,None,None
100728,2023-12-06,C0052,Smart Home,NordLock Pro,209.66,1,Paid,209.66,2023-12-06,False,1.0,Battery dies in 2 days,"My smart lock battery drains in 48 hours.
I tried new batteries and it still drains quickly.
This is unacceptable.

Sent from my Android device

My order #100728.",Battery Issue,Negative
101156,2023-11-24,C0002,Electronics,Tablet A,386.12,1,Paid,386.12,2023-11-24,False,0.0,,,None,None
100002,2023-11-15,C0002,Electronics,Tablet A,"488,25 EUR",1,Paid,488.25,2023-11-15,False,0.0,,,None,None
100228,2023-11-24,C0147,Electronics,Smartphone Z,1055.64,1,Paid,1055.64,2023-11-24,False,0.0,,,None,None
100134,20/11/2023,C0001,Electronics,Smartphone Z,"970,64 EUR",1,Pending,970.64,2023-11-20,False,0.0,,,None,None
100249,24/11/2023,C0060,Electronics,NoiseCancel Headphones,315.48,1,Paid,315.48,2023-11-24,False,0.0,,,None,None
100497,01/12/2023,C0224,Electronics,TV Pro,1627.15,1,Paid,1627.15,2023-12-01,False,0.0,,,None,None
100961,2023-12-11,C0003,Electronics,Smartphone Z,"832,85 EUR",1,Paid,832.85,2023-12-11,False,0.0,,,None,None
100336,2023-11-27,C0002,Accessories,Charger,22.85,4,Paid,22.85,2023-11-27,False,0.0,,,None,None
100440,30/11/2023,C0012,Accessories,USB-C Cable,$12.61,1,Paid,12.61,2023-11-30,False,0.0,,,None,None
101167,2023-12-11,C0001,Electronics,TV Pro,$969.19,1,Paid,969.19,2023-12-11,False,0.0,,,None,None
100813,2023-12-08,C0010,Electronics,NoiseCancel Headphones,$150.46,2,Paid,150.46,2023-12-08,False,4.0,Battery dies in 2 days | Return request | NordLock Pro won't unlock | Return request,"My smart lock battery drains in 2 days.
I changed batteries and it still dies.
Please help ASAP.

<p>Thanks</p><p>Customer</p>

Order number: 100813 | <p>I want to return this product.
It is defective.
I need my money back.
Also: return.

Sent from my iPhone</p><br><p>This is unacceptable.</p>

Ref: TX-100813 | <p>I am locked out — the lock will not unlock.
The app shows not responding.
This is urgent.

Sent from my iPhone</p><br><p>This is unacceptable.</p>

Ref: TX-100813 | <p>I want to return this product.
It is defective.
I need my money back.
Also: return.

Sent from my iPhone</p><br><p>This is unacceptable.</p>

Ref: TX-100813",Battery Issue,Negative
101052,13/12/2023,C0137,Accessories,Screen Protector,10.44,1,Paid,10.44,2023-12-13,False,0.0,,,None,None
100442,2023-11-30,C0001,Electronics,NoiseCancel Headphones,"153,00 EUR",2,Paid,153.0,2023-11-30,False,0.0,,,None,None
101163,07/12/2023,C0047,Electronics,Smartphone Z,712.48,1,Paid,712.48,2023-12-07,False,0.0,,,None,None
101114,14/12/2023,C0002,Accessories,Laptop Sleeve,32.82,1,Paid,32.82,2023-12-14,False,0.0,,,None,None
100839,08/12/2023,C0011,Accessories,Phone Case,"24,43 EUR",1,Paid,24.43,2023-12-08,False,0.0,,,None,None
101048,2023-12-13,C0014,Smart Home,NordLock Pro,183.01,1,Paid,183.01,2023-12-13,False,0.0,,,None,None
101104,2023-12-14,C0013,Accessories,Accessory Bundle,"83,54 EUR",1,Paid,83.54,2023-12-14,False,0.0,,,None,None
101150,12/12/2023,C0040,Smart Home,NordLock Pro,185.28,2,Paid,185.28,2023-12-12,False,0.0,,,None,None
100243,2023-11-24,C0026,Electronics,Laptop X,$1554.67,1,Paid,1554.67,2023-11-24,False,0.0,,,None,None
100684,2023-12-05,C0001,Electronics,Tablet A,587.10,1,Paid,587.1,2023-12-05,False,0.0,,,None,None
100658,2023-12-05,C0002,Electronics,NoiseCancel Headphones,"151,84 EUR",1,Paid,151.84,2023-12-05,False,0.0,,,None,None
100505,2023-12-01,C0007,Electronics,TV Pro,$1619.06,1,Paid,1619.06,2023-12-01,False,0.0,,,None,None
100409,2023-11-29,C0001,Smart Home,NordPlug,21,1,Paid,21.0,2023-11-29,False,0.0,,,None,None
101199,24/11/2023,C0001,Electronics,NoiseCancel Headphones,"182,17 EUR",2,Paid,182.17,2023-11-24,False,0.0,,,None,None
101106,2023-12-14,C0008,Electronics,Tablet A,"635,65 EUR",1,Paid,635.65,2023-12-14,False,0.0,,,None,None
101062,2023-12-13,C0019,Electronics,Smartphone Z,"799,82 EUR",1,Failed,799.82,2023-12-13,False,0.0,,,None,None
100141,2023-11-21,C0007,Accessories,Phone Case,$23.73,1,Paid,23.73,2023-11-21,False,0.0,,,None,None
100547,2023-12-02,C0038,Accessories,Charger,"24,90 EUR",2,Paid,24.9,2023-12-02,False,0.0,,,None,None
100901,10/12/2023,C0036,Accessories,Phone Case,"23,08 EUR",3,Paid,23.08,2023-12-10,False,0.0,,,None,None
100638,04/12/2023,C0005,Accessories,Phone Case,"19,42 EUR",1,Paid,19.42,2023-12-04,False,0.0,,,None,None
100689,2023-12-06,C0166,Electronics,Smartphone Z,$963.43,1,Paid,963.43,2023-12-06,False,1.0,Not working as expected,"The product is defective.
Poor quality.
What are my options?
Also: defective.

<br><br>--<br>NordTech Customer

Order number: 100689",Defect / Refund,Neutral
100622,04/12/2023,C0135,Accessories,Accessory Bundle,66.41,2,Paid,66.41,2023-12-04,False,0.0,,,None,None
100851,2023-12-09,C0022,Accessories,USB-C Cable,"15,85 EUR",3,Pending,15.85,2023-12-09,False,0.0,,,None,None
100584,2023-12-03,C0013,Electronics,Tablet A,"524,49 EUR",2,Paid,524.49,2023-12-03,False,0.0,,,None,None
100333,2023-11-27,C0165,Smart Home,NordTherm,83.95,1,Failed,83.95,2023-11-27,False,0.0,,,None,None
101116,2023-12-14,C0002,Accessories,Screen Protector,9.56,1,Paid,9.56,2023-12-14,True,0.0,,,None,None
101105,2023-12-14,C0218,Smart Home,NordLock Pro,$221.88,1,Paid,221.88,2023-12-14,False,3.0,App cannot connect to WiFi | Can't open the door | NordLock Pro pairing issue,"<p>The app cannot connect to WiFi.
I tried pairing again but it fails.
Please advise.

<p>Thanks</p><p>Customer</p></p>

Order number: 101105 | <p>I am stuck outside — the lock will not unlock.
The app shows not responding.
I can't get into my house.

<p>Thanks</p><p>Customer</p></p>

Ref: TX-101105 | The app cannot connect to WiFi.
I tried resetting but it fails.
It worked once and then stopped.

—
Regards,
A very unhappy customer

Ref: TX-101105",Connectivity,Negative
